/usr/share/lmod/lmod/init/sh: line 20: /usr/share/lmod/lmod/libexec//clearMT_cmd: No such file or directory
wandb: Currently logged in as: tha-santacruz (msc-nicola). Use `wandb login --relogin` to force relogin
wandb: Tracking run with wandb version 0.15.4
wandb: Run data is saved locally in /home/santacro/masters_thesis/all_runs/wandb/run-20230627_032655-rsplkthm
wandb: Run `wandb offline` to turn off syncing.
wandb: Syncing run floral-glitter-218
wandb: ⭐️ View project at https://wandb.ai/msc-nicola/train_all_MLC
wandb: 🚀 View run at https://wandb.ai/msc-nicola/train_all_MLC/runs/rsplkthm
Running job on GPU : Tesla V100-PCIE-32GB
Namespace(BATCH_SIZE=128, CHECKPOINTS_PATH='/scratch/izar/santacro/checkpoints/', DATASET_PATH='/scratch/izar/santacro/final_data/', DEVICE='cuda:0', EMBEDDING='doc2vec', EPOCH_NUM=300, FRACTION=40, HIDDEN_SIZE=8192, JOB_ID=218, LEARNING_RATE=1e-05, LEVEL='L1', LOAD_CHECKPOINT='no', MERGE_METHOD='fusion', MIN_LEARNING_RATE=1e-06, NUM_WORKERS=8, RANDOM_STATE=5, RUN_MODE='train', SAVE_CHECKPOINTS='yes', SPLITTING='species', TARGET_BASE='set', WANDB_ENTITY='msc-nicola', WANDB_LOGS='yes', WANDB_PROJECT='all_MLC')
Number of train samples : 9888
Number of val samples : 1003
Number of test samples : 10799
  0%|          | 0/300 [00:00<?, ?it/s]train/val metrics at epoch 1 | loss : 1.15/1.00 | micro_F1 : 0.24/0.22:   0%|          | 0/300 [00:02<?, ?it/s]train/val metrics at epoch 1 | loss : 1.15/1.00 | micro_F1 : 0.24/0.22:   0%|          | 1/300 [00:03<16:02,  3.22s/it]train/val metrics at epoch 2 | loss : 1.08/0.95 | micro_F1 : 0.30/0.28:   0%|          | 1/300 [00:05<16:02,  3.22s/it]train/val metrics at epoch 2 | loss : 1.08/0.95 | micro_F1 : 0.30/0.28:   1%|          | 2/300 [00:05<14:13,  2.86s/it]train/val metrics at epoch 3 | loss : 1.03/0.92 | micro_F1 : 0.35/0.33:   1%|          | 2/300 [00:08<14:13,  2.86s/it]train/val metrics at epoch 3 | loss : 1.03/0.92 | micro_F1 : 0.35/0.33:   1%|          | 3/300 [00:08<13:35,  2.75s/it]train/val metrics at epoch 4 | loss : 0.99/0.90 | micro_F1 : 0.38/0.35:   1%|          | 3/300 [00:10<13:35,  2.75s/it]train/val metrics at epoch 4 | loss : 0.99/0.90 | micro_F1 : 0.38/0.35:   1%|▏         | 4/300 [00:11<13:15,  2.69s/it]train/val metrics at epoch 5 | loss : 0.96/0.88 | micro_F1 : 0.40/0.37:   1%|▏         | 4/300 [00:13<13:15,  2.69s/it]train/val metrics at epoch 5 | loss : 0.96/0.88 | micro_F1 : 0.40/0.37:   2%|▏         | 5/300 [00:13<13:07,  2.67s/it]train/val metrics at epoch 6 | loss : 0.93/0.87 | micro_F1 : 0.41/0.37:   2%|▏         | 5/300 [00:16<13:07,  2.67s/it]train/val metrics at epoch 6 | loss : 0.93/0.87 | micro_F1 : 0.41/0.37:   2%|▏         | 6/300 [00:16<12:54,  2.63s/it]train/val metrics at epoch 7 | loss : 0.89/0.85 | micro_F1 : 0.42/0.38:   2%|▏         | 6/300 [00:18<12:54,  2.63s/it]train/val metrics at epoch 7 | loss : 0.89/0.85 | micro_F1 : 0.42/0.38:   2%|▏         | 7/300 [00:18<12:46,  2.62s/it]train/val metrics at epoch 8 | loss : 0.87/0.85 | micro_F1 : 0.43/0.38:   2%|▏         | 7/300 [00:21<12:46,  2.62s/it]train/val metrics at epoch 8 | loss : 0.87/0.85 | micro_F1 : 0.43/0.38:   3%|▎         | 8/300 [00:21<12:39,  2.60s/it]train/val metrics at epoch 9 | loss : 0.84/0.84 | micro_F1 : 0.44/0.39:   3%|▎         | 8/300 [00:23<12:39,  2.60s/it]train/val metrics at epoch 9 | loss : 0.84/0.84 | micro_F1 : 0.44/0.39:   3%|▎         | 9/300 [00:23<12:36,  2.60s/it]train/val metrics at epoch 10 | loss : 0.81/0.84 | micro_F1 : 0.45/0.39:   3%|▎         | 9/300 [00:26<12:36,  2.60s/it]train/val metrics at epoch 10 | loss : 0.81/0.84 | micro_F1 : 0.45/0.39:   3%|▎         | 10/300 [00:26<12:31,  2.59s/it]train/val metrics at epoch 11 | loss : 0.78/0.84 | micro_F1 : 0.46/0.40:   3%|▎         | 10/300 [00:28<12:31,  2.59s/it]train/val metrics at epoch 11 | loss : 0.78/0.84 | micro_F1 : 0.46/0.40:   4%|▎         | 11/300 [00:29<12:24,  2.58s/it]train/val metrics at epoch 12 | loss : 0.76/0.84 | micro_F1 : 0.47/0.40:   4%|▎         | 11/300 [00:31<12:24,  2.58s/it]train/val metrics at epoch 12 | loss : 0.76/0.84 | micro_F1 : 0.47/0.40:   4%|▍         | 12/300 [00:31<12:20,  2.57s/it]train/val metrics at epoch 13 | loss : 0.73/0.84 | micro_F1 : 0.48/0.40:   4%|▍         | 12/300 [00:34<12:20,  2.57s/it]train/val metrics at epoch 13 | loss : 0.73/0.84 | micro_F1 : 0.48/0.40:   4%|▍         | 13/300 [00:34<12:20,  2.58s/it]train/val metrics at epoch 14 | loss : 0.71/0.84 | micro_F1 : 0.49/0.41:   4%|▍         | 13/300 [00:36<12:20,  2.58s/it]train/val metrics at epoch 14 | loss : 0.71/0.84 | micro_F1 : 0.49/0.41:   5%|▍         | 14/300 [00:36<12:16,  2.57s/it]train/val metrics at epoch 15 | loss : 0.69/0.85 | micro_F1 : 0.50/0.42:   5%|▍         | 14/300 [00:39<12:16,  2.57s/it]train/val metrics at epoch 15 | loss : 0.69/0.85 | micro_F1 : 0.50/0.42:   5%|▌         | 15/300 [00:39<12:08,  2.56s/it]train/val metrics at epoch 16 | loss : 0.68/0.85 | micro_F1 : 0.50/0.41:   5%|▌         | 15/300 [00:41<12:08,  2.56s/it]train/val metrics at epoch 16 | loss : 0.68/0.85 | micro_F1 : 0.50/0.41:   5%|▌         | 16/300 [00:41<12:03,  2.55s/it]train/val metrics at epoch 17 | loss : 0.67/0.85 | micro_F1 : 0.51/0.41:   5%|▌         | 16/300 [00:44<12:03,  2.55s/it]train/val metrics at epoch 17 | loss : 0.67/0.85 | micro_F1 : 0.51/0.41:   6%|▌         | 17/300 [00:44<11:59,  2.54s/it]train/val metrics at epoch 18 | loss : 0.66/0.85 | micro_F1 : 0.51/0.41:   6%|▌         | 17/300 [00:46<11:59,  2.54s/it]train/val metrics at epoch 18 | loss : 0.66/0.85 | micro_F1 : 0.51/0.41:   6%|▌         | 18/300 [00:46<12:01,  2.56s/it]train/val metrics at epoch 19 | loss : 0.65/0.86 | micro_F1 : 0.52/0.42:   6%|▌         | 18/300 [00:49<12:01,  2.56s/it]train/val metrics at epoch 19 | loss : 0.65/0.86 | micro_F1 : 0.52/0.42:   6%|▋         | 19/300 [00:49<11:59,  2.56s/it]train/val metrics at epoch 20 | loss : 0.65/0.86 | micro_F1 : 0.52/0.41:   6%|▋         | 19/300 [00:51<11:59,  2.56s/it]train/val metrics at epoch 20 | loss : 0.65/0.86 | micro_F1 : 0.52/0.41:   7%|▋         | 20/300 [00:52<12:03,  2.59s/it]train/val metrics at epoch 21 | loss : 0.64/0.86 | micro_F1 : 0.52/0.41:   7%|▋         | 20/300 [00:54<12:03,  2.59s/it]train/val metrics at epoch 21 | loss : 0.64/0.86 | micro_F1 : 0.52/0.41:   7%|▋         | 20/300 [00:55<12:54,  2.77s/it]
wandb: Waiting for W&B process to finish... (success).
wandb: 
wandb: Run history:
wandb:          epoch ▁
wandb:  learning rate ▁
wandb:           time ▁
wandb:     train loss ▁
wandb: train macro F1 ▁
wandb: train micro F1 ▁
wandb:       val loss ▁
wandb:   val macro F1 ▁
wandb:   val micro F1 ▁
wandb: 
wandb: Run summary:
wandb:          epoch 21
wandb:  learning rate 0.0
wandb:           time 56.89869
wandb:     train loss 0.64072
wandb: train macro F1 0.46974
wandb: train micro F1 0.52107
wandb:       val loss 0.85989
wandb:   val macro F1 0.25276
wandb:   val micro F1 0.41069
wandb: 
wandb: 🚀 View run floral-glitter-218 at: https://wandb.ai/msc-nicola/train_all_MLC/runs/rsplkthm
wandb: Synced 5 W&B file(s), 1 media file(s), 1 artifact file(s) and 0 other file(s)
wandb: Find logs at: ./wandb/run-20230627_032655-rsplkthm/logs
wandb: Currently logged in as: tha-santacruz (msc-nicola). Use `wandb login --relogin` to force relogin
wandb: Tracking run with wandb version 0.15.4
wandb: Run data is saved locally in /home/santacro/masters_thesis/all_runs/wandb/run-20230627_032821-xhqgty10
wandb: Run `wandb offline` to turn off syncing.
wandb: Syncing run distinctive-pine-215
wandb: ⭐️ View project at https://wandb.ai/msc-nicola/test_all_MLC
wandb: 🚀 View run at https://wandb.ai/msc-nicola/test_all_MLC/runs/xhqgty10
Running job on GPU : Tesla V100-PCIE-32GB
Namespace(BATCH_SIZE=128, CHECKPOINTS_PATH='/scratch/izar/santacro/checkpoints/', DATASET_PATH='/scratch/izar/santacro/final_data/', DEVICE='cuda:0', EMBEDDING='doc2vec', EPOCH_NUM=300, FRACTION=40, HIDDEN_SIZE=8192, JOB_ID=218, LEARNING_RATE=1e-05, LEVEL='L1', LOAD_CHECKPOINT='yes', MERGE_METHOD='fusion', MIN_LEARNING_RATE=1e-06, NUM_WORKERS=8, RANDOM_STATE=5, RUN_MODE='test', SAVE_CHECKPOINTS='yes', SPLITTING='species', TARGET_BASE='set', WANDB_ENTITY='msc-nicola', WANDB_LOGS='yes', WANDB_PROJECT='all_MLC')
Number of train samples : 9888
Number of val samples : 1003
Number of test samples : 10799
Loaded model state dict from file /scratch/izar/santacro/checkpoints//5_doc2vec_embedding_L1_level_fusion_merging_species_splitting_8192.pth
wandb: Waiting for W&B process to finish... (success).
wandb: - 0.154 MB of 0.190 MB uploaded (0.000 MB deduped)wandb: \ 0.007 MB of 0.190 MB uploaded (0.000 MB deduped)wandb: | 0.195 MB of 0.195 MB uploaded (0.000 MB deduped)wandb: 
wandb: Run history:
wandb:     test loss ▁
wandb: test macro F1 ▁
wandb:  test macro H ▁
wandb: test micro F1 ▁
wandb: 
wandb: Run summary:
wandb:     test loss 1.1921
wandb: test macro F1 0.30391
wandb:  test macro H 1.67877
wandb: test micro F1 0.38569
wandb: 
wandb: 🚀 View run distinctive-pine-215 at: https://wandb.ai/msc-nicola/test_all_MLC/runs/xhqgty10
wandb: Synced 4 W&B file(s), 10 media file(s), 1 artifact file(s) and 0 other file(s)
wandb: Find logs at: ./wandb/run-20230627_032821-xhqgty10/logs
