/usr/share/lmod/lmod/init/sh: line 20: /usr/share/lmod/lmod/libexec//clearMT_cmd: No such file or directory
wandb: Currently logged in as: tha-santacruz (msc-nicola). Use `wandb login --relogin` to force relogin
wandb: Tracking run with wandb version 0.15.4
wandb: Run data is saved locally in /home/santacro/masters_thesis/all_runs/wandb/run-20230627_031654-4pzymoca
wandb: Run `wandb offline` to turn off syncing.
wandb: Syncing run fine-pine-175
wandb: ⭐️ View project at https://wandb.ai/msc-nicola/train_all_MLC
wandb: 🚀 View run at https://wandb.ai/msc-nicola/train_all_MLC/runs/4pzymoca
Running job on GPU : Tesla V100-PCIE-32GB
Namespace(BATCH_SIZE=128, CHECKPOINTS_PATH='/scratch/izar/santacro/checkpoints/', DATASET_PATH='/scratch/izar/santacro/final_data/', DEVICE='cuda:0', EMBEDDING='doc2vec', EPOCH_NUM=300, FRACTION=40, HIDDEN_SIZE=8192, JOB_ID=175, LEARNING_RATE=1e-05, LEVEL='L2', LOAD_CHECKPOINT='no', MERGE_METHOD='fusion', MIN_LEARNING_RATE=1e-06, NUM_WORKERS=8, RANDOM_STATE=4, RUN_MODE='train', SAVE_CHECKPOINTS='yes', SPLITTING='species', TARGET_BASE='set', WANDB_ENTITY='msc-nicola', WANDB_LOGS='yes', WANDB_PROJECT='all_MLC')
Number of train samples : 8444
Number of val samples : 826
Number of test samples : 10070
  0%|          | 0/300 [00:00<?, ?it/s]train/val metrics at epoch 1 | loss : 1.31/1.08 | micro_F1 : 0.10/0.09:   0%|          | 0/300 [00:02<?, ?it/s]train/val metrics at epoch 1 | loss : 1.31/1.08 | micro_F1 : 0.10/0.09:   0%|          | 1/300 [00:03<15:05,  3.03s/it]train/val metrics at epoch 2 | loss : 1.23/1.07 | micro_F1 : 0.11/0.10:   0%|          | 1/300 [00:05<15:05,  3.03s/it]train/val metrics at epoch 2 | loss : 1.23/1.07 | micro_F1 : 0.11/0.10:   1%|          | 2/300 [00:05<13:12,  2.66s/it]train/val metrics at epoch 3 | loss : 1.18/1.04 | micro_F1 : 0.12/0.10:   1%|          | 2/300 [00:07<13:12,  2.66s/it]train/val metrics at epoch 3 | loss : 1.18/1.04 | micro_F1 : 0.12/0.10:   1%|          | 3/300 [00:07<12:28,  2.52s/it]train/val metrics at epoch 4 | loss : 1.14/1.03 | micro_F1 : 0.13/0.11:   1%|          | 3/300 [00:09<12:28,  2.52s/it]train/val metrics at epoch 4 | loss : 1.14/1.03 | micro_F1 : 0.13/0.11:   1%|▏         | 4/300 [00:10<11:58,  2.43s/it]train/val metrics at epoch 5 | loss : 1.10/1.00 | micro_F1 : 0.15/0.12:   1%|▏         | 4/300 [00:12<11:58,  2.43s/it]train/val metrics at epoch 5 | loss : 1.10/1.00 | micro_F1 : 0.15/0.12:   2%|▏         | 5/300 [00:12<11:44,  2.39s/it]train/val metrics at epoch 6 | loss : 1.06/1.03 | micro_F1 : 0.16/0.13:   2%|▏         | 5/300 [00:14<11:44,  2.39s/it]train/val metrics at epoch 6 | loss : 1.06/1.03 | micro_F1 : 0.16/0.13:   2%|▏         | 6/300 [00:14<11:37,  2.37s/it]train/val metrics at epoch 7 | loss : 1.03/0.96 | micro_F1 : 0.17/0.14:   2%|▏         | 6/300 [00:16<11:37,  2.37s/it]train/val metrics at epoch 7 | loss : 1.03/0.96 | micro_F1 : 0.17/0.14:   2%|▏         | 7/300 [00:17<11:29,  2.35s/it]train/val metrics at epoch 8 | loss : 0.99/0.93 | micro_F1 : 0.18/0.15:   2%|▏         | 7/300 [00:19<11:29,  2.35s/it]train/val metrics at epoch 8 | loss : 0.99/0.93 | micro_F1 : 0.18/0.15:   3%|▎         | 8/300 [00:19<11:23,  2.34s/it]train/val metrics at epoch 9 | loss : 0.96/0.92 | micro_F1 : 0.20/0.16:   3%|▎         | 8/300 [00:21<11:23,  2.34s/it]train/val metrics at epoch 9 | loss : 0.96/0.92 | micro_F1 : 0.20/0.16:   3%|▎         | 9/300 [00:21<11:22,  2.34s/it]train/val metrics at epoch 10 | loss : 0.93/0.91 | micro_F1 : 0.20/0.16:   3%|▎         | 9/300 [00:23<11:22,  2.34s/it]train/val metrics at epoch 10 | loss : 0.93/0.91 | micro_F1 : 0.20/0.16:   3%|▎         | 10/300 [00:23<11:13,  2.32s/it]train/val metrics at epoch 11 | loss : 0.91/0.90 | micro_F1 : 0.21/0.17:   3%|▎         | 10/300 [00:26<11:13,  2.32s/it]train/val metrics at epoch 11 | loss : 0.91/0.90 | micro_F1 : 0.21/0.17:   4%|▎         | 11/300 [00:26<11:11,  2.32s/it]train/val metrics at epoch 12 | loss : 0.88/0.89 | micro_F1 : 0.22/0.17:   4%|▎         | 11/300 [00:28<11:11,  2.32s/it]train/val metrics at epoch 12 | loss : 0.88/0.89 | micro_F1 : 0.22/0.17:   4%|▍         | 12/300 [00:28<11:05,  2.31s/it]train/val metrics at epoch 13 | loss : 0.85/0.88 | micro_F1 : 0.22/0.18:   4%|▍         | 12/300 [00:30<11:05,  2.31s/it]train/val metrics at epoch 13 | loss : 0.85/0.88 | micro_F1 : 0.22/0.18:   4%|▍         | 13/300 [00:30<11:03,  2.31s/it]train/val metrics at epoch 14 | loss : 0.83/0.88 | micro_F1 : 0.23/0.18:   4%|▍         | 13/300 [00:33<11:03,  2.31s/it]train/val metrics at epoch 14 | loss : 0.83/0.88 | micro_F1 : 0.23/0.18:   5%|▍         | 14/300 [00:33<11:03,  2.32s/it]train/val metrics at epoch 15 | loss : 0.81/0.87 | micro_F1 : 0.23/0.18:   5%|▍         | 14/300 [00:35<11:03,  2.32s/it]train/val metrics at epoch 15 | loss : 0.81/0.87 | micro_F1 : 0.23/0.18:   5%|▌         | 15/300 [00:35<11:04,  2.33s/it]train/val metrics at epoch 16 | loss : 0.78/0.88 | micro_F1 : 0.24/0.19:   5%|▌         | 15/300 [00:37<11:04,  2.33s/it]train/val metrics at epoch 16 | loss : 0.78/0.88 | micro_F1 : 0.24/0.19:   5%|▌         | 16/300 [00:37<10:59,  2.32s/it]train/val metrics at epoch 17 | loss : 0.77/0.88 | micro_F1 : 0.25/0.20:   5%|▌         | 16/300 [00:40<10:59,  2.32s/it]train/val metrics at epoch 17 | loss : 0.77/0.88 | micro_F1 : 0.25/0.20:   6%|▌         | 17/300 [00:40<10:58,  2.33s/it]train/val metrics at epoch 18 | loss : 0.75/0.86 | micro_F1 : 0.25/0.20:   6%|▌         | 17/300 [00:42<10:58,  2.33s/it]train/val metrics at epoch 18 | loss : 0.75/0.86 | micro_F1 : 0.25/0.20:   6%|▌         | 18/300 [00:42<10:57,  2.33s/it]train/val metrics at epoch 19 | loss : 0.74/0.86 | micro_F1 : 0.25/0.20:   6%|▌         | 18/300 [00:44<10:57,  2.33s/it]train/val metrics at epoch 19 | loss : 0.74/0.86 | micro_F1 : 0.25/0.20:   6%|▋         | 19/300 [00:44<10:53,  2.33s/it]train/val metrics at epoch 20 | loss : 0.73/0.87 | micro_F1 : 0.26/0.20:   6%|▋         | 19/300 [00:47<10:53,  2.33s/it]train/val metrics at epoch 20 | loss : 0.73/0.87 | micro_F1 : 0.26/0.20:   7%|▋         | 20/300 [00:47<10:49,  2.32s/it]train/val metrics at epoch 21 | loss : 0.72/0.87 | micro_F1 : 0.26/0.21:   7%|▋         | 20/300 [00:49<10:49,  2.32s/it]train/val metrics at epoch 21 | loss : 0.72/0.87 | micro_F1 : 0.26/0.21:   7%|▋         | 21/300 [00:49<10:47,  2.32s/it]train/val metrics at epoch 22 | loss : 0.72/0.86 | micro_F1 : 0.26/0.21:   7%|▋         | 21/300 [00:51<10:47,  2.32s/it]train/val metrics at epoch 22 | loss : 0.72/0.86 | micro_F1 : 0.26/0.21:   7%|▋         | 22/300 [00:51<10:46,  2.33s/it]train/val metrics at epoch 23 | loss : 0.71/0.88 | micro_F1 : 0.26/0.20:   7%|▋         | 22/300 [00:53<10:46,  2.33s/it]train/val metrics at epoch 23 | loss : 0.71/0.88 | micro_F1 : 0.26/0.20:   8%|▊         | 23/300 [00:54<10:43,  2.32s/it]train/val metrics at epoch 24 | loss : 0.71/0.87 | micro_F1 : 0.27/0.20:   8%|▊         | 23/300 [00:56<10:43,  2.32s/it]train/val metrics at epoch 24 | loss : 0.71/0.87 | micro_F1 : 0.27/0.20:   8%|▊         | 24/300 [00:56<10:44,  2.33s/it]train/val metrics at epoch 25 | loss : 0.70/0.86 | micro_F1 : 0.27/0.21:   8%|▊         | 24/300 [00:58<10:44,  2.33s/it]train/val metrics at epoch 25 | loss : 0.70/0.86 | micro_F1 : 0.27/0.21:   8%|▊         | 25/300 [00:58<10:42,  2.34s/it]train/val metrics at epoch 26 | loss : 0.70/0.88 | micro_F1 : 0.27/0.21:   8%|▊         | 25/300 [01:01<10:42,  2.34s/it]train/val metrics at epoch 26 | loss : 0.70/0.88 | micro_F1 : 0.27/0.21:   9%|▊         | 26/300 [01:01<10:39,  2.33s/it]train/val metrics at epoch 27 | loss : 0.69/0.87 | micro_F1 : 0.27/0.21:   9%|▊         | 26/300 [01:03<10:39,  2.33s/it]train/val metrics at epoch 27 | loss : 0.69/0.87 | micro_F1 : 0.27/0.21:   9%|▉         | 27/300 [01:03<10:44,  2.36s/it]train/val metrics at epoch 28 | loss : 0.69/0.99 | micro_F1 : 0.27/0.21:   9%|▉         | 27/300 [01:05<10:44,  2.36s/it]train/val metrics at epoch 28 | loss : 0.69/0.99 | micro_F1 : 0.27/0.21:   9%|▉         | 28/300 [01:06<10:48,  2.38s/it]train/val metrics at epoch 29 | loss : 0.69/0.86 | micro_F1 : 0.27/0.21:   9%|▉         | 28/300 [01:08<10:48,  2.38s/it]train/val metrics at epoch 29 | loss : 0.69/0.86 | micro_F1 : 0.27/0.21:  10%|▉         | 29/300 [01:08<10:47,  2.39s/it]train/val metrics at epoch 30 | loss : 0.69/0.88 | micro_F1 : 0.27/0.21:  10%|▉         | 29/300 [01:10<10:47,  2.39s/it]train/val metrics at epoch 30 | loss : 0.69/0.88 | micro_F1 : 0.27/0.21:  10%|█         | 30/300 [01:10<10:48,  2.40s/it]train/val metrics at epoch 31 | loss : 0.68/0.87 | micro_F1 : 0.28/0.21:  10%|█         | 30/300 [01:13<10:48,  2.40s/it]train/val metrics at epoch 31 | loss : 0.68/0.87 | micro_F1 : 0.28/0.21:  10%|█         | 31/300 [01:13<10:50,  2.42s/it]train/val metrics at epoch 32 | loss : 0.69/0.88 | micro_F1 : 0.27/0.22:  10%|█         | 31/300 [01:15<10:50,  2.42s/it]train/val metrics at epoch 32 | loss : 0.69/0.88 | micro_F1 : 0.27/0.22:  11%|█         | 32/300 [01:15<10:46,  2.41s/it]train/val metrics at epoch 33 | loss : 0.68/0.87 | micro_F1 : 0.28/0.22:  11%|█         | 32/300 [01:17<10:46,  2.41s/it]train/val metrics at epoch 33 | loss : 0.68/0.87 | micro_F1 : 0.28/0.22:  11%|█         | 33/300 [01:18<10:43,  2.41s/it]train/val metrics at epoch 34 | loss : 0.68/0.88 | micro_F1 : 0.28/0.21:  11%|█         | 33/300 [01:20<10:43,  2.41s/it]train/val metrics at epoch 34 | loss : 0.68/0.88 | micro_F1 : 0.28/0.21:  11%|█▏        | 34/300 [01:20<10:50,  2.45s/it]train/val metrics at epoch 35 | loss : 0.68/0.88 | micro_F1 : 0.28/0.21:  11%|█▏        | 34/300 [01:22<10:50,  2.45s/it]train/val metrics at epoch 35 | loss : 0.68/0.88 | micro_F1 : 0.28/0.21:  12%|█▏        | 35/300 [01:23<10:41,  2.42s/it]train/val metrics at epoch 36 | loss : 0.68/0.88 | micro_F1 : 0.28/0.21:  12%|█▏        | 35/300 [01:25<10:41,  2.42s/it]train/val metrics at epoch 36 | loss : 0.68/0.88 | micro_F1 : 0.28/0.21:  12%|█▏        | 36/300 [01:25<10:37,  2.42s/it]train/val metrics at epoch 37 | loss : 0.68/0.87 | micro_F1 : 0.28/0.21:  12%|█▏        | 36/300 [01:27<10:37,  2.42s/it]train/val metrics at epoch 37 | loss : 0.68/0.87 | micro_F1 : 0.28/0.21:  12%|█▏        | 37/300 [01:27<10:40,  2.43s/it]train/val metrics at epoch 38 | loss : 0.67/0.98 | micro_F1 : 0.28/0.22:  12%|█▏        | 37/300 [01:30<10:40,  2.43s/it]train/val metrics at epoch 38 | loss : 0.67/0.98 | micro_F1 : 0.28/0.22:  13%|█▎        | 38/300 [01:30<10:34,  2.42s/it]train/val metrics at epoch 39 | loss : 0.67/0.88 | micro_F1 : 0.28/0.21:  13%|█▎        | 38/300 [01:32<10:34,  2.42s/it]train/val metrics at epoch 39 | loss : 0.67/0.88 | micro_F1 : 0.28/0.21:  13%|█▎        | 38/300 [01:33<10:43,  2.45s/it]
wandb: Waiting for W&B process to finish... (success).
wandb: 
wandb: Run history:
wandb:          epoch ▁
wandb:  learning rate ▁
wandb:           time ▁
wandb:     train loss ▁
wandb: train macro F1 ▁
wandb: train micro F1 ▁
wandb:       val loss ▁
wandb:   val macro F1 ▁
wandb:   val micro F1 ▁
wandb: 
wandb: Run summary:
wandb:          epoch 39
wandb:  learning rate 0.0
wandb:           time 94.83585
wandb:     train loss 0.67029
wandb: train macro F1 0.22471
wandb: train micro F1 0.28146
wandb:       val loss 0.87518
wandb:   val macro F1 0.13016
wandb:   val micro F1 0.21334
wandb: 
wandb: 🚀 View run fine-pine-175 at: https://wandb.ai/msc-nicola/train_all_MLC/runs/4pzymoca
wandb: Synced 5 W&B file(s), 1 media file(s), 1 artifact file(s) and 0 other file(s)
wandb: Find logs at: ./wandb/run-20230627_031654-4pzymoca/logs
wandb: Currently logged in as: tha-santacruz (msc-nicola). Use `wandb login --relogin` to force relogin
wandb: Tracking run with wandb version 0.15.4
wandb: Run data is saved locally in /home/santacro/masters_thesis/all_runs/wandb/run-20230627_031857-t6sg4sa2
wandb: Run `wandb offline` to turn off syncing.
wandb: Syncing run true-salad-175
wandb: ⭐️ View project at https://wandb.ai/msc-nicola/test_all_MLC
wandb: 🚀 View run at https://wandb.ai/msc-nicola/test_all_MLC/runs/t6sg4sa2
Running job on GPU : Tesla V100-PCIE-32GB
Namespace(BATCH_SIZE=128, CHECKPOINTS_PATH='/scratch/izar/santacro/checkpoints/', DATASET_PATH='/scratch/izar/santacro/final_data/', DEVICE='cuda:0', EMBEDDING='doc2vec', EPOCH_NUM=300, FRACTION=40, HIDDEN_SIZE=8192, JOB_ID=175, LEARNING_RATE=1e-05, LEVEL='L2', LOAD_CHECKPOINT='yes', MERGE_METHOD='fusion', MIN_LEARNING_RATE=1e-06, NUM_WORKERS=8, RANDOM_STATE=4, RUN_MODE='test', SAVE_CHECKPOINTS='yes', SPLITTING='species', TARGET_BASE='set', WANDB_ENTITY='msc-nicola', WANDB_LOGS='yes', WANDB_PROJECT='all_MLC')
Number of train samples : 8444
Number of val samples : 826
Number of test samples : 10070
Loaded model state dict from file /scratch/izar/santacro/checkpoints//4_doc2vec_embedding_L2_level_fusion_merging_species_splitting_8192.pth
wandb: Waiting for W&B process to finish... (success).
wandb: 
wandb: Run history:
wandb:     test loss ▁
wandb: test macro F1 ▁
wandb:  test macro H ▁
wandb: test micro F1 ▁
wandb: 
wandb: Run summary:
wandb:     test loss 1.39778
wandb: test macro F1 0.17662
wandb:  test macro H 4.05035
wandb: test micro F1 0.21901
wandb: 
wandb: 🚀 View run true-salad-175 at: https://wandb.ai/msc-nicola/test_all_MLC/runs/t6sg4sa2
wandb: Synced 4 W&B file(s), 33 media file(s), 1 artifact file(s) and 0 other file(s)
wandb: Find logs at: ./wandb/run-20230627_031857-t6sg4sa2/logs
