/usr/share/lmod/lmod/init/sh: line 20: /usr/share/lmod/lmod/libexec//clearMT_cmd: No such file or directory
wandb: Currently logged in as: tha-santacruz (msc-nicola). Use `wandb login --relogin` to force relogin
wandb: Tracking run with wandb version 0.15.4
wandb: Run data is saved locally in /home/santacro/masters_thesis/all_runs/wandb/run-20230627_023314-v525muun
wandb: Run `wandb offline` to turn off syncing.
wandb: Syncing run autumn-deluge-74
wandb: ⭐️ View project at https://wandb.ai/msc-nicola/train_all_MLC
wandb: 🚀 View run at https://wandb.ai/msc-nicola/train_all_MLC/runs/v525muun
Running job on GPU : Tesla V100-PCIE-32GB
Namespace(BATCH_SIZE=128, CHECKPOINTS_PATH='/scratch/izar/santacro/checkpoints/', DATASET_PATH='/scratch/izar/santacro/final_data/', DEVICE='cuda:0', EMBEDDING='doc2vec', EPOCH_NUM=300, FRACTION=0, HIDDEN_SIZE=8192, JOB_ID=74, LEARNING_RATE=1e-05, LEVEL='L1', LOAD_CHECKPOINT='no', MERGE_METHOD='fusion', MIN_LEARNING_RATE=1e-06, NUM_WORKERS=8, RANDOM_STATE=2, RUN_MODE='train', SAVE_CHECKPOINTS='yes', SPLITTING='progressive', TARGET_BASE='set', WANDB_ENTITY='msc-nicola', WANDB_LOGS='yes', WANDB_PROJECT='all_MLC')
Number of train samples : 9720
Number of val samples : 1080
Number of test samples : 5500
  0%|          | 0/300 [00:00<?, ?it/s]train/val metrics at epoch 1 | loss : 1.16/1.08 | micro_F1 : 0.22/0.27:   0%|          | 0/300 [00:02<?, ?it/s]train/val metrics at epoch 1 | loss : 1.16/1.08 | micro_F1 : 0.22/0.27:   0%|          | 1/300 [00:02<13:38,  2.74s/it]train/val metrics at epoch 2 | loss : 1.09/1.01 | micro_F1 : 0.30/0.31:   0%|          | 1/300 [00:04<13:38,  2.74s/it]train/val metrics at epoch 2 | loss : 1.09/1.01 | micro_F1 : 0.30/0.31:   1%|          | 2/300 [00:04<11:45,  2.37s/it]train/val metrics at epoch 3 | loss : 1.04/0.99 | micro_F1 : 0.34/0.35:   1%|          | 2/300 [00:06<11:45,  2.37s/it]train/val metrics at epoch 3 | loss : 1.04/0.99 | micro_F1 : 0.34/0.35:   1%|          | 3/300 [00:06<11:12,  2.26s/it]train/val metrics at epoch 4 | loss : 1.00/0.95 | micro_F1 : 0.37/0.37:   1%|          | 3/300 [00:08<11:12,  2.26s/it]train/val metrics at epoch 4 | loss : 1.00/0.95 | micro_F1 : 0.37/0.37:   1%|▏         | 4/300 [00:09<10:51,  2.20s/it]train/val metrics at epoch 5 | loss : 0.96/0.95 | micro_F1 : 0.39/0.37:   1%|▏         | 4/300 [00:10<10:51,  2.20s/it]train/val metrics at epoch 5 | loss : 0.96/0.95 | micro_F1 : 0.39/0.37:   2%|▏         | 5/300 [00:11<10:38,  2.17s/it]train/val metrics at epoch 6 | loss : 0.93/0.93 | micro_F1 : 0.41/0.39:   2%|▏         | 5/300 [00:13<10:38,  2.17s/it]train/val metrics at epoch 6 | loss : 0.93/0.93 | micro_F1 : 0.41/0.39:   2%|▏         | 6/300 [00:13<10:28,  2.14s/it]train/val metrics at epoch 7 | loss : 0.89/0.93 | micro_F1 : 0.42/0.39:   2%|▏         | 6/300 [00:15<10:28,  2.14s/it]train/val metrics at epoch 7 | loss : 0.89/0.93 | micro_F1 : 0.42/0.39:   2%|▏         | 7/300 [00:15<10:22,  2.12s/it]train/val metrics at epoch 8 | loss : 0.86/0.92 | micro_F1 : 0.42/0.39:   2%|▏         | 7/300 [00:17<10:22,  2.12s/it]train/val metrics at epoch 8 | loss : 0.86/0.92 | micro_F1 : 0.42/0.39:   3%|▎         | 8/300 [00:17<10:20,  2.13s/it]train/val metrics at epoch 9 | loss : 0.83/0.92 | micro_F1 : 0.44/0.40:   3%|▎         | 8/300 [00:19<10:20,  2.13s/it]train/val metrics at epoch 9 | loss : 0.83/0.92 | micro_F1 : 0.44/0.40:   3%|▎         | 9/300 [00:19<10:18,  2.12s/it]train/val metrics at epoch 10 | loss : 0.81/0.91 | micro_F1 : 0.45/0.41:   3%|▎         | 9/300 [00:21<10:18,  2.12s/it]train/val metrics at epoch 10 | loss : 0.81/0.91 | micro_F1 : 0.45/0.41:   3%|▎         | 10/300 [00:21<10:16,  2.13s/it]train/val metrics at epoch 11 | loss : 0.77/0.92 | micro_F1 : 0.46/0.40:   3%|▎         | 10/300 [00:24<10:16,  2.13s/it]train/val metrics at epoch 11 | loss : 0.77/0.92 | micro_F1 : 0.46/0.40:   4%|▎         | 11/300 [00:24<11:09,  2.32s/it]train/val metrics at epoch 12 | loss : 0.74/0.93 | micro_F1 : 0.47/0.40:   4%|▎         | 11/300 [00:26<11:09,  2.32s/it]train/val metrics at epoch 12 | loss : 0.74/0.93 | micro_F1 : 0.47/0.40:   4%|▍         | 12/300 [00:26<10:52,  2.27s/it]train/val metrics at epoch 13 | loss : 0.72/0.93 | micro_F1 : 0.48/0.42:   4%|▍         | 12/300 [00:28<10:52,  2.27s/it]train/val metrics at epoch 13 | loss : 0.72/0.93 | micro_F1 : 0.48/0.42:   4%|▍         | 13/300 [00:28<10:38,  2.22s/it]train/val metrics at epoch 14 | loss : 0.71/0.93 | micro_F1 : 0.49/0.43:   4%|▍         | 13/300 [00:30<10:38,  2.22s/it]train/val metrics at epoch 14 | loss : 0.71/0.93 | micro_F1 : 0.49/0.43:   5%|▍         | 14/300 [00:30<10:26,  2.19s/it]train/val metrics at epoch 15 | loss : 0.69/0.94 | micro_F1 : 0.50/0.42:   5%|▍         | 14/300 [00:32<10:26,  2.19s/it]train/val metrics at epoch 15 | loss : 0.69/0.94 | micro_F1 : 0.50/0.42:   5%|▌         | 15/300 [00:33<10:20,  2.18s/it]train/val metrics at epoch 16 | loss : 0.68/0.97 | micro_F1 : 0.50/0.43:   5%|▌         | 15/300 [00:34<10:20,  2.18s/it]train/val metrics at epoch 16 | loss : 0.68/0.97 | micro_F1 : 0.50/0.43:   5%|▌         | 16/300 [00:35<10:11,  2.15s/it]train/val metrics at epoch 17 | loss : 0.67/0.95 | micro_F1 : 0.51/0.43:   5%|▌         | 16/300 [00:37<10:11,  2.15s/it]train/val metrics at epoch 17 | loss : 0.67/0.95 | micro_F1 : 0.51/0.43:   6%|▌         | 17/300 [00:37<10:05,  2.14s/it]train/val metrics at epoch 18 | loss : 0.66/0.95 | micro_F1 : 0.51/0.43:   6%|▌         | 17/300 [00:39<10:05,  2.14s/it]train/val metrics at epoch 18 | loss : 0.66/0.95 | micro_F1 : 0.51/0.43:   6%|▌         | 18/300 [00:39<10:01,  2.13s/it]train/val metrics at epoch 19 | loss : 0.66/0.97 | micro_F1 : 0.51/0.43:   6%|▌         | 18/300 [00:41<10:01,  2.13s/it]train/val metrics at epoch 19 | loss : 0.66/0.97 | micro_F1 : 0.51/0.43:   6%|▋         | 19/300 [00:41<10:05,  2.15s/it]train/val metrics at epoch 20 | loss : 0.65/0.97 | micro_F1 : 0.52/0.43:   6%|▋         | 19/300 [00:43<10:05,  2.15s/it]train/val metrics at epoch 20 | loss : 0.65/0.97 | micro_F1 : 0.52/0.43:   6%|▋         | 19/300 [00:44<10:55,  2.33s/it]
wandb: Waiting for W&B process to finish... (success).
wandb: 
wandb: Run history:
wandb:          epoch ▁
wandb:  learning rate ▁
wandb:           time ▁
wandb:     train loss ▁
wandb: train macro F1 ▁
wandb: train micro F1 ▁
wandb:       val loss ▁
wandb:   val macro F1 ▁
wandb:   val micro F1 ▁
wandb: 
wandb: Run summary:
wandb:          epoch 20
wandb:  learning rate 0.0
wandb:           time 45.75695
wandb:     train loss 0.65219
wandb: train macro F1 0.46153
wandb: train micro F1 0.51504
wandb:       val loss 0.96774
wandb:   val macro F1 0.30385
wandb:   val micro F1 0.42936
wandb: 
wandb: 🚀 View run autumn-deluge-74 at: https://wandb.ai/msc-nicola/train_all_MLC/runs/v525muun
wandb: Synced 5 W&B file(s), 1 media file(s), 1 artifact file(s) and 0 other file(s)
wandb: Find logs at: ./wandb/run-20230627_023314-v525muun/logs
wandb: Currently logged in as: tha-santacruz (msc-nicola). Use `wandb login --relogin` to force relogin
wandb: Tracking run with wandb version 0.15.4
wandb: Run data is saved locally in /home/santacro/masters_thesis/all_runs/wandb/run-20230627_023421-z69z32l2
wandb: Run `wandb offline` to turn off syncing.
wandb: Syncing run graceful-morning-74
wandb: ⭐️ View project at https://wandb.ai/msc-nicola/test_all_MLC
wandb: 🚀 View run at https://wandb.ai/msc-nicola/test_all_MLC/runs/z69z32l2
Running job on GPU : Tesla V100-PCIE-32GB
Namespace(BATCH_SIZE=128, CHECKPOINTS_PATH='/scratch/izar/santacro/checkpoints/', DATASET_PATH='/scratch/izar/santacro/final_data/', DEVICE='cuda:0', EMBEDDING='doc2vec', EPOCH_NUM=300, FRACTION=0, HIDDEN_SIZE=8192, JOB_ID=74, LEARNING_RATE=1e-05, LEVEL='L1', LOAD_CHECKPOINT='yes', MERGE_METHOD='fusion', MIN_LEARNING_RATE=1e-06, NUM_WORKERS=8, RANDOM_STATE=2, RUN_MODE='test', SAVE_CHECKPOINTS='yes', SPLITTING='progressive', TARGET_BASE='set', WANDB_ENTITY='msc-nicola', WANDB_LOGS='yes', WANDB_PROJECT='all_MLC')
Number of train samples : 9720
Number of val samples : 1080
Number of test samples : 5500
Loaded model state dict from file /scratch/izar/santacro/checkpoints//2_doc2vec_embedding_L1_level_fusion_merging_progressive_0%_8192.pth
wandb: Waiting for W&B process to finish... (success).
wandb: - 0.007 MB of 0.182 MB uploaded (0.000 MB deduped)wandb: \ 0.007 MB of 0.182 MB uploaded (0.000 MB deduped)wandb: | 0.007 MB of 0.182 MB uploaded (0.000 MB deduped)wandb: / 0.007 MB of 0.182 MB uploaded (0.000 MB deduped)wandb: - 0.007 MB of 0.182 MB uploaded (0.000 MB deduped)wandb: \ 0.007 MB of 0.182 MB uploaded (0.000 MB deduped)wandb: 
wandb: Run history:
wandb:     test loss ▁
wandb: test macro F1 ▁
wandb:  test macro H ▁
wandb: test micro F1 ▁
wandb: 
wandb: Run summary:
wandb:     test loss 1.21683
wandb: test macro F1 0.29803
wandb:  test macro H 1.64545
wandb: test micro F1 0.39707
wandb: 
wandb: 🚀 View run graceful-morning-74 at: https://wandb.ai/msc-nicola/test_all_MLC/runs/z69z32l2
wandb: Synced 4 W&B file(s), 10 media file(s), 1 artifact file(s) and 0 other file(s)
wandb: Find logs at: ./wandb/run-20230627_023421-z69z32l2/logs
