/usr/share/lmod/lmod/init/sh: line 20: /usr/share/lmod/lmod/libexec//clearMT_cmd: No such file or directory
wandb: Currently logged in as: tha-santacruz (msc-nicola). Use `wandb login --relogin` to force relogin
wandb: Tracking run with wandb version 0.15.4
wandb: Run data is saved locally in /home/santacro/masters_thesis/all_runs/wandb/run-20230626_213742-m5d04fwd
wandb: Run `wandb offline` to turn off syncing.
wandb: Syncing run sparkling-bird-21
wandb: ⭐️ View project at https://wandb.ai/msc-nicola/train_all_MLC
wandb: 🚀 View run at https://wandb.ai/msc-nicola/train_all_MLC/runs/m5d04fwd
Running job on GPU : Tesla V100-PCIE-32GB
Namespace(BATCH_SIZE=128, CHECKPOINTS_PATH='/scratch/izar/santacro/checkpoints/', DATASET_PATH='/scratch/izar/santacro/final_data/', DEVICE='cuda:0', EMBEDDING='doc2vec', EPOCH_NUM=300, FRACTION=0, HIDDEN_SIZE=8192, JOB_ID=21, LEARNING_RATE=1e-05, LEVEL='L1', LOAD_CHECKPOINT='no', MERGE_METHOD='fusion', MIN_LEARNING_RATE=1e-06, NUM_WORKERS=8, RANDOM_STATE=1, RUN_MODE='train', SAVE_CHECKPOINTS='yes', SPLITTING='progressive', TARGET_BASE='set', WANDB_ENTITY='msc-nicola', WANDB_LOGS='yes', WANDB_PROJECT='all_MLC')
Number of train samples : 9499
Number of val samples : 1056
Number of test samples : 5605
  0%|          | 0/300 [00:00<?, ?it/s]train/val metrics at epoch 1 | loss : 1.16/1.12 | micro_F1 : 0.22/0.25:   0%|          | 0/300 [00:02<?, ?it/s]train/val metrics at epoch 1 | loss : 1.16/1.12 | micro_F1 : 0.22/0.25:   0%|          | 1/300 [00:03<15:31,  3.12s/it]train/val metrics at epoch 2 | loss : 1.09/1.04 | micro_F1 : 0.29/0.31:   0%|          | 1/300 [00:04<15:31,  3.12s/it]train/val metrics at epoch 2 | loss : 1.09/1.04 | micro_F1 : 0.29/0.31:   1%|          | 2/300 [00:05<12:23,  2.49s/it]train/val metrics at epoch 3 | loss : 1.04/1.02 | micro_F1 : 0.34/0.33:   1%|          | 2/300 [00:06<12:23,  2.49s/it]train/val metrics at epoch 3 | loss : 1.04/1.02 | micro_F1 : 0.34/0.33:   1%|          | 3/300 [00:07<11:12,  2.26s/it]train/val metrics at epoch 4 | loss : 1.00/0.99 | micro_F1 : 0.36/0.35:   1%|          | 3/300 [00:08<11:12,  2.26s/it]train/val metrics at epoch 4 | loss : 1.00/0.99 | micro_F1 : 0.36/0.35:   1%|▏         | 4/300 [00:09<10:39,  2.16s/it]train/val metrics at epoch 5 | loss : 0.97/1.03 | micro_F1 : 0.38/0.37:   1%|▏         | 4/300 [00:10<10:39,  2.16s/it]train/val metrics at epoch 5 | loss : 0.97/1.03 | micro_F1 : 0.38/0.37:   2%|▏         | 5/300 [00:11<10:22,  2.11s/it]train/val metrics at epoch 6 | loss : 0.94/0.96 | micro_F1 : 0.39/0.38:   2%|▏         | 5/300 [00:13<10:22,  2.11s/it]train/val metrics at epoch 6 | loss : 0.94/0.96 | micro_F1 : 0.39/0.38:   2%|▏         | 6/300 [00:13<10:14,  2.09s/it]train/val metrics at epoch 7 | loss : 0.90/0.98 | micro_F1 : 0.40/0.37:   2%|▏         | 6/300 [00:15<10:14,  2.09s/it]train/val metrics at epoch 7 | loss : 0.90/0.98 | micro_F1 : 0.40/0.37:   2%|▏         | 7/300 [00:15<10:07,  2.07s/it]train/val metrics at epoch 8 | loss : 0.87/0.96 | micro_F1 : 0.41/0.38:   2%|▏         | 7/300 [00:17<10:07,  2.07s/it]train/val metrics at epoch 8 | loss : 0.87/0.96 | micro_F1 : 0.41/0.38:   3%|▎         | 8/300 [00:17<10:05,  2.07s/it]train/val metrics at epoch 9 | loss : 0.84/0.97 | micro_F1 : 0.42/0.38:   3%|▎         | 8/300 [00:19<10:05,  2.07s/it]train/val metrics at epoch 9 | loss : 0.84/0.97 | micro_F1 : 0.42/0.38:   3%|▎         | 9/300 [00:19<10:03,  2.07s/it]train/val metrics at epoch 10 | loss : 0.82/0.99 | micro_F1 : 0.43/0.38:   3%|▎         | 9/300 [00:21<10:03,  2.07s/it]train/val metrics at epoch 10 | loss : 0.82/0.99 | micro_F1 : 0.43/0.38:   3%|▎         | 10/300 [00:21<09:53,  2.05s/it]train/val metrics at epoch 11 | loss : 0.78/0.96 | micro_F1 : 0.44/0.39:   3%|▎         | 10/300 [00:23<09:53,  2.05s/it]train/val metrics at epoch 11 | loss : 0.78/0.96 | micro_F1 : 0.44/0.39:   4%|▎         | 11/300 [00:23<09:51,  2.05s/it]train/val metrics at epoch 12 | loss : 0.77/0.98 | micro_F1 : 0.46/0.39:   4%|▎         | 11/300 [00:25<09:51,  2.05s/it]train/val metrics at epoch 12 | loss : 0.77/0.98 | micro_F1 : 0.46/0.39:   4%|▍         | 12/300 [00:25<09:48,  2.04s/it]train/val metrics at epoch 13 | loss : 0.76/0.96 | micro_F1 : 0.46/0.40:   4%|▍         | 12/300 [00:27<09:48,  2.04s/it]train/val metrics at epoch 13 | loss : 0.76/0.96 | micro_F1 : 0.46/0.40:   4%|▍         | 13/300 [00:27<09:42,  2.03s/it]train/val metrics at epoch 14 | loss : 0.74/0.99 | micro_F1 : 0.47/0.41:   4%|▍         | 13/300 [00:29<09:42,  2.03s/it]train/val metrics at epoch 14 | loss : 0.74/0.99 | micro_F1 : 0.47/0.41:   5%|▍         | 14/300 [00:29<09:39,  2.02s/it]train/val metrics at epoch 15 | loss : 0.73/1.00 | micro_F1 : 0.47/0.40:   5%|▍         | 14/300 [00:31<09:39,  2.02s/it]train/val metrics at epoch 15 | loss : 0.73/1.00 | micro_F1 : 0.47/0.40:   5%|▌         | 15/300 [00:31<09:33,  2.01s/it]train/val metrics at epoch 16 | loss : 0.73/0.98 | micro_F1 : 0.47/0.41:   5%|▌         | 15/300 [00:33<09:33,  2.01s/it]train/val metrics at epoch 16 | loss : 0.73/0.98 | micro_F1 : 0.47/0.41:   5%|▌         | 16/300 [00:33<09:32,  2.02s/it]train/val metrics at epoch 17 | loss : 0.72/0.97 | micro_F1 : 0.48/0.41:   5%|▌         | 16/300 [00:35<09:32,  2.02s/it]train/val metrics at epoch 17 | loss : 0.72/0.97 | micro_F1 : 0.48/0.41:   6%|▌         | 17/300 [00:35<09:26,  2.00s/it]train/val metrics at epoch 18 | loss : 0.72/0.98 | micro_F1 : 0.48/0.41:   6%|▌         | 17/300 [00:37<09:26,  2.00s/it]train/val metrics at epoch 18 | loss : 0.72/0.98 | micro_F1 : 0.48/0.41:   6%|▌         | 18/300 [00:37<09:22,  2.00s/it]train/val metrics at epoch 19 | loss : 0.71/1.00 | micro_F1 : 0.48/0.40:   6%|▌         | 18/300 [00:39<09:22,  2.00s/it]train/val metrics at epoch 19 | loss : 0.71/1.00 | micro_F1 : 0.48/0.40:   6%|▋         | 19/300 [00:39<09:24,  2.01s/it]train/val metrics at epoch 20 | loss : 0.71/1.03 | micro_F1 : 0.48/0.41:   6%|▋         | 19/300 [00:41<09:24,  2.01s/it]train/val metrics at epoch 20 | loss : 0.71/1.03 | micro_F1 : 0.48/0.41:   7%|▋         | 20/300 [00:42<10:36,  2.27s/it]train/val metrics at epoch 21 | loss : 0.70/0.98 | micro_F1 : 0.48/0.41:   7%|▋         | 20/300 [00:44<10:36,  2.27s/it]train/val metrics at epoch 21 | loss : 0.70/0.98 | micro_F1 : 0.48/0.41:   7%|▋         | 20/300 [00:45<10:42,  2.29s/it]
wandb: Waiting for W&B process to finish... (success).
wandb: 
wandb: Run history:
wandb:          epoch ▁
wandb:  learning rate ▁
wandb:           time ▁
wandb:     train loss ▁
wandb: train macro F1 ▁
wandb: train micro F1 ▁
wandb:       val loss ▁
wandb:   val macro F1 ▁
wandb:   val micro F1 ▁
wandb: 
wandb: Run summary:
wandb:          epoch 21
wandb:  learning rate 0.0
wandb:           time 47.19295
wandb:     train loss 0.70453
wandb: train macro F1 0.4223
wandb: train micro F1 0.47878
wandb:       val loss 0.9763
wandb:   val macro F1 0.30522
wandb:   val micro F1 0.40652
wandb: 
wandb: 🚀 View run sparkling-bird-21 at: https://wandb.ai/msc-nicola/train_all_MLC/runs/m5d04fwd
wandb: Synced 5 W&B file(s), 1 media file(s), 1 artifact file(s) and 0 other file(s)
wandb: Find logs at: ./wandb/run-20230626_213742-m5d04fwd/logs
wandb: Currently logged in as: tha-santacruz (msc-nicola). Use `wandb login --relogin` to force relogin
wandb: Tracking run with wandb version 0.15.4
wandb: Run data is saved locally in /home/santacro/masters_thesis/all_runs/wandb/run-20230626_213851-asse60h3
wandb: Run `wandb offline` to turn off syncing.
wandb: Syncing run wandering-jazz-19
wandb: ⭐️ View project at https://wandb.ai/msc-nicola/test_all_MLC
wandb: 🚀 View run at https://wandb.ai/msc-nicola/test_all_MLC/runs/asse60h3
Running job on GPU : Tesla V100-PCIE-32GB
Namespace(BATCH_SIZE=128, CHECKPOINTS_PATH='/scratch/izar/santacro/checkpoints/', DATASET_PATH='/scratch/izar/santacro/final_data/', DEVICE='cuda:0', EMBEDDING='doc2vec', EPOCH_NUM=300, FRACTION=0, HIDDEN_SIZE=8192, JOB_ID=21, LEARNING_RATE=1e-05, LEVEL='L1', LOAD_CHECKPOINT='yes', MERGE_METHOD='fusion', MIN_LEARNING_RATE=1e-06, NUM_WORKERS=8, RANDOM_STATE=1, RUN_MODE='test', SAVE_CHECKPOINTS='yes', SPLITTING='progressive', TARGET_BASE='set', WANDB_ENTITY='msc-nicola', WANDB_LOGS='yes', WANDB_PROJECT='all_MLC')
Number of train samples : 9499
Number of val samples : 1056
Number of test samples : 5605
Loaded model state dict from file /scratch/izar/santacro/checkpoints//1_doc2vec_embedding_L1_level_fusion_merging_progressive_0%_8192.pth
wandb: Waiting for W&B process to finish... (success).
wandb: 
wandb: Run history:
wandb:     test loss ▁
wandb: test macro F1 ▁
wandb:  test macro H ▁
wandb: test micro F1 ▁
wandb: 
wandb: Run summary:
wandb:     test loss 1.16995
wandb: test macro F1 0.29963
wandb:  test macro H 1.96057
wandb: test micro F1 0.34429
wandb: 
wandb: 🚀 View run wandering-jazz-19 at: https://wandb.ai/msc-nicola/test_all_MLC/runs/asse60h3
wandb: Synced 4 W&B file(s), 10 media file(s), 1 artifact file(s) and 0 other file(s)
wandb: Find logs at: ./wandb/run-20230626_213851-asse60h3/logs
