/usr/share/lmod/lmod/init/sh: line 20: /usr/share/lmod/lmod/libexec//clearMT_cmd: No such file or directory
wandb: Currently logged in as: tha-santacruz (msc-nicola). Use `wandb login --relogin` to force relogin
wandb: Tracking run with wandb version 0.15.4
wandb: Run data is saved locally in /home/santacro/masters_thesis/all_runs/wandb/run-20230627_033450-2zcjcrvl
wandb: Run `wandb offline` to turn off syncing.
wandb: Syncing run kind-river-257
wandb: ⭐️ View project at https://wandb.ai/msc-nicola/train_all_MLC
wandb: 🚀 View run at https://wandb.ai/msc-nicola/train_all_MLC/runs/2zcjcrvl
Running job on GPU : Tesla V100-PCIE-32GB
Namespace(BATCH_SIZE=128, CHECKPOINTS_PATH='/scratch/izar/santacro/checkpoints/', DATASET_PATH='/scratch/izar/santacro/final_data/', DEVICE='cuda:0', EMBEDDING='agnostic', EPOCH_NUM=300, FRACTION=70, HIDDEN_SIZE=8192, JOB_ID=256, LEARNING_RATE=1e-05, LEVEL='L1', LOAD_CHECKPOINT='no', MERGE_METHOD='fusion', MIN_LEARNING_RATE=1e-06, NUM_WORKERS=8, RANDOM_STATE=5, RUN_MODE='train', SAVE_CHECKPOINTS='yes', SPLITTING='progressive', TARGET_BASE='set', WANDB_ENTITY='msc-nicola', WANDB_LOGS='yes', WANDB_PROJECT='all_MLC')
Number of train samples : 9802
Number of val samples : 1089
Number of test samples : 5400
  0%|          | 0/300 [00:00<?, ?it/s]train/val metrics at epoch 1 | loss : 1.19/1.24 | micro_F1 : 0.27/0.31:   0%|          | 0/300 [00:03<?, ?it/s]train/val metrics at epoch 1 | loss : 1.19/1.24 | micro_F1 : 0.27/0.31:   0%|          | 1/300 [00:04<20:16,  4.07s/it]train/val metrics at epoch 2 | loss : 1.12/1.16 | micro_F1 : 0.32/0.32:   0%|          | 1/300 [00:07<20:16,  4.07s/it]train/val metrics at epoch 2 | loss : 1.12/1.16 | micro_F1 : 0.32/0.32:   1%|          | 2/300 [00:07<17:56,  3.61s/it]train/val metrics at epoch 3 | loss : 1.06/1.14 | micro_F1 : 0.34/0.33:   1%|          | 2/300 [00:10<17:56,  3.61s/it]train/val metrics at epoch 3 | loss : 1.06/1.14 | micro_F1 : 0.34/0.33:   1%|          | 3/300 [00:10<16:51,  3.41s/it]train/val metrics at epoch 4 | loss : 1.00/1.13 | micro_F1 : 0.37/0.36:   1%|          | 3/300 [00:13<16:51,  3.41s/it]train/val metrics at epoch 4 | loss : 1.00/1.13 | micro_F1 : 0.37/0.36:   1%|▏         | 4/300 [00:13<16:28,  3.34s/it]train/val metrics at epoch 5 | loss : 0.95/1.12 | micro_F1 : 0.39/0.36:   1%|▏         | 4/300 [00:16<16:28,  3.34s/it]train/val metrics at epoch 5 | loss : 0.95/1.12 | micro_F1 : 0.39/0.36:   2%|▏         | 5/300 [00:16<16:11,  3.29s/it]train/val metrics at epoch 6 | loss : 0.90/1.10 | micro_F1 : 0.41/0.37:   2%|▏         | 5/300 [00:19<16:11,  3.29s/it]train/val metrics at epoch 6 | loss : 0.90/1.10 | micro_F1 : 0.41/0.37:   2%|▏         | 6/300 [00:20<16:02,  3.27s/it]train/val metrics at epoch 7 | loss : 0.84/1.12 | micro_F1 : 0.44/0.37:   2%|▏         | 6/300 [00:23<16:02,  3.27s/it]train/val metrics at epoch 7 | loss : 0.84/1.12 | micro_F1 : 0.44/0.37:   2%|▏         | 7/300 [00:23<15:53,  3.25s/it]train/val metrics at epoch 8 | loss : 0.79/1.10 | micro_F1 : 0.47/0.38:   2%|▏         | 7/300 [00:26<15:53,  3.25s/it]train/val metrics at epoch 8 | loss : 0.79/1.10 | micro_F1 : 0.47/0.38:   3%|▎         | 8/300 [00:26<15:45,  3.24s/it]train/val metrics at epoch 9 | loss : 0.74/1.10 | micro_F1 : 0.48/0.39:   3%|▎         | 8/300 [00:29<15:45,  3.24s/it]train/val metrics at epoch 9 | loss : 0.74/1.10 | micro_F1 : 0.48/0.39:   3%|▎         | 9/300 [00:29<15:36,  3.22s/it]train/val metrics at epoch 10 | loss : 0.69/1.13 | micro_F1 : 0.51/0.39:   3%|▎         | 9/300 [00:32<15:36,  3.22s/it]train/val metrics at epoch 10 | loss : 0.69/1.13 | micro_F1 : 0.51/0.39:   3%|▎         | 10/300 [00:33<15:36,  3.23s/it]train/val metrics at epoch 11 | loss : 0.65/1.14 | micro_F1 : 0.52/0.39:   3%|▎         | 10/300 [00:35<15:36,  3.23s/it]train/val metrics at epoch 11 | loss : 0.65/1.14 | micro_F1 : 0.52/0.39:   4%|▎         | 11/300 [00:36<15:30,  3.22s/it]train/val metrics at epoch 12 | loss : 0.63/1.16 | micro_F1 : 0.54/0.40:   4%|▎         | 11/300 [00:39<15:30,  3.22s/it]train/val metrics at epoch 12 | loss : 0.63/1.16 | micro_F1 : 0.54/0.40:   4%|▍         | 12/300 [00:39<15:25,  3.21s/it]train/val metrics at epoch 13 | loss : 0.61/1.17 | micro_F1 : 0.55/0.40:   4%|▍         | 12/300 [00:42<15:25,  3.21s/it]train/val metrics at epoch 13 | loss : 0.61/1.17 | micro_F1 : 0.55/0.40:   4%|▍         | 13/300 [00:42<15:17,  3.20s/it]train/val metrics at epoch 14 | loss : 0.59/1.19 | micro_F1 : 0.56/0.41:   4%|▍         | 13/300 [00:45<15:17,  3.20s/it]train/val metrics at epoch 14 | loss : 0.59/1.19 | micro_F1 : 0.56/0.41:   5%|▍         | 14/300 [00:45<15:13,  3.20s/it]train/val metrics at epoch 15 | loss : 0.57/1.20 | micro_F1 : 0.57/0.42:   5%|▍         | 14/300 [00:48<15:13,  3.20s/it]train/val metrics at epoch 15 | loss : 0.57/1.20 | micro_F1 : 0.57/0.42:   5%|▌         | 15/300 [00:48<15:08,  3.19s/it]train/val metrics at epoch 16 | loss : 0.56/1.20 | micro_F1 : 0.58/0.41:   5%|▌         | 15/300 [00:51<15:08,  3.19s/it]train/val metrics at epoch 16 | loss : 0.56/1.20 | micro_F1 : 0.58/0.41:   5%|▌         | 16/300 [00:52<15:03,  3.18s/it]train/val metrics at epoch 17 | loss : 0.55/1.22 | micro_F1 : 0.58/0.40:   5%|▌         | 16/300 [00:55<15:03,  3.18s/it]train/val metrics at epoch 17 | loss : 0.55/1.22 | micro_F1 : 0.58/0.40:   6%|▌         | 17/300 [00:55<15:03,  3.19s/it]train/val metrics at epoch 18 | loss : 0.54/1.20 | micro_F1 : 0.59/0.41:   6%|▌         | 17/300 [00:58<15:03,  3.19s/it]train/val metrics at epoch 18 | loss : 0.54/1.20 | micro_F1 : 0.59/0.41:   6%|▌         | 17/300 [00:59<16:24,  3.48s/it]
wandb: Waiting for W&B process to finish... (success).
wandb: 
wandb: Run history:
wandb:          epoch ▁
wandb:  learning rate ▁
wandb:           time ▁
wandb:     train loss ▁
wandb: train macro F1 ▁
wandb: train micro F1 ▁
wandb:       val loss ▁
wandb:   val macro F1 ▁
wandb:   val micro F1 ▁
wandb: 
wandb: Run summary:
wandb:          epoch 18
wandb:  learning rate 0.0
wandb:           time 60.872
wandb:     train loss 0.54242
wandb: train macro F1 0.50448
wandb: train micro F1 0.58505
wandb:       val loss 1.20492
wandb:   val macro F1 0.31034
wandb:   val micro F1 0.41341
wandb: 
wandb: 🚀 View run kind-river-257 at: https://wandb.ai/msc-nicola/train_all_MLC/runs/2zcjcrvl
wandb: Synced 5 W&B file(s), 1 media file(s), 1 artifact file(s) and 0 other file(s)
wandb: Find logs at: ./wandb/run-20230627_033450-2zcjcrvl/logs
wandb: Currently logged in as: tha-santacruz (msc-nicola). Use `wandb login --relogin` to force relogin
wandb: Tracking run with wandb version 0.15.4
wandb: Run data is saved locally in /home/santacro/masters_thesis/all_runs/wandb/run-20230627_033613-ntqhznqo
wandb: Run `wandb offline` to turn off syncing.
wandb: Syncing run unique-donkey-256
wandb: ⭐️ View project at https://wandb.ai/msc-nicola/test_all_MLC
wandb: 🚀 View run at https://wandb.ai/msc-nicola/test_all_MLC/runs/ntqhznqo
Running job on GPU : Tesla V100-PCIE-32GB
Namespace(BATCH_SIZE=128, CHECKPOINTS_PATH='/scratch/izar/santacro/checkpoints/', DATASET_PATH='/scratch/izar/santacro/final_data/', DEVICE='cuda:0', EMBEDDING='agnostic', EPOCH_NUM=300, FRACTION=70, HIDDEN_SIZE=8192, JOB_ID=256, LEARNING_RATE=1e-05, LEVEL='L1', LOAD_CHECKPOINT='yes', MERGE_METHOD='fusion', MIN_LEARNING_RATE=1e-06, NUM_WORKERS=8, RANDOM_STATE=5, RUN_MODE='test', SAVE_CHECKPOINTS='yes', SPLITTING='progressive', TARGET_BASE='set', WANDB_ENTITY='msc-nicola', WANDB_LOGS='yes', WANDB_PROJECT='all_MLC')
Number of train samples : 9802
Number of val samples : 1089
Number of test samples : 5400
Loaded model state dict from file /scratch/izar/santacro/checkpoints//5_agnostic_embedding_L1_level_fusion_merging_progressive_70%_8192.pth
wandb: Waiting for W&B process to finish... (success).
wandb: 
wandb: Run history:
wandb:     test loss ▁
wandb: test macro F1 ▁
wandb:  test macro H ▁
wandb: test micro F1 ▁
wandb: 
wandb: Run summary:
wandb:     test loss 1.27069
wandb: test macro F1 0.31659
wandb:  test macro H 1.86481
wandb: test micro F1 0.41569
wandb: 
wandb: 🚀 View run unique-donkey-256 at: https://wandb.ai/msc-nicola/test_all_MLC/runs/ntqhznqo
wandb: Synced 4 W&B file(s), 10 media file(s), 1 artifact file(s) and 0 other file(s)
wandb: Find logs at: ./wandb/run-20230627_033613-ntqhznqo/logs
