/usr/share/lmod/lmod/init/sh: line 20: /usr/share/lmod/lmod/libexec//clearMT_cmd: No such file or directory
wandb: Currently logged in as: tha-santacruz (msc-nicola). Use `wandb login --relogin` to force relogin
wandb: Tracking run with wandb version 0.15.4
wandb: Run data is saved locally in /home/santacro/masters_thesis/all_runs/wandb/run-20230627_032219-q1r576uq
wandb: Run `wandb offline` to turn off syncing.
wandb: Syncing run devoted-feather-195
wandb: ⭐️ View project at https://wandb.ai/msc-nicola/train_all_MLC
wandb: 🚀 View run at https://wandb.ai/msc-nicola/train_all_MLC/runs/q1r576uq
Running job on GPU : Tesla V100-PCIE-32GB
Namespace(BATCH_SIZE=128, CHECKPOINTS_PATH='/scratch/izar/santacro/checkpoints/', DATASET_PATH='/scratch/izar/santacro/final_data/', DEVICE='cuda:0', EMBEDDING='longformer', EPOCH_NUM=300, FRACTION=50, HIDDEN_SIZE=8192, JOB_ID=196, LEARNING_RATE=1e-05, LEVEL='L1', LOAD_CHECKPOINT='no', MERGE_METHOD='fusion', MIN_LEARNING_RATE=1e-06, NUM_WORKERS=8, RANDOM_STATE=4, RUN_MODE='train', SAVE_CHECKPOINTS='yes', SPLITTING='progressive', TARGET_BASE='set', WANDB_ENTITY='msc-nicola', WANDB_LOGS='yes', WANDB_PROJECT='all_MLC')
Number of train samples : 9288
Number of val samples : 1032
Number of test samples : 5702
  0%|          | 0/300 [00:00<?, ?it/s]train/val metrics at epoch 1 | loss : 1.16/1.18 | micro_F1 : 0.22/0.23:   0%|          | 0/300 [00:02<?, ?it/s]train/val metrics at epoch 1 | loss : 1.16/1.18 | micro_F1 : 0.22/0.23:   0%|          | 1/300 [00:02<14:33,  2.92s/it]train/val metrics at epoch 2 | loss : 1.11/1.18 | micro_F1 : 0.26/0.26:   0%|          | 1/300 [00:04<14:33,  2.92s/it]train/val metrics at epoch 2 | loss : 1.11/1.18 | micro_F1 : 0.26/0.26:   1%|          | 2/300 [00:04<11:55,  2.40s/it]train/val metrics at epoch 3 | loss : 1.09/1.12 | micro_F1 : 0.29/0.29:   1%|          | 2/300 [00:06<11:55,  2.40s/it]train/val metrics at epoch 3 | loss : 1.09/1.12 | micro_F1 : 0.29/0.29:   1%|          | 3/300 [00:07<11:10,  2.26s/it]train/val metrics at epoch 4 | loss : 1.07/1.09 | micro_F1 : 0.30/0.34:   1%|          | 3/300 [00:08<11:10,  2.26s/it]train/val metrics at epoch 4 | loss : 1.07/1.09 | micro_F1 : 0.30/0.34:   1%|▏         | 4/300 [00:09<10:42,  2.17s/it]train/val metrics at epoch 5 | loss : 1.05/1.05 | micro_F1 : 0.32/0.34:   1%|▏         | 4/300 [00:10<10:42,  2.17s/it]train/val metrics at epoch 5 | loss : 1.05/1.05 | micro_F1 : 0.32/0.34:   2%|▏         | 5/300 [00:11<10:24,  2.12s/it]train/val metrics at epoch 6 | loss : 1.03/1.08 | micro_F1 : 0.33/0.35:   2%|▏         | 5/300 [00:12<10:24,  2.12s/it]train/val metrics at epoch 6 | loss : 1.03/1.08 | micro_F1 : 0.33/0.35:   2%|▏         | 6/300 [00:13<10:17,  2.10s/it]train/val metrics at epoch 7 | loss : 1.01/1.01 | micro_F1 : 0.35/0.38:   2%|▏         | 6/300 [00:15<10:17,  2.10s/it]train/val metrics at epoch 7 | loss : 1.01/1.01 | micro_F1 : 0.35/0.38:   2%|▏         | 7/300 [00:15<10:15,  2.10s/it]train/val metrics at epoch 8 | loss : 0.99/1.05 | micro_F1 : 0.35/0.36:   2%|▏         | 7/300 [00:17<10:15,  2.10s/it]train/val metrics at epoch 8 | loss : 0.99/1.05 | micro_F1 : 0.35/0.36:   3%|▎         | 8/300 [00:17<10:08,  2.08s/it]train/val metrics at epoch 9 | loss : 0.98/1.00 | micro_F1 : 0.36/0.37:   3%|▎         | 8/300 [00:19<10:08,  2.08s/it]train/val metrics at epoch 9 | loss : 0.98/1.00 | micro_F1 : 0.36/0.37:   3%|▎         | 9/300 [00:19<10:06,  2.09s/it]train/val metrics at epoch 10 | loss : 0.96/1.01 | micro_F1 : 0.37/0.38:   3%|▎         | 9/300 [00:21<10:06,  2.09s/it]train/val metrics at epoch 10 | loss : 0.96/1.01 | micro_F1 : 0.37/0.38:   3%|▎         | 10/300 [00:21<10:00,  2.07s/it]train/val metrics at epoch 11 | loss : 0.94/1.02 | micro_F1 : 0.37/0.30:   3%|▎         | 10/300 [00:23<10:00,  2.07s/it]train/val metrics at epoch 11 | loss : 0.94/1.02 | micro_F1 : 0.37/0.30:   4%|▎         | 11/300 [00:23<09:54,  2.06s/it]train/val metrics at epoch 12 | loss : 0.93/1.02 | micro_F1 : 0.38/0.29:   4%|▎         | 11/300 [00:25<09:54,  2.06s/it]train/val metrics at epoch 12 | loss : 0.93/1.02 | micro_F1 : 0.38/0.29:   4%|▍         | 12/300 [00:25<09:55,  2.07s/it]train/val metrics at epoch 13 | loss : 0.91/1.03 | micro_F1 : 0.38/0.28:   4%|▍         | 12/300 [00:27<09:55,  2.07s/it]train/val metrics at epoch 13 | loss : 0.91/1.03 | micro_F1 : 0.38/0.28:   4%|▍         | 13/300 [00:27<09:57,  2.08s/it]train/val metrics at epoch 14 | loss : 0.90/1.02 | micro_F1 : 0.39/0.37:   4%|▍         | 13/300 [00:29<09:57,  2.08s/it]train/val metrics at epoch 14 | loss : 0.90/1.02 | micro_F1 : 0.39/0.37:   5%|▍         | 14/300 [00:29<09:51,  2.07s/it]train/val metrics at epoch 15 | loss : 0.89/0.97 | micro_F1 : 0.40/0.43:   5%|▍         | 14/300 [00:31<09:51,  2.07s/it]train/val metrics at epoch 15 | loss : 0.89/0.97 | micro_F1 : 0.40/0.43:   5%|▌         | 15/300 [00:31<09:49,  2.07s/it]train/val metrics at epoch 16 | loss : 0.88/1.02 | micro_F1 : 0.40/0.37:   5%|▌         | 15/300 [00:33<09:49,  2.07s/it]train/val metrics at epoch 16 | loss : 0.88/1.02 | micro_F1 : 0.40/0.37:   5%|▌         | 16/300 [00:33<09:49,  2.07s/it]train/val metrics at epoch 17 | loss : 0.87/0.97 | micro_F1 : 0.40/0.37:   5%|▌         | 16/300 [00:35<09:49,  2.07s/it]train/val metrics at epoch 17 | loss : 0.87/0.97 | micro_F1 : 0.40/0.37:   6%|▌         | 17/300 [00:35<09:44,  2.06s/it]train/val metrics at epoch 18 | loss : 0.87/1.00 | micro_F1 : 0.41/0.33:   6%|▌         | 17/300 [00:37<09:44,  2.06s/it]train/val metrics at epoch 18 | loss : 0.87/1.00 | micro_F1 : 0.41/0.33:   6%|▌         | 18/300 [00:37<09:41,  2.06s/it]train/val metrics at epoch 19 | loss : 0.86/1.00 | micro_F1 : 0.40/0.37:   6%|▌         | 18/300 [00:39<09:41,  2.06s/it]train/val metrics at epoch 19 | loss : 0.86/1.00 | micro_F1 : 0.40/0.37:   6%|▋         | 19/300 [00:39<09:34,  2.04s/it]train/val metrics at epoch 20 | loss : 0.85/1.00 | micro_F1 : 0.41/0.39:   6%|▋         | 19/300 [00:41<09:34,  2.04s/it]train/val metrics at epoch 20 | loss : 0.85/1.00 | micro_F1 : 0.41/0.39:   7%|▋         | 20/300 [00:42<09:31,  2.04s/it]train/val metrics at epoch 21 | loss : 0.85/0.99 | micro_F1 : 0.41/0.39:   7%|▋         | 20/300 [00:43<09:31,  2.04s/it]train/val metrics at epoch 21 | loss : 0.85/0.99 | micro_F1 : 0.41/0.39:   7%|▋         | 21/300 [00:43<09:23,  2.02s/it]train/val metrics at epoch 22 | loss : 0.85/1.13 | micro_F1 : 0.41/0.37:   7%|▋         | 21/300 [00:45<09:23,  2.02s/it]train/val metrics at epoch 22 | loss : 0.85/1.13 | micro_F1 : 0.41/0.37:   7%|▋         | 22/300 [00:45<09:21,  2.02s/it]train/val metrics at epoch 23 | loss : 0.85/0.98 | micro_F1 : 0.41/0.37:   7%|▋         | 22/300 [00:47<09:21,  2.02s/it]train/val metrics at epoch 23 | loss : 0.85/0.98 | micro_F1 : 0.41/0.37:   8%|▊         | 23/300 [00:47<09:16,  2.01s/it]train/val metrics at epoch 24 | loss : 0.84/1.00 | micro_F1 : 0.41/0.39:   8%|▊         | 23/300 [00:49<09:16,  2.01s/it]train/val metrics at epoch 24 | loss : 0.84/1.00 | micro_F1 : 0.41/0.39:   8%|▊         | 24/300 [00:50<09:17,  2.02s/it]train/val metrics at epoch 25 | loss : 0.84/1.04 | micro_F1 : 0.41/0.37:   8%|▊         | 24/300 [00:51<09:17,  2.02s/it]train/val metrics at epoch 25 | loss : 0.84/1.04 | micro_F1 : 0.41/0.37:   8%|▊         | 25/300 [00:52<09:22,  2.04s/it]train/val metrics at epoch 26 | loss : 0.84/1.03 | micro_F1 : 0.41/0.38:   8%|▊         | 25/300 [00:53<09:22,  2.04s/it]train/val metrics at epoch 26 | loss : 0.84/1.03 | micro_F1 : 0.41/0.38:   9%|▊         | 26/300 [00:54<09:20,  2.04s/it]train/val metrics at epoch 27 | loss : 0.84/0.98 | micro_F1 : 0.42/0.40:   9%|▊         | 26/300 [00:56<09:20,  2.04s/it]train/val metrics at epoch 27 | loss : 0.84/0.98 | micro_F1 : 0.42/0.40:   9%|▊         | 26/300 [00:56<09:58,  2.19s/it]
wandb: Waiting for W&B process to finish... (success).
wandb: 
wandb: Run history:
wandb:          epoch ▁
wandb:  learning rate ▁
wandb:           time ▁
wandb:     train loss ▁
wandb: train macro F1 ▁
wandb: train micro F1 ▁
wandb:       val loss ▁
wandb:   val macro F1 ▁
wandb:   val micro F1 ▁
wandb: 
wandb: Run summary:
wandb:          epoch 27
wandb:  learning rate 0.0
wandb:           time 58.30084
wandb:     train loss 0.83656
wandb: train macro F1 0.34939
wandb: train micro F1 0.41899
wandb:       val loss 0.97518
wandb:   val macro F1 0.30813
wandb:   val micro F1 0.39661
wandb: 
wandb: 🚀 View run devoted-feather-195 at: https://wandb.ai/msc-nicola/train_all_MLC/runs/q1r576uq
wandb: Synced 5 W&B file(s), 1 media file(s), 1 artifact file(s) and 0 other file(s)
wandb: Find logs at: ./wandb/run-20230627_032219-q1r576uq/logs
wandb: Currently logged in as: tha-santacruz (msc-nicola). Use `wandb login --relogin` to force relogin
wandb: Tracking run with wandb version 0.15.4
wandb: Run data is saved locally in /home/santacro/masters_thesis/all_runs/wandb/run-20230627_032341-vyjiqflk
wandb: Run `wandb offline` to turn off syncing.
wandb: Syncing run ruby-snow-195
wandb: ⭐️ View project at https://wandb.ai/msc-nicola/test_all_MLC
wandb: 🚀 View run at https://wandb.ai/msc-nicola/test_all_MLC/runs/vyjiqflk
Running job on GPU : Tesla V100-PCIE-32GB
Namespace(BATCH_SIZE=128, CHECKPOINTS_PATH='/scratch/izar/santacro/checkpoints/', DATASET_PATH='/scratch/izar/santacro/final_data/', DEVICE='cuda:0', EMBEDDING='longformer', EPOCH_NUM=300, FRACTION=50, HIDDEN_SIZE=8192, JOB_ID=196, LEARNING_RATE=1e-05, LEVEL='L1', LOAD_CHECKPOINT='yes', MERGE_METHOD='fusion', MIN_LEARNING_RATE=1e-06, NUM_WORKERS=8, RANDOM_STATE=4, RUN_MODE='test', SAVE_CHECKPOINTS='yes', SPLITTING='progressive', TARGET_BASE='set', WANDB_ENTITY='msc-nicola', WANDB_LOGS='yes', WANDB_PROJECT='all_MLC')
Number of train samples : 9288
Number of val samples : 1032
Number of test samples : 5702
Loaded model state dict from file /scratch/izar/santacro/checkpoints//4_longformer_embedding_L1_level_fusion_merging_progressive_50%_8192.pth
wandb: Waiting for W&B process to finish... (success).
wandb: - 0.135 MB of 0.190 MB uploaded (0.000 MB deduped)wandb: \ 0.190 MB of 0.190 MB uploaded (0.000 MB deduped)wandb: | 0.190 MB of 0.196 MB uploaded (0.000 MB deduped)wandb: / 0.196 MB of 0.196 MB uploaded (0.000 MB deduped)wandb: 
wandb: Run history:
wandb:     test loss ▁
wandb: test macro F1 ▁
wandb:  test macro H ▁
wandb: test micro F1 ▁
wandb: 
wandb: Run summary:
wandb:     test loss 1.06728
wandb: test macro F1 0.2982
wandb:  test macro H 2.31884
wandb: test micro F1 0.3752
wandb: 
wandb: 🚀 View run ruby-snow-195 at: https://wandb.ai/msc-nicola/test_all_MLC/runs/vyjiqflk
wandb: Synced 4 W&B file(s), 10 media file(s), 1 artifact file(s) and 0 other file(s)
wandb: Find logs at: ./wandb/run-20230627_032341-vyjiqflk/logs
