/usr/share/lmod/lmod/init/sh: line 20: /usr/share/lmod/lmod/libexec//clearMT_cmd: No such file or directory
wandb: Currently logged in as: tha-santacruz (msc-nicola). Use `wandb login --relogin` to force relogin
wandb: Tracking run with wandb version 0.15.4
wandb: Run data is saved locally in /home/santacro/masters_thesis/all_runs/wandb/run-20230627_032925-1f6ods4l
wandb: Run `wandb offline` to turn off syncing.
wandb: Syncing run magic-aardvark-229
wandb: ⭐️ View project at https://wandb.ai/msc-nicola/train_all_MLC
wandb: 🚀 View run at https://wandb.ai/msc-nicola/train_all_MLC/runs/1f6ods4l
Running job on GPU : Tesla V100-PCIE-32GB
Namespace(BATCH_SIZE=128, CHECKPOINTS_PATH='/scratch/izar/santacro/checkpoints/', DATASET_PATH='/scratch/izar/santacro/final_data/', DEVICE='cuda:0', EMBEDDING='doc2vec', EPOCH_NUM=300, FRACTION=40, HIDDEN_SIZE=8192, JOB_ID=229, LEARNING_RATE=1e-05, LEVEL='L2', LOAD_CHECKPOINT='no', MERGE_METHOD='selection', MIN_LEARNING_RATE=1e-06, NUM_WORKERS=8, RANDOM_STATE=5, RUN_MODE='train', SAVE_CHECKPOINTS='yes', SPLITTING='species', TARGET_BASE='set', WANDB_ENTITY='msc-nicola', WANDB_LOGS='yes', WANDB_PROJECT='all_MLC')
Number of train samples : 9066
Number of val samples : 929
Number of test samples : 9397
  0%|          | 0/300 [00:00<?, ?it/s]train/val metrics at epoch 1 | loss : 1.32/1.09 | micro_F1 : 0.09/0.09:   0%|          | 0/300 [00:02<?, ?it/s]train/val metrics at epoch 1 | loss : 1.32/1.09 | micro_F1 : 0.09/0.09:   0%|          | 1/300 [00:03<15:16,  3.06s/it]train/val metrics at epoch 2 | loss : 1.26/1.06 | micro_F1 : 0.11/0.10:   0%|          | 1/300 [00:05<15:16,  3.06s/it]train/val metrics at epoch 2 | loss : 1.26/1.06 | micro_F1 : 0.11/0.10:   1%|          | 2/300 [00:05<13:19,  2.68s/it]train/val metrics at epoch 3 | loss : 1.22/1.03 | micro_F1 : 0.12/0.11:   1%|          | 2/300 [00:07<13:19,  2.68s/it]train/val metrics at epoch 3 | loss : 1.22/1.03 | micro_F1 : 0.12/0.11:   1%|          | 3/300 [00:07<12:44,  2.57s/it]train/val metrics at epoch 4 | loss : 1.17/1.01 | micro_F1 : 0.13/0.11:   1%|          | 3/300 [00:10<12:44,  2.57s/it]train/val metrics at epoch 4 | loss : 1.17/1.01 | micro_F1 : 0.13/0.11:   1%|▏         | 4/300 [00:10<12:39,  2.56s/it]train/val metrics at epoch 5 | loss : 1.13/0.98 | micro_F1 : 0.14/0.12:   1%|▏         | 4/300 [00:12<12:39,  2.56s/it]train/val metrics at epoch 5 | loss : 1.13/0.98 | micro_F1 : 0.14/0.12:   2%|▏         | 5/300 [00:12<12:27,  2.53s/it]train/val metrics at epoch 6 | loss : 1.09/0.95 | micro_F1 : 0.15/0.13:   2%|▏         | 5/300 [00:15<12:27,  2.53s/it]train/val metrics at epoch 6 | loss : 1.09/0.95 | micro_F1 : 0.15/0.13:   2%|▏         | 6/300 [00:15<12:18,  2.51s/it]train/val metrics at epoch 7 | loss : 1.05/0.94 | micro_F1 : 0.16/0.14:   2%|▏         | 6/300 [00:17<12:18,  2.51s/it]train/val metrics at epoch 7 | loss : 1.05/0.94 | micro_F1 : 0.16/0.14:   2%|▏         | 7/300 [00:17<12:05,  2.47s/it]train/val metrics at epoch 8 | loss : 1.02/0.92 | micro_F1 : 0.17/0.14:   2%|▏         | 7/300 [00:20<12:05,  2.47s/it]train/val metrics at epoch 8 | loss : 1.02/0.92 | micro_F1 : 0.17/0.14:   3%|▎         | 8/300 [00:20<11:58,  2.46s/it]train/val metrics at epoch 9 | loss : 0.99/0.92 | micro_F1 : 0.18/0.15:   3%|▎         | 8/300 [00:22<11:58,  2.46s/it]train/val metrics at epoch 9 | loss : 0.99/0.92 | micro_F1 : 0.18/0.15:   3%|▎         | 9/300 [00:22<11:58,  2.47s/it]train/val metrics at epoch 10 | loss : 0.96/0.90 | micro_F1 : 0.18/0.15:   3%|▎         | 9/300 [00:24<11:58,  2.47s/it]train/val metrics at epoch 10 | loss : 0.96/0.90 | micro_F1 : 0.18/0.15:   3%|▎         | 10/300 [00:25<11:52,  2.46s/it]train/val metrics at epoch 11 | loss : 0.93/0.89 | micro_F1 : 0.19/0.16:   3%|▎         | 10/300 [00:27<11:52,  2.46s/it]train/val metrics at epoch 11 | loss : 0.93/0.89 | micro_F1 : 0.19/0.16:   4%|▎         | 11/300 [00:27<11:53,  2.47s/it]train/val metrics at epoch 12 | loss : 0.91/0.88 | micro_F1 : 0.19/0.16:   4%|▎         | 11/300 [00:29<11:53,  2.47s/it]train/val metrics at epoch 12 | loss : 0.91/0.88 | micro_F1 : 0.19/0.16:   4%|▍         | 12/300 [00:30<11:54,  2.48s/it]train/val metrics at epoch 13 | loss : 0.88/0.89 | micro_F1 : 0.20/0.16:   4%|▍         | 12/300 [00:32<11:54,  2.48s/it]train/val metrics at epoch 13 | loss : 0.88/0.89 | micro_F1 : 0.20/0.16:   4%|▍         | 13/300 [00:32<11:44,  2.45s/it]train/val metrics at epoch 14 | loss : 0.86/0.87 | micro_F1 : 0.21/0.16:   4%|▍         | 13/300 [00:34<11:44,  2.45s/it]train/val metrics at epoch 14 | loss : 0.86/0.87 | micro_F1 : 0.21/0.16:   5%|▍         | 14/300 [00:34<11:36,  2.44s/it]train/val metrics at epoch 15 | loss : 0.84/0.88 | micro_F1 : 0.21/0.16:   5%|▍         | 14/300 [00:37<11:36,  2.44s/it]train/val metrics at epoch 15 | loss : 0.84/0.88 | micro_F1 : 0.21/0.16:   5%|▌         | 15/300 [00:37<11:35,  2.44s/it]train/val metrics at epoch 16 | loss : 0.82/0.87 | micro_F1 : 0.22/0.17:   5%|▌         | 15/300 [00:39<11:35,  2.44s/it]train/val metrics at epoch 16 | loss : 0.82/0.87 | micro_F1 : 0.22/0.17:   5%|▌         | 16/300 [00:39<11:30,  2.43s/it]train/val metrics at epoch 17 | loss : 0.80/0.88 | micro_F1 : 0.22/0.17:   5%|▌         | 16/300 [00:42<11:30,  2.43s/it]train/val metrics at epoch 17 | loss : 0.80/0.88 | micro_F1 : 0.22/0.17:   6%|▌         | 17/300 [00:42<11:26,  2.43s/it]train/val metrics at epoch 18 | loss : 0.79/1.02 | micro_F1 : 0.23/0.17:   6%|▌         | 17/300 [00:44<11:26,  2.43s/it]train/val metrics at epoch 18 | loss : 0.79/1.02 | micro_F1 : 0.23/0.17:   6%|▌         | 18/300 [00:44<11:25,  2.43s/it]train/val metrics at epoch 19 | loss : 0.77/0.87 | micro_F1 : 0.23/0.17:   6%|▌         | 18/300 [00:46<11:25,  2.43s/it]train/val metrics at epoch 19 | loss : 0.77/0.87 | micro_F1 : 0.23/0.17:   6%|▋         | 19/300 [00:47<11:24,  2.44s/it]train/val metrics at epoch 20 | loss : 0.75/0.89 | micro_F1 : 0.24/0.18:   6%|▋         | 19/300 [00:49<11:24,  2.44s/it]train/val metrics at epoch 20 | loss : 0.75/0.89 | micro_F1 : 0.24/0.18:   7%|▋         | 20/300 [00:49<11:21,  2.44s/it]train/val metrics at epoch 21 | loss : 0.75/0.88 | micro_F1 : 0.24/0.18:   7%|▋         | 20/300 [00:52<11:21,  2.44s/it]train/val metrics at epoch 21 | loss : 0.75/0.88 | micro_F1 : 0.24/0.18:   7%|▋         | 21/300 [00:52<11:53,  2.56s/it]train/val metrics at epoch 22 | loss : 0.74/0.87 | micro_F1 : 0.24/0.18:   7%|▋         | 21/300 [00:54<11:53,  2.56s/it]train/val metrics at epoch 22 | loss : 0.74/0.87 | micro_F1 : 0.24/0.18:   7%|▋         | 22/300 [00:54<11:52,  2.56s/it]train/val metrics at epoch 23 | loss : 0.73/0.86 | micro_F1 : 0.24/0.18:   7%|▋         | 22/300 [00:57<11:52,  2.56s/it]train/val metrics at epoch 23 | loss : 0.73/0.86 | micro_F1 : 0.24/0.18:   8%|▊         | 23/300 [00:57<11:39,  2.52s/it]train/val metrics at epoch 24 | loss : 0.73/0.87 | micro_F1 : 0.25/0.18:   8%|▊         | 23/300 [00:59<11:39,  2.52s/it]train/val metrics at epoch 24 | loss : 0.73/0.87 | micro_F1 : 0.25/0.18:   8%|▊         | 24/300 [00:59<11:25,  2.48s/it]train/val metrics at epoch 25 | loss : 0.72/0.89 | micro_F1 : 0.25/0.18:   8%|▊         | 24/300 [01:02<11:25,  2.48s/it]train/val metrics at epoch 25 | loss : 0.72/0.89 | micro_F1 : 0.25/0.18:   8%|▊         | 25/300 [01:02<11:24,  2.49s/it]train/val metrics at epoch 26 | loss : 0.72/0.88 | micro_F1 : 0.25/0.18:   8%|▊         | 25/300 [01:04<11:24,  2.49s/it]train/val metrics at epoch 26 | loss : 0.72/0.88 | micro_F1 : 0.25/0.18:   9%|▊         | 26/300 [01:04<11:17,  2.47s/it]train/val metrics at epoch 27 | loss : 0.72/0.87 | micro_F1 : 0.25/0.18:   9%|▊         | 26/300 [01:06<11:17,  2.47s/it]train/val metrics at epoch 27 | loss : 0.72/0.87 | micro_F1 : 0.25/0.18:   9%|▉         | 27/300 [01:07<11:08,  2.45s/it]train/val metrics at epoch 28 | loss : 0.71/0.86 | micro_F1 : 0.25/0.19:   9%|▉         | 27/300 [01:09<11:08,  2.45s/it]train/val metrics at epoch 28 | loss : 0.71/0.86 | micro_F1 : 0.25/0.19:   9%|▉         | 28/300 [01:09<10:59,  2.42s/it]train/val metrics at epoch 29 | loss : 0.71/0.86 | micro_F1 : 0.25/0.19:   9%|▉         | 28/300 [01:11<10:59,  2.42s/it]train/val metrics at epoch 29 | loss : 0.71/0.86 | micro_F1 : 0.25/0.19:  10%|▉         | 29/300 [01:11<10:56,  2.42s/it]train/val metrics at epoch 30 | loss : 0.71/0.88 | micro_F1 : 0.25/0.18:  10%|▉         | 29/300 [01:14<10:56,  2.42s/it]train/val metrics at epoch 30 | loss : 0.71/0.88 | micro_F1 : 0.25/0.18:  10%|█         | 30/300 [01:14<10:57,  2.44s/it]train/val metrics at epoch 31 | loss : 0.71/0.87 | micro_F1 : 0.25/0.18:  10%|█         | 30/300 [01:16<10:57,  2.44s/it]train/val metrics at epoch 31 | loss : 0.71/0.87 | micro_F1 : 0.25/0.18:  10%|█         | 31/300 [01:16<10:56,  2.44s/it]train/val metrics at epoch 32 | loss : 0.71/0.87 | micro_F1 : 0.25/0.18:  10%|█         | 31/300 [01:19<10:56,  2.44s/it]train/val metrics at epoch 32 | loss : 0.71/0.87 | micro_F1 : 0.25/0.18:  11%|█         | 32/300 [01:19<10:53,  2.44s/it]train/val metrics at epoch 33 | loss : 0.71/0.87 | micro_F1 : 0.25/0.19:  11%|█         | 32/300 [01:21<10:53,  2.44s/it]train/val metrics at epoch 33 | loss : 0.71/0.87 | micro_F1 : 0.25/0.19:  11%|█         | 33/300 [01:21<10:50,  2.44s/it]train/val metrics at epoch 34 | loss : 0.70/0.86 | micro_F1 : 0.25/0.19:  11%|█         | 33/300 [01:24<10:50,  2.44s/it]train/val metrics at epoch 34 | loss : 0.70/0.86 | micro_F1 : 0.25/0.19:  11%|█▏        | 34/300 [01:24<10:54,  2.46s/it]train/val metrics at epoch 35 | loss : 0.70/0.90 | micro_F1 : 0.26/0.18:  11%|█▏        | 34/300 [01:26<10:54,  2.46s/it]train/val metrics at epoch 35 | loss : 0.70/0.90 | micro_F1 : 0.26/0.18:  12%|█▏        | 35/300 [01:26<10:50,  2.46s/it]train/val metrics at epoch 36 | loss : 0.70/0.88 | micro_F1 : 0.25/0.19:  12%|█▏        | 35/300 [01:28<10:50,  2.46s/it]train/val metrics at epoch 36 | loss : 0.70/0.88 | micro_F1 : 0.25/0.19:  12%|█▏        | 36/300 [01:29<10:43,  2.44s/it]train/val metrics at epoch 37 | loss : 0.70/0.87 | micro_F1 : 0.26/0.19:  12%|█▏        | 36/300 [01:31<10:43,  2.44s/it]train/val metrics at epoch 37 | loss : 0.70/0.87 | micro_F1 : 0.26/0.19:  12%|█▏        | 37/300 [01:31<10:38,  2.43s/it]train/val metrics at epoch 38 | loss : 0.69/0.89 | micro_F1 : 0.26/0.18:  12%|█▏        | 37/300 [01:33<10:38,  2.43s/it]train/val metrics at epoch 38 | loss : 0.69/0.89 | micro_F1 : 0.26/0.18:  13%|█▎        | 38/300 [01:33<10:38,  2.44s/it]train/val metrics at epoch 39 | loss : 0.70/0.89 | micro_F1 : 0.26/0.18:  13%|█▎        | 38/300 [01:36<10:38,  2.44s/it]train/val metrics at epoch 39 | loss : 0.70/0.89 | micro_F1 : 0.26/0.18:  13%|█▎        | 39/300 [01:36<10:36,  2.44s/it]train/val metrics at epoch 40 | loss : 0.69/0.92 | micro_F1 : 0.26/0.18:  13%|█▎        | 39/300 [01:38<10:36,  2.44s/it]train/val metrics at epoch 40 | loss : 0.69/0.92 | micro_F1 : 0.26/0.18:  13%|█▎        | 40/300 [01:38<10:31,  2.43s/it]train/val metrics at epoch 41 | loss : 0.69/0.89 | micro_F1 : 0.26/0.19:  13%|█▎        | 40/300 [01:41<10:31,  2.43s/it]train/val metrics at epoch 41 | loss : 0.69/0.89 | micro_F1 : 0.26/0.19:  14%|█▎        | 41/300 [01:41<10:29,  2.43s/it]train/val metrics at epoch 42 | loss : 0.69/0.87 | micro_F1 : 0.26/0.18:  14%|█▎        | 41/300 [01:43<10:29,  2.43s/it]train/val metrics at epoch 42 | loss : 0.69/0.87 | micro_F1 : 0.26/0.18:  14%|█▍        | 42/300 [01:43<10:28,  2.43s/it]train/val metrics at epoch 43 | loss : 0.69/0.88 | micro_F1 : 0.26/0.18:  14%|█▍        | 42/300 [01:45<10:28,  2.43s/it]train/val metrics at epoch 43 | loss : 0.69/0.88 | micro_F1 : 0.26/0.18:  14%|█▍        | 43/300 [01:46<10:32,  2.46s/it]train/val metrics at epoch 44 | loss : 0.69/0.88 | micro_F1 : 0.26/0.18:  14%|█▍        | 43/300 [01:48<10:32,  2.46s/it]train/val metrics at epoch 44 | loss : 0.69/0.88 | micro_F1 : 0.26/0.18:  14%|█▍        | 43/300 [01:49<10:52,  2.54s/it]
wandb: Waiting for W&B process to finish... (success).
wandb: 
wandb: Run history:
wandb:          epoch ▁
wandb:  learning rate ▁
wandb:           time ▁
wandb:     train loss ▁
wandb: train macro F1 ▁
wandb: train micro F1 ▁
wandb:       val loss ▁
wandb:   val macro F1 ▁
wandb:   val micro F1 ▁
wandb: 
wandb: Run summary:
wandb:          epoch 44
wandb:  learning rate 0.0
wandb:           time 110.67855
wandb:     train loss 0.68634
wandb: train macro F1 0.20587
wandb: train micro F1 0.25947
wandb:       val loss 0.88244
wandb:   val macro F1 0.10927
wandb:   val micro F1 0.18401
wandb: 
wandb: 🚀 View run magic-aardvark-229 at: https://wandb.ai/msc-nicola/train_all_MLC/runs/1f6ods4l
wandb: Synced 5 W&B file(s), 1 media file(s), 1 artifact file(s) and 0 other file(s)
wandb: Find logs at: ./wandb/run-20230627_032925-1f6ods4l/logs
wandb: Currently logged in as: tha-santacruz (msc-nicola). Use `wandb login --relogin` to force relogin
wandb: Tracking run with wandb version 0.15.4
wandb: Run data is saved locally in /home/santacro/masters_thesis/all_runs/wandb/run-20230627_033144-81spg092
wandb: Run `wandb offline` to turn off syncing.
wandb: Syncing run unique-oath-228
wandb: ⭐️ View project at https://wandb.ai/msc-nicola/test_all_MLC
wandb: 🚀 View run at https://wandb.ai/msc-nicola/test_all_MLC/runs/81spg092
Running job on GPU : Tesla V100-PCIE-32GB
Namespace(BATCH_SIZE=128, CHECKPOINTS_PATH='/scratch/izar/santacro/checkpoints/', DATASET_PATH='/scratch/izar/santacro/final_data/', DEVICE='cuda:0', EMBEDDING='doc2vec', EPOCH_NUM=300, FRACTION=40, HIDDEN_SIZE=8192, JOB_ID=229, LEARNING_RATE=1e-05, LEVEL='L2', LOAD_CHECKPOINT='yes', MERGE_METHOD='selection', MIN_LEARNING_RATE=1e-06, NUM_WORKERS=8, RANDOM_STATE=5, RUN_MODE='test', SAVE_CHECKPOINTS='yes', SPLITTING='species', TARGET_BASE='set', WANDB_ENTITY='msc-nicola', WANDB_LOGS='yes', WANDB_PROJECT='all_MLC')
Number of train samples : 9066
Number of val samples : 929
Number of test samples : 9397
Loaded model state dict from file /scratch/izar/santacro/checkpoints//5_doc2vec_embedding_L2_level_selection_merging_species_splitting_8192.pth
wandb: Waiting for W&B process to finish... (success).
wandb: 
wandb: Run history:
wandb:     test loss ▁
wandb: test macro F1 ▁
wandb:  test macro H ▁
wandb: test micro F1 ▁
wandb: 
wandb: Run summary:
wandb:     test loss 1.32908
wandb: test macro F1 0.13578
wandb:  test macro H 4.92796
wandb: test micro F1 0.19632
wandb: 
wandb: 🚀 View run unique-oath-228 at: https://wandb.ai/msc-nicola/test_all_MLC/runs/81spg092
wandb: Synced 4 W&B file(s), 33 media file(s), 1 artifact file(s) and 0 other file(s)
wandb: Find logs at: ./wandb/run-20230627_033144-81spg092/logs
