/usr/share/lmod/lmod/init/sh: line 20: /usr/share/lmod/lmod/libexec//clearMT_cmd: No such file or directory
wandb: Currently logged in as: tha-santacruz (msc-nicola). Use `wandb login --relogin` to force relogin
wandb: Tracking run with wandb version 0.15.4
wandb: Run data is saved locally in /home/santacro/masters_thesis/all_runs/wandb/run-20230627_031522-wr5y940t
wandb: Run `wandb offline` to turn off syncing.
wandb: Syncing run olive-feather-171
wandb: ⭐️ View project at https://wandb.ai/msc-nicola/train_all_MLC
wandb: 🚀 View run at https://wandb.ai/msc-nicola/train_all_MLC/runs/wr5y940t
Running job on GPU : Tesla V100-PCIE-32GB
Namespace(BATCH_SIZE=128, CHECKPOINTS_PATH='/scratch/izar/santacro/checkpoints/', DATASET_PATH='/scratch/izar/santacro/final_data/', DEVICE='cuda:0', EMBEDDING='doc2vec', EPOCH_NUM=300, FRACTION=40, HIDDEN_SIZE=8192, JOB_ID=170, LEARNING_RATE=1e-05, LEVEL='L2', LOAD_CHECKPOINT='no', MERGE_METHOD='fusion', MIN_LEARNING_RATE=1e-06, NUM_WORKERS=8, RANDOM_STATE=4, RUN_MODE='train', SAVE_CHECKPOINTS='yes', SPLITTING='spatial', TARGET_BASE='set', WANDB_ENTITY='msc-nicola', WANDB_LOGS='yes', WANDB_PROJECT='all_MLC')
Number of train samples : 9301
Number of val samples : 1446
Number of test samples : 4215
  0%|          | 0/300 [00:00<?, ?it/s]train/val metrics at epoch 1 | loss : 1.30/1.10 | micro_F1 : 0.10/0.09:   0%|          | 0/300 [00:02<?, ?it/s]train/val metrics at epoch 1 | loss : 1.30/1.10 | micro_F1 : 0.10/0.09:   0%|          | 1/300 [00:02<14:55,  2.99s/it]train/val metrics at epoch 2 | loss : 1.21/1.05 | micro_F1 : 0.12/0.09:   0%|          | 1/300 [00:05<14:55,  2.99s/it]train/val metrics at epoch 2 | loss : 1.21/1.05 | micro_F1 : 0.12/0.09:   1%|          | 2/300 [00:05<13:35,  2.74s/it]train/val metrics at epoch 3 | loss : 1.16/1.04 | micro_F1 : 0.13/0.09:   1%|          | 2/300 [00:07<13:35,  2.74s/it]train/val metrics at epoch 3 | loss : 1.16/1.04 | micro_F1 : 0.13/0.09:   1%|          | 3/300 [00:07<12:43,  2.57s/it]train/val metrics at epoch 4 | loss : 1.12/1.01 | micro_F1 : 0.14/0.10:   1%|          | 3/300 [00:10<12:43,  2.57s/it]train/val metrics at epoch 4 | loss : 1.12/1.01 | micro_F1 : 0.14/0.10:   1%|▏         | 4/300 [00:10<12:09,  2.46s/it]train/val metrics at epoch 5 | loss : 1.08/0.99 | micro_F1 : 0.15/0.10:   1%|▏         | 4/300 [00:12<12:09,  2.46s/it]train/val metrics at epoch 5 | loss : 1.08/0.99 | micro_F1 : 0.15/0.10:   2%|▏         | 5/300 [00:12<11:55,  2.42s/it]train/val metrics at epoch 6 | loss : 1.04/0.97 | micro_F1 : 0.17/0.11:   2%|▏         | 5/300 [00:14<11:55,  2.42s/it]train/val metrics at epoch 6 | loss : 1.04/0.97 | micro_F1 : 0.17/0.11:   2%|▏         | 6/300 [00:14<11:39,  2.38s/it]train/val metrics at epoch 7 | loss : 1.01/0.96 | micro_F1 : 0.18/0.12:   2%|▏         | 6/300 [00:17<11:39,  2.38s/it]train/val metrics at epoch 7 | loss : 1.01/0.96 | micro_F1 : 0.18/0.12:   2%|▏         | 7/300 [00:17<11:32,  2.36s/it]train/val metrics at epoch 8 | loss : 0.99/0.94 | micro_F1 : 0.19/0.13:   2%|▏         | 7/300 [00:19<11:32,  2.36s/it]train/val metrics at epoch 8 | loss : 0.99/0.94 | micro_F1 : 0.19/0.13:   3%|▎         | 8/300 [00:19<11:21,  2.33s/it]train/val metrics at epoch 9 | loss : 0.95/0.93 | micro_F1 : 0.20/0.14:   3%|▎         | 8/300 [00:21<11:21,  2.33s/it]train/val metrics at epoch 9 | loss : 0.95/0.93 | micro_F1 : 0.20/0.14:   3%|▎         | 9/300 [00:21<11:18,  2.33s/it]train/val metrics at epoch 10 | loss : 0.92/0.91 | micro_F1 : 0.21/0.15:   3%|▎         | 9/300 [00:23<11:18,  2.33s/it]train/val metrics at epoch 10 | loss : 0.92/0.91 | micro_F1 : 0.21/0.15:   3%|▎         | 10/300 [00:24<11:17,  2.34s/it]train/val metrics at epoch 11 | loss : 0.89/0.91 | micro_F1 : 0.22/0.15:   3%|▎         | 10/300 [00:26<11:17,  2.34s/it]train/val metrics at epoch 11 | loss : 0.89/0.91 | micro_F1 : 0.22/0.15:   4%|▎         | 11/300 [00:26<11:17,  2.34s/it]train/val metrics at epoch 12 | loss : 0.87/0.91 | micro_F1 : 0.22/0.16:   4%|▎         | 11/300 [00:28<11:17,  2.34s/it]train/val metrics at epoch 12 | loss : 0.87/0.91 | micro_F1 : 0.22/0.16:   4%|▍         | 12/300 [00:28<11:11,  2.33s/it]train/val metrics at epoch 13 | loss : 0.85/0.88 | micro_F1 : 0.23/0.17:   4%|▍         | 12/300 [00:30<11:11,  2.33s/it]train/val metrics at epoch 13 | loss : 0.85/0.88 | micro_F1 : 0.23/0.17:   4%|▍         | 13/300 [00:31<11:07,  2.33s/it]train/val metrics at epoch 14 | loss : 0.82/0.88 | micro_F1 : 0.24/0.18:   4%|▍         | 13/300 [00:33<11:07,  2.33s/it]train/val metrics at epoch 14 | loss : 0.82/0.88 | micro_F1 : 0.24/0.18:   5%|▍         | 14/300 [00:33<11:06,  2.33s/it]train/val metrics at epoch 15 | loss : 0.81/0.88 | micro_F1 : 0.24/0.18:   5%|▍         | 14/300 [00:35<11:06,  2.33s/it]train/val metrics at epoch 15 | loss : 0.81/0.88 | micro_F1 : 0.24/0.18:   5%|▌         | 15/300 [00:35<11:02,  2.32s/it]train/val metrics at epoch 16 | loss : 0.78/0.90 | micro_F1 : 0.25/0.18:   5%|▌         | 15/300 [00:37<11:02,  2.32s/it]train/val metrics at epoch 16 | loss : 0.78/0.90 | micro_F1 : 0.25/0.18:   5%|▌         | 16/300 [00:38<10:59,  2.32s/it]train/val metrics at epoch 17 | loss : 0.77/0.87 | micro_F1 : 0.25/0.19:   5%|▌         | 16/300 [00:40<10:59,  2.32s/it]train/val metrics at epoch 17 | loss : 0.77/0.87 | micro_F1 : 0.25/0.19:   6%|▌         | 17/300 [00:40<10:55,  2.32s/it]train/val metrics at epoch 18 | loss : 0.75/0.99 | micro_F1 : 0.26/0.19:   6%|▌         | 17/300 [00:42<10:55,  2.32s/it]train/val metrics at epoch 18 | loss : 0.75/0.99 | micro_F1 : 0.26/0.19:   6%|▌         | 18/300 [00:42<10:57,  2.33s/it]train/val metrics at epoch 19 | loss : 0.73/0.87 | micro_F1 : 0.27/0.19:   6%|▌         | 18/300 [00:44<10:57,  2.33s/it]train/val metrics at epoch 19 | loss : 0.73/0.87 | micro_F1 : 0.27/0.19:   6%|▋         | 19/300 [00:45<10:51,  2.32s/it]train/val metrics at epoch 20 | loss : 0.71/0.87 | micro_F1 : 0.27/0.20:   6%|▋         | 19/300 [00:47<10:51,  2.32s/it]train/val metrics at epoch 20 | loss : 0.71/0.87 | micro_F1 : 0.27/0.20:   7%|▋         | 20/300 [00:47<10:50,  2.32s/it]train/val metrics at epoch 21 | loss : 0.70/0.89 | micro_F1 : 0.28/0.20:   7%|▋         | 20/300 [00:49<10:50,  2.32s/it]train/val metrics at epoch 21 | loss : 0.70/0.89 | micro_F1 : 0.28/0.20:   7%|▋         | 21/300 [00:49<10:43,  2.31s/it]train/val metrics at epoch 22 | loss : 0.68/0.88 | micro_F1 : 0.29/0.20:   7%|▋         | 21/300 [00:51<10:43,  2.31s/it]train/val metrics at epoch 22 | loss : 0.68/0.88 | micro_F1 : 0.29/0.20:   7%|▋         | 22/300 [00:51<10:42,  2.31s/it]train/val metrics at epoch 23 | loss : 0.67/0.89 | micro_F1 : 0.29/0.20:   7%|▋         | 22/300 [00:54<10:42,  2.31s/it]train/val metrics at epoch 23 | loss : 0.67/0.89 | micro_F1 : 0.29/0.20:   8%|▊         | 23/300 [00:54<10:40,  2.31s/it]train/val metrics at epoch 24 | loss : 0.66/0.91 | micro_F1 : 0.29/0.21:   8%|▊         | 23/300 [00:56<10:40,  2.31s/it]train/val metrics at epoch 24 | loss : 0.66/0.91 | micro_F1 : 0.29/0.21:   8%|▊         | 24/300 [00:56<10:40,  2.32s/it]train/val metrics at epoch 25 | loss : 0.66/0.89 | micro_F1 : 0.29/0.21:   8%|▊         | 24/300 [00:58<10:40,  2.32s/it]train/val metrics at epoch 25 | loss : 0.66/0.89 | micro_F1 : 0.29/0.21:   8%|▊         | 25/300 [00:58<10:37,  2.32s/it]train/val metrics at epoch 26 | loss : 0.65/0.88 | micro_F1 : 0.30/0.21:   8%|▊         | 25/300 [01:01<10:37,  2.32s/it]train/val metrics at epoch 26 | loss : 0.65/0.88 | micro_F1 : 0.30/0.21:   9%|▊         | 26/300 [01:01<10:34,  2.32s/it]train/val metrics at epoch 27 | loss : 0.65/0.89 | micro_F1 : 0.30/0.22:   9%|▊         | 26/300 [01:03<10:34,  2.32s/it]train/val metrics at epoch 27 | loss : 0.65/0.89 | micro_F1 : 0.30/0.22:   9%|▉         | 27/300 [01:03<10:33,  2.32s/it]train/val metrics at epoch 28 | loss : 0.64/0.89 | micro_F1 : 0.30/0.22:   9%|▉         | 27/300 [01:05<10:33,  2.32s/it]train/val metrics at epoch 28 | loss : 0.64/0.89 | micro_F1 : 0.30/0.22:   9%|▉         | 28/300 [01:05<10:28,  2.31s/it]train/val metrics at epoch 29 | loss : 0.64/0.89 | micro_F1 : 0.30/0.21:   9%|▉         | 28/300 [01:08<10:28,  2.31s/it]train/val metrics at epoch 29 | loss : 0.64/0.89 | micro_F1 : 0.30/0.21:   9%|▉         | 28/300 [01:08<11:07,  2.46s/it]
wandb: Waiting for W&B process to finish... (success).
wandb: 
wandb: Run history:
wandb:          epoch ▁
wandb:  learning rate ▁
wandb:           time ▁
wandb:     train loss ▁
wandb: train macro F1 ▁
wandb: train micro F1 ▁
wandb:       val loss ▁
wandb:   val macro F1 ▁
wandb:   val micro F1 ▁
wandb: 
wandb: Run summary:
wandb:          epoch 29
wandb:  learning rate 0.0
wandb:           time 71.10617
wandb:     train loss 0.63841
wandb: train macro F1 0.25144
wandb: train micro F1 0.30162
wandb:       val loss 0.89297
wandb:   val macro F1 0.12228
wandb:   val micro F1 0.21382
wandb: 
wandb: 🚀 View run olive-feather-171 at: https://wandb.ai/msc-nicola/train_all_MLC/runs/wr5y940t
wandb: Synced 5 W&B file(s), 1 media file(s), 1 artifact file(s) and 0 other file(s)
wandb: Find logs at: ./wandb/run-20230627_031522-wr5y940t/logs
wandb: Currently logged in as: tha-santacruz (msc-nicola). Use `wandb login --relogin` to force relogin
wandb: Tracking run with wandb version 0.15.4
wandb: Run data is saved locally in /home/santacro/masters_thesis/all_runs/wandb/run-20230627_031658-4shtmlf2
wandb: Run `wandb offline` to turn off syncing.
wandb: Syncing run divine-pine-170
wandb: ⭐️ View project at https://wandb.ai/msc-nicola/test_all_MLC
wandb: 🚀 View run at https://wandb.ai/msc-nicola/test_all_MLC/runs/4shtmlf2
Running job on GPU : Tesla V100-PCIE-32GB
Namespace(BATCH_SIZE=128, CHECKPOINTS_PATH='/scratch/izar/santacro/checkpoints/', DATASET_PATH='/scratch/izar/santacro/final_data/', DEVICE='cuda:0', EMBEDDING='doc2vec', EPOCH_NUM=300, FRACTION=40, HIDDEN_SIZE=8192, JOB_ID=170, LEARNING_RATE=1e-05, LEVEL='L2', LOAD_CHECKPOINT='yes', MERGE_METHOD='fusion', MIN_LEARNING_RATE=1e-06, NUM_WORKERS=8, RANDOM_STATE=4, RUN_MODE='test', SAVE_CHECKPOINTS='yes', SPLITTING='spatial', TARGET_BASE='set', WANDB_ENTITY='msc-nicola', WANDB_LOGS='yes', WANDB_PROJECT='all_MLC')
Number of train samples : 9301
Number of val samples : 1446
Number of test samples : 4215
Loaded model state dict from file /scratch/izar/santacro/checkpoints//4_doc2vec_embedding_L2_level_fusion_merging_spatial_splitting_8192.pth
wandb: Waiting for W&B process to finish... (success).
wandb: 
wandb: Run history:
wandb:     test loss ▁
wandb: test macro F1 ▁
wandb:  test macro H ▁
wandb: test micro F1 ▁
wandb: 
wandb: Run summary:
wandb:     test loss 1.07023
wandb: test macro F1 0.1285
wandb:  test macro H 4.00451
wandb: test micro F1 0.20886
wandb: 
wandb: 🚀 View run divine-pine-170 at: https://wandb.ai/msc-nicola/test_all_MLC/runs/4shtmlf2
wandb: Synced 4 W&B file(s), 33 media file(s), 1 artifact file(s) and 0 other file(s)
wandb: Find logs at: ./wandb/run-20230627_031658-4shtmlf2/logs
