/usr/share/lmod/lmod/init/sh: line 20: /usr/share/lmod/lmod/libexec//clearMT_cmd: No such file or directory
wandb: Currently logged in as: tha-santacruz (msc-nicola). Use `wandb login --relogin` to force relogin
wandb: Tracking run with wandb version 0.15.4
wandb: Run data is saved locally in /home/santacro/masters_thesis/all_runs/wandb/run-20230626_214845-v7yq7anf
wandb: Run `wandb offline` to turn off syncing.
wandb: Syncing run sweet-pyramid-36
wandb: ⭐️ View project at https://wandb.ai/msc-nicola/train_all_MLC
wandb: 🚀 View run at https://wandb.ai/msc-nicola/train_all_MLC/runs/v7yq7anf
Running job on GPU : Tesla V100-PCIE-32GB
Namespace(BATCH_SIZE=128, CHECKPOINTS_PATH='/scratch/izar/santacro/checkpoints/', DATASET_PATH='/scratch/izar/santacro/final_data/', DEVICE='cuda:0', EMBEDDING='doc2vec', EPOCH_NUM=300, FRACTION=50, HIDDEN_SIZE=8192, JOB_ID=36, LEARNING_RATE=1e-05, LEVEL='L1', LOAD_CHECKPOINT='no', MERGE_METHOD='fusion', MIN_LEARNING_RATE=1e-06, NUM_WORKERS=8, RANDOM_STATE=1, RUN_MODE='train', SAVE_CHECKPOINTS='yes', SPLITTING='progressive', TARGET_BASE='set', WANDB_ENTITY='msc-nicola', WANDB_LOGS='yes', WANDB_PROJECT='all_MLC')
Number of train samples : 9499
Number of val samples : 1056
Number of test samples : 5605
  0%|          | 0/300 [00:00<?, ?it/s]train/val metrics at epoch 1 | loss : 1.16/1.14 | micro_F1 : 0.21/0.25:   0%|          | 0/300 [00:03<?, ?it/s]train/val metrics at epoch 1 | loss : 1.16/1.14 | micro_F1 : 0.21/0.25:   0%|          | 1/300 [00:03<16:14,  3.26s/it]train/val metrics at epoch 2 | loss : 1.10/1.08 | micro_F1 : 0.28/0.31:   0%|          | 1/300 [00:05<16:14,  3.26s/it]train/val metrics at epoch 2 | loss : 1.10/1.08 | micro_F1 : 0.28/0.31:   1%|          | 2/300 [00:05<12:30,  2.52s/it]train/val metrics at epoch 3 | loss : 1.05/1.06 | micro_F1 : 0.32/0.35:   1%|          | 2/300 [00:07<12:30,  2.52s/it]train/val metrics at epoch 3 | loss : 1.05/1.06 | micro_F1 : 0.32/0.35:   1%|          | 3/300 [00:07<11:19,  2.29s/it]train/val metrics at epoch 4 | loss : 1.01/1.05 | micro_F1 : 0.36/0.35:   1%|          | 3/300 [00:09<11:19,  2.29s/it]train/val metrics at epoch 4 | loss : 1.01/1.05 | micro_F1 : 0.36/0.35:   1%|▏         | 4/300 [00:09<10:54,  2.21s/it]train/val metrics at epoch 5 | loss : 0.97/1.04 | micro_F1 : 0.38/0.39:   1%|▏         | 4/300 [00:11<10:54,  2.21s/it]train/val metrics at epoch 5 | loss : 0.97/1.04 | micro_F1 : 0.38/0.39:   2%|▏         | 5/300 [00:11<10:23,  2.11s/it]train/val metrics at epoch 6 | loss : 0.94/1.00 | micro_F1 : 0.39/0.40:   2%|▏         | 5/300 [00:13<10:23,  2.11s/it]train/val metrics at epoch 6 | loss : 0.94/1.00 | micro_F1 : 0.39/0.40:   2%|▏         | 6/300 [00:13<10:06,  2.06s/it]train/val metrics at epoch 7 | loss : 0.90/1.01 | micro_F1 : 0.40/0.39:   2%|▏         | 6/300 [00:15<10:06,  2.06s/it]train/val metrics at epoch 7 | loss : 0.90/1.01 | micro_F1 : 0.40/0.39:   2%|▏         | 7/300 [00:15<10:00,  2.05s/it]train/val metrics at epoch 8 | loss : 0.87/1.02 | micro_F1 : 0.41/0.40:   2%|▏         | 7/300 [00:17<10:00,  2.05s/it]train/val metrics at epoch 8 | loss : 0.87/1.02 | micro_F1 : 0.41/0.40:   3%|▎         | 8/300 [00:17<09:58,  2.05s/it]train/val metrics at epoch 9 | loss : 0.84/1.03 | micro_F1 : 0.43/0.40:   3%|▎         | 8/300 [00:19<09:58,  2.05s/it]train/val metrics at epoch 9 | loss : 0.84/1.03 | micro_F1 : 0.43/0.40:   3%|▎         | 9/300 [00:19<09:54,  2.04s/it]train/val metrics at epoch 10 | loss : 0.81/1.01 | micro_F1 : 0.44/0.41:   3%|▎         | 9/300 [00:21<09:54,  2.04s/it]train/val metrics at epoch 10 | loss : 0.81/1.01 | micro_F1 : 0.44/0.41:   3%|▎         | 10/300 [00:21<09:49,  2.03s/it]train/val metrics at epoch 11 | loss : 0.78/1.02 | micro_F1 : 0.45/0.42:   3%|▎         | 10/300 [00:23<09:49,  2.03s/it]train/val metrics at epoch 11 | loss : 0.78/1.02 | micro_F1 : 0.45/0.42:   4%|▎         | 11/300 [00:23<09:47,  2.03s/it]train/val metrics at epoch 12 | loss : 0.76/1.00 | micro_F1 : 0.46/0.40:   4%|▎         | 11/300 [00:25<09:47,  2.03s/it]train/val metrics at epoch 12 | loss : 0.76/1.00 | micro_F1 : 0.46/0.40:   4%|▍         | 12/300 [00:25<09:45,  2.03s/it]train/val metrics at epoch 13 | loss : 0.75/1.04 | micro_F1 : 0.46/0.42:   4%|▍         | 12/300 [00:27<09:45,  2.03s/it]train/val metrics at epoch 13 | loss : 0.75/1.04 | micro_F1 : 0.46/0.42:   4%|▍         | 13/300 [00:27<09:46,  2.04s/it]train/val metrics at epoch 14 | loss : 0.74/1.03 | micro_F1 : 0.47/0.41:   4%|▍         | 13/300 [00:29<09:46,  2.04s/it]train/val metrics at epoch 14 | loss : 0.74/1.03 | micro_F1 : 0.47/0.41:   5%|▍         | 14/300 [00:29<09:39,  2.03s/it]train/val metrics at epoch 15 | loss : 0.73/1.07 | micro_F1 : 0.47/0.41:   5%|▍         | 14/300 [00:31<09:39,  2.03s/it]train/val metrics at epoch 15 | loss : 0.73/1.07 | micro_F1 : 0.47/0.41:   5%|▌         | 15/300 [00:31<09:35,  2.02s/it]train/val metrics at epoch 16 | loss : 0.72/1.05 | micro_F1 : 0.48/0.41:   5%|▌         | 15/300 [00:33<09:35,  2.02s/it]train/val metrics at epoch 16 | loss : 0.72/1.05 | micro_F1 : 0.48/0.41:   5%|▌         | 16/300 [00:33<09:33,  2.02s/it]train/val metrics at epoch 17 | loss : 0.71/1.05 | micro_F1 : 0.48/0.41:   5%|▌         | 16/300 [00:35<09:33,  2.02s/it]train/val metrics at epoch 17 | loss : 0.71/1.05 | micro_F1 : 0.48/0.41:   6%|▌         | 17/300 [00:35<09:32,  2.02s/it]train/val metrics at epoch 18 | loss : 0.70/1.07 | micro_F1 : 0.49/0.41:   6%|▌         | 17/300 [00:37<09:32,  2.02s/it]train/val metrics at epoch 18 | loss : 0.70/1.07 | micro_F1 : 0.49/0.41:   6%|▌         | 18/300 [00:37<09:26,  2.01s/it]train/val metrics at epoch 19 | loss : 0.70/1.09 | micro_F1 : 0.49/0.43:   6%|▌         | 18/300 [00:39<09:26,  2.01s/it]train/val metrics at epoch 19 | loss : 0.70/1.09 | micro_F1 : 0.49/0.43:   6%|▋         | 19/300 [00:39<09:24,  2.01s/it]train/val metrics at epoch 20 | loss : 0.70/1.09 | micro_F1 : 0.49/0.42:   6%|▋         | 19/300 [00:41<09:24,  2.01s/it]train/val metrics at epoch 20 | loss : 0.70/1.09 | micro_F1 : 0.49/0.42:   7%|▋         | 20/300 [00:41<09:23,  2.01s/it]train/val metrics at epoch 21 | loss : 0.69/1.04 | micro_F1 : 0.49/0.42:   7%|▋         | 20/300 [00:43<09:23,  2.01s/it]train/val metrics at epoch 21 | loss : 0.69/1.04 | micro_F1 : 0.49/0.42:   7%|▋         | 21/300 [00:43<09:23,  2.02s/it]train/val metrics at epoch 22 | loss : 0.69/1.07 | micro_F1 : 0.49/0.42:   7%|▋         | 21/300 [00:45<09:23,  2.02s/it]train/val metrics at epoch 22 | loss : 0.69/1.07 | micro_F1 : 0.49/0.42:   7%|▋         | 21/300 [00:46<10:13,  2.20s/it]
wandb: Waiting for W&B process to finish... (success).
wandb: - 0.007 MB of 0.007 MB uploaded (0.000 MB deduped)wandb: \ 0.007 MB of 0.007 MB uploaded (0.000 MB deduped)wandb: | 0.007 MB of 0.007 MB uploaded (0.000 MB deduped)wandb: / 0.007 MB of 0.007 MB uploaded (0.000 MB deduped)wandb: - 0.007 MB of 0.007 MB uploaded (0.000 MB deduped)wandb: 
wandb: Run history:
wandb:          epoch ▁
wandb:  learning rate ▁
wandb:           time ▁
wandb:     train loss ▁
wandb: train macro F1 ▁
wandb: train micro F1 ▁
wandb:       val loss ▁
wandb:   val macro F1 ▁
wandb:   val micro F1 ▁
wandb: 
wandb: Run summary:
wandb:          epoch 22
wandb:  learning rate 0.0
wandb:           time 47.84547
wandb:     train loss 0.69139
wandb: train macro F1 0.43778
wandb: train micro F1 0.48801
wandb:       val loss 1.07355
wandb:   val macro F1 0.30783
wandb:   val micro F1 0.42128
wandb: 
wandb: 🚀 View run sweet-pyramid-36 at: https://wandb.ai/msc-nicola/train_all_MLC/runs/v7yq7anf
wandb: Synced 5 W&B file(s), 1 media file(s), 1 artifact file(s) and 0 other file(s)
wandb: Find logs at: ./wandb/run-20230626_214845-v7yq7anf/logs
wandb: Currently logged in as: tha-santacruz (msc-nicola). Use `wandb login --relogin` to force relogin
wandb: Tracking run with wandb version 0.15.4
wandb: Run data is saved locally in /home/santacro/masters_thesis/all_runs/wandb/run-20230626_214954-obv1ug4b
wandb: Run `wandb offline` to turn off syncing.
wandb: Syncing run splendid-deluge-35
wandb: ⭐️ View project at https://wandb.ai/msc-nicola/test_all_MLC
wandb: 🚀 View run at https://wandb.ai/msc-nicola/test_all_MLC/runs/obv1ug4b
Running job on GPU : Tesla V100-PCIE-32GB
Namespace(BATCH_SIZE=128, CHECKPOINTS_PATH='/scratch/izar/santacro/checkpoints/', DATASET_PATH='/scratch/izar/santacro/final_data/', DEVICE='cuda:0', EMBEDDING='doc2vec', EPOCH_NUM=300, FRACTION=50, HIDDEN_SIZE=8192, JOB_ID=36, LEARNING_RATE=1e-05, LEVEL='L1', LOAD_CHECKPOINT='yes', MERGE_METHOD='fusion', MIN_LEARNING_RATE=1e-06, NUM_WORKERS=8, RANDOM_STATE=1, RUN_MODE='test', SAVE_CHECKPOINTS='yes', SPLITTING='progressive', TARGET_BASE='set', WANDB_ENTITY='msc-nicola', WANDB_LOGS='yes', WANDB_PROJECT='all_MLC')
Number of train samples : 9499
Number of val samples : 1056
Number of test samples : 5605
Loaded model state dict from file /scratch/izar/santacro/checkpoints//1_doc2vec_embedding_L1_level_fusion_merging_progressive_50%_8192.pth
wandb: Waiting for W&B process to finish... (success).
wandb: 
wandb: Run history:
wandb:     test loss ▁
wandb: test macro F1 ▁
wandb:  test macro H ▁
wandb: test micro F1 ▁
wandb: 
wandb: Run summary:
wandb:     test loss 1.11741
wandb: test macro F1 0.32965
wandb:  test macro H 1.91401
wandb: test micro F1 0.41428
wandb: 
wandb: 🚀 View run splendid-deluge-35 at: https://wandb.ai/msc-nicola/test_all_MLC/runs/obv1ug4b
wandb: Synced 4 W&B file(s), 10 media file(s), 1 artifact file(s) and 0 other file(s)
wandb: Find logs at: ./wandb/run-20230626_214954-obv1ug4b/logs
