/usr/share/lmod/lmod/init/sh: line 20: /usr/share/lmod/lmod/libexec//clearMT_cmd: No such file or directory
wandb: Currently logged in as: tha-santacruz (msc-nicola). Use `wandb login --relogin` to force relogin
wandb: Tracking run with wandb version 0.15.4
wandb: Run data is saved locally in /home/santacro/masters_thesis/all_runs/wandb/run-20230627_032622-vlnghcxb
wandb: Run `wandb offline` to turn off syncing.
wandb: Syncing run celestial-sponge-213
wandb: ⭐️ View project at https://wandb.ai/msc-nicola/train_all_MLC
wandb: 🚀 View run at https://wandb.ai/msc-nicola/train_all_MLC/runs/vlnghcxb
Running job on GPU : Tesla V100-PCIE-32GB
Namespace(BATCH_SIZE=128, CHECKPOINTS_PATH='/scratch/izar/santacro/checkpoints/', DATASET_PATH='/scratch/izar/santacro/final_data/', DEVICE='cuda:0', EMBEDDING='doc2vec', EPOCH_NUM=300, FRACTION=40, HIDDEN_SIZE=8192, JOB_ID=214, LEARNING_RATE=1e-05, LEVEL='L1', LOAD_CHECKPOINT='no', MERGE_METHOD='selection', MIN_LEARNING_RATE=1e-06, NUM_WORKERS=8, RANDOM_STATE=5, RUN_MODE='train', SAVE_CHECKPOINTS='yes', SPLITTING='spatial', TARGET_BASE='set', WANDB_ENTITY='msc-nicola', WANDB_LOGS='yes', WANDB_PROJECT='all_MLC')
Number of train samples : 10313
Number of val samples : 1625
Number of test samples : 4688
  0%|          | 0/300 [00:00<?, ?it/s]train/val metrics at epoch 1 | loss : 1.17/0.99 | micro_F1 : 0.25/0.27:   0%|          | 0/300 [00:02<?, ?it/s]train/val metrics at epoch 1 | loss : 1.17/0.99 | micro_F1 : 0.25/0.27:   0%|          | 1/300 [00:03<15:39,  3.14s/it]train/val metrics at epoch 2 | loss : 1.10/0.97 | micro_F1 : 0.32/0.30:   0%|          | 1/300 [00:05<15:39,  3.14s/it]train/val metrics at epoch 2 | loss : 1.10/0.97 | micro_F1 : 0.32/0.30:   1%|          | 2/300 [00:05<13:51,  2.79s/it]train/val metrics at epoch 3 | loss : 1.05/0.95 | micro_F1 : 0.35/0.31:   1%|          | 2/300 [00:07<13:51,  2.79s/it]train/val metrics at epoch 3 | loss : 1.05/0.95 | micro_F1 : 0.35/0.31:   1%|          | 3/300 [00:08<13:05,  2.64s/it]train/val metrics at epoch 4 | loss : 1.00/0.93 | micro_F1 : 0.37/0.31:   1%|          | 3/300 [00:10<13:05,  2.64s/it]train/val metrics at epoch 4 | loss : 1.00/0.93 | micro_F1 : 0.37/0.31:   1%|▏         | 4/300 [00:10<12:48,  2.60s/it]train/val metrics at epoch 5 | loss : 0.97/0.92 | micro_F1 : 0.38/0.32:   1%|▏         | 4/300 [00:12<12:48,  2.60s/it]train/val metrics at epoch 5 | loss : 0.97/0.92 | micro_F1 : 0.38/0.32:   2%|▏         | 5/300 [00:13<12:29,  2.54s/it]train/val metrics at epoch 6 | loss : 0.93/0.92 | micro_F1 : 0.39/0.32:   2%|▏         | 5/300 [00:15<12:29,  2.54s/it]train/val metrics at epoch 6 | loss : 0.93/0.92 | micro_F1 : 0.39/0.32:   2%|▏         | 6/300 [00:15<12:22,  2.53s/it]train/val metrics at epoch 7 | loss : 0.90/0.91 | micro_F1 : 0.39/0.32:   2%|▏         | 6/300 [00:17<12:22,  2.53s/it]train/val metrics at epoch 7 | loss : 0.90/0.91 | micro_F1 : 0.39/0.32:   2%|▏         | 7/300 [00:18<12:18,  2.52s/it]train/val metrics at epoch 8 | loss : 0.87/0.91 | micro_F1 : 0.41/0.33:   2%|▏         | 7/300 [00:20<12:18,  2.52s/it]train/val metrics at epoch 8 | loss : 0.87/0.91 | micro_F1 : 0.41/0.33:   3%|▎         | 8/300 [00:20<12:19,  2.53s/it]train/val metrics at epoch 9 | loss : 0.84/0.91 | micro_F1 : 0.42/0.34:   3%|▎         | 8/300 [00:23<12:19,  2.53s/it]train/val metrics at epoch 9 | loss : 0.84/0.91 | micro_F1 : 0.42/0.34:   3%|▎         | 9/300 [00:23<12:18,  2.54s/it]train/val metrics at epoch 10 | loss : 0.81/0.91 | micro_F1 : 0.43/0.34:   3%|▎         | 9/300 [00:25<12:18,  2.54s/it]train/val metrics at epoch 10 | loss : 0.81/0.91 | micro_F1 : 0.43/0.34:   3%|▎         | 10/300 [00:25<12:16,  2.54s/it]train/val metrics at epoch 11 | loss : 0.79/0.91 | micro_F1 : 0.44/0.35:   3%|▎         | 10/300 [00:28<12:16,  2.54s/it]train/val metrics at epoch 11 | loss : 0.79/0.91 | micro_F1 : 0.44/0.35:   4%|▎         | 11/300 [00:28<12:15,  2.54s/it]train/val metrics at epoch 12 | loss : 0.76/0.91 | micro_F1 : 0.45/0.35:   4%|▎         | 11/300 [00:30<12:15,  2.54s/it]train/val metrics at epoch 12 | loss : 0.76/0.91 | micro_F1 : 0.45/0.35:   4%|▍         | 12/300 [00:30<12:11,  2.54s/it]train/val metrics at epoch 13 | loss : 0.75/0.92 | micro_F1 : 0.46/0.36:   4%|▍         | 12/300 [00:33<12:11,  2.54s/it]train/val metrics at epoch 13 | loss : 0.75/0.92 | micro_F1 : 0.46/0.36:   4%|▍         | 13/300 [00:33<12:08,  2.54s/it]train/val metrics at epoch 14 | loss : 0.74/0.92 | micro_F1 : 0.47/0.35:   4%|▍         | 13/300 [00:35<12:08,  2.54s/it]train/val metrics at epoch 14 | loss : 0.74/0.92 | micro_F1 : 0.47/0.35:   5%|▍         | 14/300 [00:35<12:02,  2.52s/it]train/val metrics at epoch 15 | loss : 0.72/0.93 | micro_F1 : 0.47/0.35:   5%|▍         | 14/300 [00:38<12:02,  2.52s/it]train/val metrics at epoch 15 | loss : 0.72/0.93 | micro_F1 : 0.47/0.35:   5%|▌         | 15/300 [00:38<11:55,  2.51s/it]train/val metrics at epoch 16 | loss : 0.71/0.93 | micro_F1 : 0.48/0.36:   5%|▌         | 15/300 [00:40<11:55,  2.51s/it]train/val metrics at epoch 16 | loss : 0.71/0.93 | micro_F1 : 0.48/0.36:   5%|▌         | 16/300 [00:40<11:51,  2.51s/it]train/val metrics at epoch 17 | loss : 0.71/0.93 | micro_F1 : 0.48/0.35:   5%|▌         | 16/300 [00:43<11:51,  2.51s/it]train/val metrics at epoch 17 | loss : 0.71/0.93 | micro_F1 : 0.48/0.35:   6%|▌         | 17/300 [00:43<11:56,  2.53s/it]train/val metrics at epoch 18 | loss : 0.70/0.94 | micro_F1 : 0.48/0.36:   6%|▌         | 17/300 [00:45<11:56,  2.53s/it]train/val metrics at epoch 18 | loss : 0.70/0.94 | micro_F1 : 0.48/0.36:   6%|▌         | 18/300 [00:46<11:59,  2.55s/it]train/val metrics at epoch 19 | loss : 0.70/0.94 | micro_F1 : 0.48/0.36:   6%|▌         | 18/300 [00:48<11:59,  2.55s/it]train/val metrics at epoch 19 | loss : 0.70/0.94 | micro_F1 : 0.48/0.36:   6%|▌         | 18/300 [00:49<12:51,  2.73s/it]
wandb: Waiting for W&B process to finish... (success).
wandb: - 0.007 MB of 0.007 MB uploaded (0.000 MB deduped)wandb: \ 0.007 MB of 0.007 MB uploaded (0.000 MB deduped)wandb: | 0.007 MB of 0.007 MB uploaded (0.000 MB deduped)wandb: / 0.009 MB of 0.011 MB uploaded (0.000 MB deduped)wandb: - 0.011 MB of 0.011 MB uploaded (0.000 MB deduped)wandb: 
wandb: Run history:
wandb:          epoch ▁
wandb:  learning rate ▁
wandb:           time ▁
wandb:     train loss ▁
wandb: train macro F1 ▁
wandb: train micro F1 ▁
wandb:       val loss ▁
wandb:   val macro F1 ▁
wandb:   val micro F1 ▁
wandb: 
wandb: Run summary:
wandb:          epoch 19
wandb:  learning rate 0.0
wandb:           time 50.76253
wandb:     train loss 0.69556
wandb: train macro F1 0.42142
wandb: train micro F1 0.48451
wandb:       val loss 0.93877
wandb:   val macro F1 0.23816
wandb:   val micro F1 0.35628
wandb: 
wandb: 🚀 View run celestial-sponge-213 at: https://wandb.ai/msc-nicola/train_all_MLC/runs/vlnghcxb
wandb: Synced 5 W&B file(s), 1 media file(s), 1 artifact file(s) and 0 other file(s)
wandb: Find logs at: ./wandb/run-20230627_032622-vlnghcxb/logs
wandb: Currently logged in as: tha-santacruz (msc-nicola). Use `wandb login --relogin` to force relogin
wandb: Tracking run with wandb version 0.15.4
wandb: Run data is saved locally in /home/santacro/masters_thesis/all_runs/wandb/run-20230627_032739-jh7luop2
wandb: Run `wandb offline` to turn off syncing.
wandb: Syncing run ethereal-dew-213
wandb: ⭐️ View project at https://wandb.ai/msc-nicola/test_all_MLC
wandb: 🚀 View run at https://wandb.ai/msc-nicola/test_all_MLC/runs/jh7luop2
Running job on GPU : Tesla V100-PCIE-32GB
Namespace(BATCH_SIZE=128, CHECKPOINTS_PATH='/scratch/izar/santacro/checkpoints/', DATASET_PATH='/scratch/izar/santacro/final_data/', DEVICE='cuda:0', EMBEDDING='doc2vec', EPOCH_NUM=300, FRACTION=40, HIDDEN_SIZE=8192, JOB_ID=214, LEARNING_RATE=1e-05, LEVEL='L1', LOAD_CHECKPOINT='yes', MERGE_METHOD='selection', MIN_LEARNING_RATE=1e-06, NUM_WORKERS=8, RANDOM_STATE=5, RUN_MODE='test', SAVE_CHECKPOINTS='yes', SPLITTING='spatial', TARGET_BASE='set', WANDB_ENTITY='msc-nicola', WANDB_LOGS='yes', WANDB_PROJECT='all_MLC')
Number of train samples : 10313
Number of val samples : 1625
Number of test samples : 4688
Loaded model state dict from file /scratch/izar/santacro/checkpoints//5_doc2vec_embedding_L1_level_selection_merging_spatial_splitting_8192.pth
wandb: Waiting for W&B process to finish... (success).
wandb: - 0.067 MB of 0.184 MB uploaded (0.000 MB deduped)wandb: \ 0.007 MB of 0.184 MB uploaded (0.000 MB deduped)wandb: | 0.184 MB of 0.189 MB uploaded (0.000 MB deduped)wandb: / 0.189 MB of 0.189 MB uploaded (0.000 MB deduped)wandb: 
wandb: Run history:
wandb:     test loss ▁
wandb: test macro F1 ▁
wandb:  test macro H ▁
wandb: test micro F1 ▁
wandb: 
wandb: Run summary:
wandb:     test loss 0.94337
wandb: test macro F1 0.25741
wandb:  test macro H 2.13588
wandb: test micro F1 0.35744
wandb: 
wandb: 🚀 View run ethereal-dew-213 at: https://wandb.ai/msc-nicola/test_all_MLC/runs/jh7luop2
wandb: Synced 4 W&B file(s), 10 media file(s), 1 artifact file(s) and 0 other file(s)
wandb: Find logs at: ./wandb/run-20230627_032739-jh7luop2/logs
