/usr/share/lmod/lmod/init/sh: line 20: /usr/share/lmod/lmod/libexec//clearMT_cmd: No such file or directory
wandb: Currently logged in as: tha-santacruz (msc-nicola). Use `wandb login --relogin` to force relogin
wandb: Tracking run with wandb version 0.15.4
wandb: Run data is saved locally in /home/santacro/masters_thesis/all_runs/wandb/run-20230627_030347-p173lgq9
wandb: Run `wandb offline` to turn off syncing.
wandb: Syncing run dashing-spaceship-133
wandb: ⭐️ View project at https://wandb.ai/msc-nicola/train_all_MLC
wandb: 🚀 View run at https://wandb.ai/msc-nicola/train_all_MLC/runs/p173lgq9
Running job on GPU : Tesla V100-PCIE-32GB
Namespace(BATCH_SIZE=128, CHECKPOINTS_PATH='/scratch/izar/santacro/checkpoints/', DATASET_PATH='/scratch/izar/santacro/final_data/', DEVICE='cuda:0', EMBEDDING='doc2vec', EPOCH_NUM=300, FRACTION=20, HIDDEN_SIZE=8192, JOB_ID=133, LEARNING_RATE=1e-05, LEVEL='L1', LOAD_CHECKPOINT='no', MERGE_METHOD='fusion', MIN_LEARNING_RATE=1e-06, NUM_WORKERS=8, RANDOM_STATE=3, RUN_MODE='train', SAVE_CHECKPOINTS='yes', SPLITTING='progressive', TARGET_BASE='set', WANDB_ENTITY='msc-nicola', WANDB_LOGS='yes', WANDB_PROJECT='all_MLC')
Number of train samples : 9920
Number of val samples : 1102
Number of test samples : 5350
  0%|          | 0/300 [00:00<?, ?it/s]train/val metrics at epoch 1 | loss : 1.16/1.16 | micro_F1 : 0.22/0.29:   0%|          | 0/300 [00:02<?, ?it/s]train/val metrics at epoch 1 | loss : 1.16/1.16 | micro_F1 : 0.22/0.29:   0%|          | 1/300 [00:02<13:49,  2.77s/it]train/val metrics at epoch 2 | loss : 1.09/1.07 | micro_F1 : 0.29/0.33:   0%|          | 1/300 [00:04<13:49,  2.77s/it]train/val metrics at epoch 2 | loss : 1.09/1.07 | micro_F1 : 0.29/0.33:   1%|          | 2/300 [00:04<11:52,  2.39s/it]train/val metrics at epoch 3 | loss : 1.05/1.04 | micro_F1 : 0.34/0.36:   1%|          | 2/300 [00:06<11:52,  2.39s/it]train/val metrics at epoch 3 | loss : 1.05/1.04 | micro_F1 : 0.34/0.36:   1%|          | 3/300 [00:07<11:11,  2.26s/it]train/val metrics at epoch 4 | loss : 1.01/1.01 | micro_F1 : 0.37/0.39:   1%|          | 3/300 [00:08<11:11,  2.26s/it]train/val metrics at epoch 4 | loss : 1.01/1.01 | micro_F1 : 0.37/0.39:   1%|▏         | 4/300 [00:09<10:50,  2.20s/it]train/val metrics at epoch 5 | loss : 0.97/0.99 | micro_F1 : 0.38/0.40:   1%|▏         | 4/300 [00:11<10:50,  2.20s/it]train/val metrics at epoch 5 | loss : 0.97/0.99 | micro_F1 : 0.38/0.40:   2%|▏         | 5/300 [00:11<10:40,  2.17s/it]train/val metrics at epoch 6 | loss : 0.93/0.96 | micro_F1 : 0.40/0.40:   2%|▏         | 5/300 [00:13<10:40,  2.17s/it]train/val metrics at epoch 6 | loss : 0.93/0.96 | micro_F1 : 0.40/0.40:   2%|▏         | 6/300 [00:13<10:31,  2.15s/it]train/val metrics at epoch 7 | loss : 0.90/0.96 | micro_F1 : 0.40/0.41:   2%|▏         | 6/300 [00:15<10:31,  2.15s/it]train/val metrics at epoch 7 | loss : 0.90/0.96 | micro_F1 : 0.40/0.41:   2%|▏         | 7/300 [00:15<10:26,  2.14s/it]train/val metrics at epoch 8 | loss : 0.87/0.95 | micro_F1 : 0.42/0.40:   2%|▏         | 7/300 [00:17<10:26,  2.14s/it]train/val metrics at epoch 8 | loss : 0.87/0.95 | micro_F1 : 0.42/0.40:   3%|▎         | 8/300 [00:17<10:16,  2.11s/it]train/val metrics at epoch 9 | loss : 0.84/0.96 | micro_F1 : 0.43/0.42:   3%|▎         | 8/300 [00:19<10:16,  2.11s/it]train/val metrics at epoch 9 | loss : 0.84/0.96 | micro_F1 : 0.43/0.42:   3%|▎         | 9/300 [00:19<10:10,  2.10s/it]train/val metrics at epoch 10 | loss : 0.81/0.96 | micro_F1 : 0.44/0.42:   3%|▎         | 9/300 [00:21<10:10,  2.10s/it]train/val metrics at epoch 10 | loss : 0.81/0.96 | micro_F1 : 0.44/0.42:   3%|▎         | 10/300 [00:21<10:09,  2.10s/it]train/val metrics at epoch 11 | loss : 0.78/0.98 | micro_F1 : 0.45/0.42:   3%|▎         | 10/300 [00:23<10:09,  2.10s/it]train/val metrics at epoch 11 | loss : 0.78/0.98 | micro_F1 : 0.45/0.42:   4%|▎         | 11/300 [00:23<10:10,  2.11s/it]train/val metrics at epoch 12 | loss : 0.75/0.98 | micro_F1 : 0.46/0.43:   4%|▎         | 11/300 [00:25<10:10,  2.11s/it]train/val metrics at epoch 12 | loss : 0.75/0.98 | micro_F1 : 0.46/0.43:   4%|▍         | 12/300 [00:25<10:11,  2.12s/it]train/val metrics at epoch 13 | loss : 0.72/1.00 | micro_F1 : 0.48/0.43:   4%|▍         | 12/300 [00:27<10:11,  2.12s/it]train/val metrics at epoch 13 | loss : 0.72/1.00 | micro_F1 : 0.48/0.43:   4%|▍         | 13/300 [00:28<10:17,  2.15s/it]train/val metrics at epoch 14 | loss : 0.71/1.01 | micro_F1 : 0.48/0.44:   4%|▍         | 13/300 [00:30<10:17,  2.15s/it]train/val metrics at epoch 14 | loss : 0.71/1.01 | micro_F1 : 0.48/0.44:   5%|▍         | 14/300 [00:30<10:10,  2.13s/it]train/val metrics at epoch 15 | loss : 0.70/1.00 | micro_F1 : 0.48/0.42:   5%|▍         | 14/300 [00:32<10:10,  2.13s/it]train/val metrics at epoch 15 | loss : 0.70/1.00 | micro_F1 : 0.48/0.42:   5%|▌         | 15/300 [00:32<10:05,  2.12s/it]train/val metrics at epoch 16 | loss : 0.68/1.01 | micro_F1 : 0.49/0.44:   5%|▌         | 15/300 [00:34<10:05,  2.12s/it]train/val metrics at epoch 16 | loss : 0.68/1.01 | micro_F1 : 0.49/0.44:   5%|▌         | 16/300 [00:34<09:59,  2.11s/it]train/val metrics at epoch 17 | loss : 0.67/1.02 | micro_F1 : 0.50/0.44:   5%|▌         | 16/300 [00:36<09:59,  2.11s/it]train/val metrics at epoch 17 | loss : 0.67/1.02 | micro_F1 : 0.50/0.44:   6%|▌         | 17/300 [00:36<10:02,  2.13s/it]train/val metrics at epoch 18 | loss : 0.67/1.02 | micro_F1 : 0.50/0.44:   6%|▌         | 17/300 [00:38<10:02,  2.13s/it]train/val metrics at epoch 18 | loss : 0.67/1.02 | micro_F1 : 0.50/0.44:   6%|▌         | 17/300 [00:39<10:54,  2.31s/it]
wandb: Waiting for W&B process to finish... (success).
wandb: 
wandb: Run history:
wandb:          epoch ▁
wandb:  learning rate ▁
wandb:           time ▁
wandb:     train loss ▁
wandb: train macro F1 ▁
wandb: train micro F1 ▁
wandb:       val loss ▁
wandb:   val macro F1 ▁
wandb:   val micro F1 ▁
wandb: 
wandb: Run summary:
wandb:          epoch 18
wandb:  learning rate 0.0
wandb:           time 40.7681
wandb:     train loss 0.66541
wandb: train macro F1 0.44777
wandb: train micro F1 0.50482
wandb:       val loss 1.0191
wandb:   val macro F1 0.34562
wandb:   val micro F1 0.43653
wandb: 
wandb: 🚀 View run dashing-spaceship-133 at: https://wandb.ai/msc-nicola/train_all_MLC/runs/p173lgq9
wandb: Synced 5 W&B file(s), 1 media file(s), 1 artifact file(s) and 0 other file(s)
wandb: Find logs at: ./wandb/run-20230627_030347-p173lgq9/logs
wandb: Currently logged in as: tha-santacruz (msc-nicola). Use `wandb login --relogin` to force relogin
wandb: Tracking run with wandb version 0.15.4
wandb: Run data is saved locally in /home/santacro/masters_thesis/all_runs/wandb/run-20230627_030449-ppz6znml
wandb: Run `wandb offline` to turn off syncing.
wandb: Syncing run young-snowball-133
wandb: ⭐️ View project at https://wandb.ai/msc-nicola/test_all_MLC
wandb: 🚀 View run at https://wandb.ai/msc-nicola/test_all_MLC/runs/ppz6znml
Running job on GPU : Tesla V100-PCIE-32GB
Namespace(BATCH_SIZE=128, CHECKPOINTS_PATH='/scratch/izar/santacro/checkpoints/', DATASET_PATH='/scratch/izar/santacro/final_data/', DEVICE='cuda:0', EMBEDDING='doc2vec', EPOCH_NUM=300, FRACTION=20, HIDDEN_SIZE=8192, JOB_ID=133, LEARNING_RATE=1e-05, LEVEL='L1', LOAD_CHECKPOINT='yes', MERGE_METHOD='fusion', MIN_LEARNING_RATE=1e-06, NUM_WORKERS=8, RANDOM_STATE=3, RUN_MODE='test', SAVE_CHECKPOINTS='yes', SPLITTING='progressive', TARGET_BASE='set', WANDB_ENTITY='msc-nicola', WANDB_LOGS='yes', WANDB_PROJECT='all_MLC')
Number of train samples : 9920
Number of val samples : 1102
Number of test samples : 5350
Loaded model state dict from file /scratch/izar/santacro/checkpoints//3_doc2vec_embedding_L1_level_fusion_merging_progressive_20%_8192.pth
wandb: Waiting for W&B process to finish... (success).
wandb: - 0.151 MB of 0.185 MB uploaded (0.000 MB deduped)wandb: \ 0.185 MB of 0.185 MB uploaded (0.000 MB deduped)wandb: | 0.190 MB of 0.190 MB uploaded (0.000 MB deduped)wandb: 
wandb: Run history:
wandb:     test loss ▁
wandb: test macro F1 ▁
wandb:  test macro H ▁
wandb: test micro F1 ▁
wandb: 
wandb: Run summary:
wandb:     test loss 1.14319
wandb: test macro F1 0.30959
wandb:  test macro H 1.78374
wandb: test micro F1 0.40135
wandb: 
wandb: 🚀 View run young-snowball-133 at: https://wandb.ai/msc-nicola/test_all_MLC/runs/ppz6znml
wandb: Synced 4 W&B file(s), 10 media file(s), 1 artifact file(s) and 0 other file(s)
wandb: Find logs at: ./wandb/run-20230627_030449-ppz6znml/logs
