/usr/share/lmod/lmod/init/sh: line 20: /usr/share/lmod/lmod/libexec//clearMT_cmd: No such file or directory
wandb: Currently logged in as: tha-santacruz (msc-nicola). Use `wandb login --relogin` to force relogin
wandb: Tracking run with wandb version 0.15.4
wandb: Run data is saved locally in /home/santacro/masters_thesis/all_runs/wandb/run-20230627_031150-soke7cj2
wandb: Run `wandb offline` to turn off syncing.
wandb: Syncing run youthful-fire-160
wandb: ⭐️ View project at https://wandb.ai/msc-nicola/train_all_MLC
wandb: 🚀 View run at https://wandb.ai/msc-nicola/train_all_MLC/runs/soke7cj2
Running job on GPU : Tesla V100-PCIE-32GB
Namespace(BATCH_SIZE=128, CHECKPOINTS_PATH='/scratch/izar/santacro/checkpoints/', DATASET_PATH='/scratch/izar/santacro/final_data/', DEVICE='cuda:0', EMBEDDING='doc2vec', EPOCH_NUM=300, FRACTION=40, HIDDEN_SIZE=8192, JOB_ID=161, LEARNING_RATE=1e-05, LEVEL='L1', LOAD_CHECKPOINT='no', MERGE_METHOD='selection', MIN_LEARNING_RATE=1e-06, NUM_WORKERS=8, RANDOM_STATE=4, RUN_MODE='train', SAVE_CHECKPOINTS='yes', SPLITTING='spatial', TARGET_BASE='set', WANDB_ENTITY='msc-nicola', WANDB_LOGS='yes', WANDB_PROJECT='all_MLC')
Number of train samples : 10324
Number of val samples : 1624
Number of test samples : 4689
  0%|          | 0/300 [00:00<?, ?it/s]train/val metrics at epoch 1 | loss : 1.17/0.99 | micro_F1 : 0.25/0.26:   0%|          | 0/300 [00:02<?, ?it/s]train/val metrics at epoch 1 | loss : 1.17/0.99 | micro_F1 : 0.25/0.26:   0%|          | 1/300 [00:02<14:56,  3.00s/it]train/val metrics at epoch 2 | loss : 1.10/0.97 | micro_F1 : 0.32/0.30:   0%|          | 1/300 [00:05<14:56,  3.00s/it]train/val metrics at epoch 2 | loss : 1.10/0.97 | micro_F1 : 0.32/0.30:   1%|          | 2/300 [00:05<13:00,  2.62s/it]train/val metrics at epoch 3 | loss : 1.05/0.94 | micro_F1 : 0.35/0.31:   1%|          | 2/300 [00:07<13:00,  2.62s/it]train/val metrics at epoch 3 | loss : 1.05/0.94 | micro_F1 : 0.35/0.31:   1%|          | 3/300 [00:07<12:24,  2.51s/it]train/val metrics at epoch 4 | loss : 1.00/0.93 | micro_F1 : 0.37/0.32:   1%|          | 3/300 [00:09<12:24,  2.51s/it]train/val metrics at epoch 4 | loss : 1.00/0.93 | micro_F1 : 0.37/0.32:   1%|▏         | 4/300 [00:10<12:05,  2.45s/it]train/val metrics at epoch 5 | loss : 0.96/0.92 | micro_F1 : 0.38/0.32:   1%|▏         | 4/300 [00:12<12:05,  2.45s/it]train/val metrics at epoch 5 | loss : 0.96/0.92 | micro_F1 : 0.38/0.32:   2%|▏         | 5/300 [00:12<12:10,  2.48s/it]train/val metrics at epoch 6 | loss : 0.93/0.91 | micro_F1 : 0.39/0.33:   2%|▏         | 5/300 [00:14<12:10,  2.48s/it]train/val metrics at epoch 6 | loss : 0.93/0.91 | micro_F1 : 0.39/0.33:   2%|▏         | 6/300 [00:15<11:59,  2.45s/it]train/val metrics at epoch 7 | loss : 0.90/0.91 | micro_F1 : 0.40/0.34:   2%|▏         | 6/300 [00:17<11:59,  2.45s/it]train/val metrics at epoch 7 | loss : 0.90/0.91 | micro_F1 : 0.40/0.34:   2%|▏         | 7/300 [00:17<11:53,  2.43s/it]train/val metrics at epoch 8 | loss : 0.87/0.91 | micro_F1 : 0.41/0.33:   2%|▏         | 7/300 [00:19<11:53,  2.43s/it]train/val metrics at epoch 8 | loss : 0.87/0.91 | micro_F1 : 0.41/0.33:   3%|▎         | 8/300 [00:19<11:40,  2.40s/it]train/val metrics at epoch 9 | loss : 0.84/0.91 | micro_F1 : 0.42/0.34:   3%|▎         | 8/300 [00:21<11:40,  2.40s/it]train/val metrics at epoch 9 | loss : 0.84/0.91 | micro_F1 : 0.42/0.34:   3%|▎         | 9/300 [00:22<11:36,  2.39s/it]train/val metrics at epoch 10 | loss : 0.81/0.91 | micro_F1 : 0.43/0.35:   3%|▎         | 9/300 [00:24<11:36,  2.39s/it]train/val metrics at epoch 10 | loss : 0.81/0.91 | micro_F1 : 0.43/0.35:   3%|▎         | 10/300 [00:24<11:32,  2.39s/it]train/val metrics at epoch 11 | loss : 0.79/0.91 | micro_F1 : 0.44/0.34:   3%|▎         | 10/300 [00:26<11:32,  2.39s/it]train/val metrics at epoch 11 | loss : 0.79/0.91 | micro_F1 : 0.44/0.34:   4%|▎         | 11/300 [00:26<11:23,  2.37s/it]train/val metrics at epoch 12 | loss : 0.76/0.92 | micro_F1 : 0.45/0.34:   4%|▎         | 11/300 [00:28<11:23,  2.37s/it]train/val metrics at epoch 12 | loss : 0.76/0.92 | micro_F1 : 0.45/0.34:   4%|▍         | 12/300 [00:29<11:21,  2.37s/it]train/val metrics at epoch 13 | loss : 0.75/0.92 | micro_F1 : 0.46/0.35:   4%|▍         | 12/300 [00:31<11:21,  2.37s/it]train/val metrics at epoch 13 | loss : 0.75/0.92 | micro_F1 : 0.46/0.35:   4%|▍         | 13/300 [00:31<11:18,  2.36s/it]train/val metrics at epoch 14 | loss : 0.73/0.92 | micro_F1 : 0.47/0.36:   4%|▍         | 13/300 [00:33<11:18,  2.36s/it]train/val metrics at epoch 14 | loss : 0.73/0.92 | micro_F1 : 0.47/0.36:   5%|▍         | 14/300 [00:33<11:23,  2.39s/it]train/val metrics at epoch 15 | loss : 0.72/0.93 | micro_F1 : 0.47/0.35:   5%|▍         | 14/300 [00:36<11:23,  2.39s/it]train/val metrics at epoch 15 | loss : 0.72/0.93 | micro_F1 : 0.47/0.35:   5%|▌         | 15/300 [00:36<11:18,  2.38s/it]train/val metrics at epoch 16 | loss : 0.71/0.93 | micro_F1 : 0.48/0.35:   5%|▌         | 15/300 [00:38<11:18,  2.38s/it]train/val metrics at epoch 16 | loss : 0.71/0.93 | micro_F1 : 0.48/0.35:   5%|▌         | 16/300 [00:38<11:16,  2.38s/it]train/val metrics at epoch 17 | loss : 0.70/0.93 | micro_F1 : 0.48/0.35:   5%|▌         | 16/300 [00:40<11:16,  2.38s/it]train/val metrics at epoch 17 | loss : 0.70/0.93 | micro_F1 : 0.48/0.35:   6%|▌         | 17/300 [00:41<11:17,  2.40s/it]train/val metrics at epoch 18 | loss : 0.70/0.94 | micro_F1 : 0.49/0.36:   6%|▌         | 17/300 [00:43<11:17,  2.40s/it]train/val metrics at epoch 18 | loss : 0.70/0.94 | micro_F1 : 0.49/0.36:   6%|▌         | 17/300 [00:44<12:17,  2.61s/it]
wandb: Waiting for W&B process to finish... (success).
wandb: 
wandb: Run history:
wandb:          epoch ▁
wandb:  learning rate ▁
wandb:           time ▁
wandb:     train loss ▁
wandb: train macro F1 ▁
wandb: train micro F1 ▁
wandb:       val loss ▁
wandb:   val macro F1 ▁
wandb:   val micro F1 ▁
wandb: 
wandb: Run summary:
wandb:          epoch 18
wandb:  learning rate 0.0
wandb:           time 45.81476
wandb:     train loss 0.69771
wandb: train macro F1 0.42204
wandb: train micro F1 0.48503
wandb:       val loss 0.93805
wandb:   val macro F1 0.241
wandb:   val micro F1 0.35603
wandb: 
wandb: 🚀 View run youthful-fire-160 at: https://wandb.ai/msc-nicola/train_all_MLC/runs/soke7cj2
wandb: Synced 5 W&B file(s), 1 media file(s), 1 artifact file(s) and 0 other file(s)
wandb: Find logs at: ./wandb/run-20230627_031150-soke7cj2/logs
wandb: Currently logged in as: tha-santacruz (msc-nicola). Use `wandb login --relogin` to force relogin
wandb: Tracking run with wandb version 0.15.4
wandb: Run data is saved locally in /home/santacro/masters_thesis/all_runs/wandb/run-20230627_031304-sk9u4z5y
wandb: Run `wandb offline` to turn off syncing.
wandb: Syncing run visionary-snowflake-160
wandb: ⭐️ View project at https://wandb.ai/msc-nicola/test_all_MLC
wandb: 🚀 View run at https://wandb.ai/msc-nicola/test_all_MLC/runs/sk9u4z5y
Running job on GPU : Tesla V100-PCIE-32GB
Namespace(BATCH_SIZE=128, CHECKPOINTS_PATH='/scratch/izar/santacro/checkpoints/', DATASET_PATH='/scratch/izar/santacro/final_data/', DEVICE='cuda:0', EMBEDDING='doc2vec', EPOCH_NUM=300, FRACTION=40, HIDDEN_SIZE=8192, JOB_ID=161, LEARNING_RATE=1e-05, LEVEL='L1', LOAD_CHECKPOINT='yes', MERGE_METHOD='selection', MIN_LEARNING_RATE=1e-06, NUM_WORKERS=8, RANDOM_STATE=4, RUN_MODE='test', SAVE_CHECKPOINTS='yes', SPLITTING='spatial', TARGET_BASE='set', WANDB_ENTITY='msc-nicola', WANDB_LOGS='yes', WANDB_PROJECT='all_MLC')
Number of train samples : 10324
Number of val samples : 1624
Number of test samples : 4689
Loaded model state dict from file /scratch/izar/santacro/checkpoints//4_doc2vec_embedding_L1_level_selection_merging_spatial_splitting_8192.pth
wandb: Waiting for W&B process to finish... (success).
wandb: - 0.027 MB of 0.183 MB uploaded (0.000 MB deduped)wandb: \ 0.183 MB of 0.183 MB uploaded (0.000 MB deduped)wandb: | 0.183 MB of 0.188 MB uploaded (0.000 MB deduped)wandb: / 0.188 MB of 0.188 MB uploaded (0.000 MB deduped)wandb: 
wandb: Run history:
wandb:     test loss ▁
wandb: test macro F1 ▁
wandb:  test macro H ▁
wandb: test micro F1 ▁
wandb: 
wandb: Run summary:
wandb:     test loss 0.93987
wandb: test macro F1 0.26005
wandb:  test macro H 2.12519
wandb: test micro F1 0.35821
wandb: 
wandb: 🚀 View run visionary-snowflake-160 at: https://wandb.ai/msc-nicola/test_all_MLC/runs/sk9u4z5y
wandb: Synced 4 W&B file(s), 10 media file(s), 1 artifact file(s) and 0 other file(s)
wandb: Find logs at: ./wandb/run-20230627_031304-sk9u4z5y/logs
