/usr/share/lmod/lmod/init/sh: line 20: /usr/share/lmod/lmod/libexec//clearMT_cmd: No such file or directory
wandb: Currently logged in as: tha-santacruz (msc-nicola). Use `wandb login --relogin` to force relogin
wandb: Tracking run with wandb version 0.15.4
wandb: Run data is saved locally in /home/santacro/masters_thesis/all_runs/wandb/run-20230627_025115-xcqorcyd
wandb: Run `wandb offline` to turn off syncing.
wandb: Syncing run effortless-yogurt-103
wandb: ⭐️ View project at https://wandb.ai/msc-nicola/train_all_MLC
wandb: 🚀 View run at https://wandb.ai/msc-nicola/train_all_MLC/runs/xcqorcyd
Running job on GPU : Tesla V100-PCIE-32GB
Namespace(BATCH_SIZE=128, CHECKPOINTS_PATH='/scratch/izar/santacro/checkpoints/', DATASET_PATH='/scratch/izar/santacro/final_data/', DEVICE='cuda:0', EMBEDDING='agnostic', EPOCH_NUM=300, FRACTION=90, HIDDEN_SIZE=8192, JOB_ID=103, LEARNING_RATE=1e-05, LEVEL='L1', LOAD_CHECKPOINT='no', MERGE_METHOD='fusion', MIN_LEARNING_RATE=1e-06, NUM_WORKERS=8, RANDOM_STATE=2, RUN_MODE='train', SAVE_CHECKPOINTS='yes', SPLITTING='progressive', TARGET_BASE='set', WANDB_ENTITY='msc-nicola', WANDB_LOGS='yes', WANDB_PROJECT='all_MLC')
Number of train samples : 9720
Number of val samples : 1080
Number of test samples : 5500
  0%|          | 0/300 [00:00<?, ?it/s]train/val metrics at epoch 1 | loss : 1.19/1.16 | micro_F1 : 0.27/0.31:   0%|          | 0/300 [00:03<?, ?it/s]train/val metrics at epoch 1 | loss : 1.19/1.16 | micro_F1 : 0.27/0.31:   0%|          | 1/300 [00:03<18:54,  3.79s/it]train/val metrics at epoch 2 | loss : 1.12/1.08 | micro_F1 : 0.32/0.31:   0%|          | 1/300 [00:06<18:54,  3.79s/it]train/val metrics at epoch 2 | loss : 1.12/1.08 | micro_F1 : 0.32/0.31:   1%|          | 2/300 [00:06<17:01,  3.43s/it]train/val metrics at epoch 3 | loss : 1.06/1.06 | micro_F1 : 0.34/0.32:   1%|          | 2/300 [00:09<17:01,  3.43s/it]train/val metrics at epoch 3 | loss : 1.06/1.06 | micro_F1 : 0.34/0.32:   1%|          | 3/300 [00:10<16:24,  3.32s/it]train/val metrics at epoch 4 | loss : 1.00/1.06 | micro_F1 : 0.36/0.34:   1%|          | 3/300 [00:12<16:24,  3.32s/it]train/val metrics at epoch 4 | loss : 1.00/1.06 | micro_F1 : 0.36/0.34:   1%|▏         | 4/300 [00:13<15:59,  3.24s/it]train/val metrics at epoch 5 | loss : 0.94/1.03 | micro_F1 : 0.39/0.35:   1%|▏         | 4/300 [00:16<15:59,  3.24s/it]train/val metrics at epoch 5 | loss : 0.94/1.03 | micro_F1 : 0.39/0.35:   2%|▏         | 5/300 [00:16<15:46,  3.21s/it]train/val metrics at epoch 6 | loss : 0.89/1.02 | micro_F1 : 0.42/0.37:   2%|▏         | 5/300 [00:19<15:46,  3.21s/it]train/val metrics at epoch 6 | loss : 0.89/1.02 | micro_F1 : 0.42/0.37:   2%|▏         | 6/300 [00:19<15:36,  3.19s/it]train/val metrics at epoch 7 | loss : 0.84/1.03 | micro_F1 : 0.44/0.39:   2%|▏         | 6/300 [00:22<15:36,  3.19s/it]train/val metrics at epoch 7 | loss : 0.84/1.03 | micro_F1 : 0.44/0.39:   2%|▏         | 7/300 [00:22<15:27,  3.17s/it]train/val metrics at epoch 8 | loss : 0.79/1.02 | micro_F1 : 0.47/0.39:   2%|▏         | 7/300 [00:25<15:27,  3.17s/it]train/val metrics at epoch 8 | loss : 0.79/1.02 | micro_F1 : 0.47/0.39:   3%|▎         | 8/300 [00:25<15:20,  3.15s/it]train/val metrics at epoch 9 | loss : 0.74/1.02 | micro_F1 : 0.49/0.41:   3%|▎         | 8/300 [00:28<15:20,  3.15s/it]train/val metrics at epoch 9 | loss : 0.74/1.02 | micro_F1 : 0.49/0.41:   3%|▎         | 9/300 [00:29<15:20,  3.16s/it]train/val metrics at epoch 10 | loss : 0.69/1.05 | micro_F1 : 0.51/0.41:   3%|▎         | 9/300 [00:32<15:20,  3.16s/it]train/val metrics at epoch 10 | loss : 0.69/1.05 | micro_F1 : 0.51/0.41:   3%|▎         | 10/300 [00:32<15:39,  3.24s/it]train/val metrics at epoch 11 | loss : 0.64/1.08 | micro_F1 : 0.53/0.42:   3%|▎         | 10/300 [00:35<15:39,  3.24s/it]train/val metrics at epoch 11 | loss : 0.64/1.08 | micro_F1 : 0.53/0.42:   4%|▎         | 11/300 [00:35<15:27,  3.21s/it]train/val metrics at epoch 12 | loss : 0.60/1.12 | micro_F1 : 0.56/0.43:   4%|▎         | 11/300 [00:38<15:27,  3.21s/it]train/val metrics at epoch 12 | loss : 0.60/1.12 | micro_F1 : 0.56/0.43:   4%|▍         | 12/300 [00:39<15:51,  3.30s/it]train/val metrics at epoch 13 | loss : 0.56/1.10 | micro_F1 : 0.58/0.42:   4%|▍         | 12/300 [00:41<15:51,  3.30s/it]train/val metrics at epoch 13 | loss : 0.56/1.10 | micro_F1 : 0.58/0.42:   4%|▍         | 13/300 [00:42<15:36,  3.26s/it]train/val metrics at epoch 14 | loss : 0.54/1.12 | micro_F1 : 0.59/0.43:   4%|▍         | 13/300 [00:45<15:36,  3.26s/it]train/val metrics at epoch 14 | loss : 0.54/1.12 | micro_F1 : 0.59/0.43:   5%|▍         | 14/300 [00:45<15:27,  3.24s/it]train/val metrics at epoch 15 | loss : 0.52/1.15 | micro_F1 : 0.60/0.43:   5%|▍         | 14/300 [00:48<15:27,  3.24s/it]train/val metrics at epoch 15 | loss : 0.52/1.15 | micro_F1 : 0.60/0.43:   5%|▌         | 15/300 [00:48<15:16,  3.22s/it]train/val metrics at epoch 16 | loss : 0.50/1.17 | micro_F1 : 0.61/0.43:   5%|▌         | 15/300 [00:51<15:16,  3.22s/it]train/val metrics at epoch 16 | loss : 0.50/1.17 | micro_F1 : 0.61/0.43:   5%|▌         | 16/300 [00:51<15:20,  3.24s/it]train/val metrics at epoch 17 | loss : 0.48/1.21 | micro_F1 : 0.62/0.43:   5%|▌         | 16/300 [00:54<15:20,  3.24s/it]train/val metrics at epoch 17 | loss : 0.48/1.21 | micro_F1 : 0.62/0.43:   6%|▌         | 17/300 [00:55<15:09,  3.21s/it]train/val metrics at epoch 18 | loss : 0.47/1.22 | micro_F1 : 0.63/0.43:   6%|▌         | 17/300 [00:57<15:09,  3.21s/it]train/val metrics at epoch 18 | loss : 0.47/1.22 | micro_F1 : 0.63/0.43:   6%|▌         | 17/300 [00:58<16:18,  3.46s/it]
wandb: Waiting for W&B process to finish... (success).
wandb: 
wandb: Run history:
wandb:          epoch ▁
wandb:  learning rate ▁
wandb:           time ▁
wandb:     train loss ▁
wandb: train macro F1 ▁
wandb: train micro F1 ▁
wandb:       val loss ▁
wandb:   val macro F1 ▁
wandb:   val micro F1 ▁
wandb: 
wandb: Run summary:
wandb:          epoch 18
wandb:  learning rate 0.0
wandb:           time 62.7627
wandb:     train loss 0.47493
wandb: train macro F1 0.56278
wandb: train micro F1 0.62927
wandb:       val loss 1.21538
wandb:   val macro F1 0.31034
wandb:   val micro F1 0.43056
wandb: 
wandb: 🚀 View run effortless-yogurt-103 at: https://wandb.ai/msc-nicola/train_all_MLC/runs/xcqorcyd
wandb: Synced 5 W&B file(s), 1 media file(s), 1 artifact file(s) and 0 other file(s)
wandb: Find logs at: ./wandb/run-20230627_025115-xcqorcyd/logs
wandb: Currently logged in as: tha-santacruz (msc-nicola). Use `wandb login --relogin` to force relogin
wandb: Tracking run with wandb version 0.15.4
wandb: Run data is saved locally in /home/santacro/masters_thesis/all_runs/wandb/run-20230627_025240-hvduujdf
wandb: Run `wandb offline` to turn off syncing.
wandb: Syncing run fast-universe-104
wandb: ⭐️ View project at https://wandb.ai/msc-nicola/test_all_MLC
wandb: 🚀 View run at https://wandb.ai/msc-nicola/test_all_MLC/runs/hvduujdf
Running job on GPU : Tesla V100-PCIE-32GB
Namespace(BATCH_SIZE=128, CHECKPOINTS_PATH='/scratch/izar/santacro/checkpoints/', DATASET_PATH='/scratch/izar/santacro/final_data/', DEVICE='cuda:0', EMBEDDING='agnostic', EPOCH_NUM=300, FRACTION=90, HIDDEN_SIZE=8192, JOB_ID=103, LEARNING_RATE=1e-05, LEVEL='L1', LOAD_CHECKPOINT='yes', MERGE_METHOD='fusion', MIN_LEARNING_RATE=1e-06, NUM_WORKERS=8, RANDOM_STATE=2, RUN_MODE='test', SAVE_CHECKPOINTS='yes', SPLITTING='progressive', TARGET_BASE='set', WANDB_ENTITY='msc-nicola', WANDB_LOGS='yes', WANDB_PROJECT='all_MLC')
Number of train samples : 9720
Number of val samples : 1080
Number of test samples : 5500
Loaded model state dict from file /scratch/izar/santacro/checkpoints//2_agnostic_embedding_L1_level_fusion_merging_progressive_90%_8192.pth
wandb: Waiting for W&B process to finish... (success).
wandb: 
wandb: Run history:
wandb:     test loss ▁
wandb: test macro F1 ▁
wandb:  test macro H ▁
wandb: test micro F1 ▁
wandb: 
wandb: Run summary:
wandb:     test loss 1.29818
wandb: test macro F1 0.3051
wandb:  test macro H 1.78891
wandb: test micro F1 0.4175
wandb: 
wandb: 🚀 View run fast-universe-104 at: https://wandb.ai/msc-nicola/test_all_MLC/runs/hvduujdf
wandb: Synced 4 W&B file(s), 10 media file(s), 1 artifact file(s) and 0 other file(s)
wandb: Find logs at: ./wandb/run-20230627_025240-hvduujdf/logs
