/usr/share/lmod/lmod/init/sh: line 20: /usr/share/lmod/lmod/libexec//clearMT_cmd: No such file or directory
wandb: Currently logged in as: tha-santacruz (msc-nicola). Use `wandb login --relogin` to force relogin
wandb: Tracking run with wandb version 0.15.4
wandb: Run data is saved locally in /home/santacro/masters_thesis/all_runs/wandb/run-20230626_213243-rarw0h7y
wandb: Run `wandb offline` to turn off syncing.
wandb: Syncing run worthy-snow-15
wandb: ⭐️ View project at https://wandb.ai/msc-nicola/train_all_MLC
wandb: 🚀 View run at https://wandb.ai/msc-nicola/train_all_MLC/runs/rarw0h7y
Running job on GPU : Tesla V100-PCIE-32GB
Namespace(BATCH_SIZE=128, CHECKPOINTS_PATH='/scratch/izar/santacro/checkpoints/', DATASET_PATH='/scratch/izar/santacro/final_data/', DEVICE='cuda:0', EMBEDDING='agnostic', EPOCH_NUM=300, FRACTION=40, HIDDEN_SIZE=8192, JOB_ID=15, LEARNING_RATE=1e-05, LEVEL='L2', LOAD_CHECKPOINT='no', MERGE_METHOD='fusion', MIN_LEARNING_RATE=1e-06, NUM_WORKERS=8, RANDOM_STATE=1, RUN_MODE='train', SAVE_CHECKPOINTS='yes', SPLITTING='spatial', TARGET_BASE='set', WANDB_ENTITY='msc-nicola', WANDB_LOGS='yes', WANDB_PROJECT='all_MLC')
Number of train samples : 9286
Number of val samples : 1452
Number of test samples : 4221
  0%|          | 0/300 [00:00<?, ?it/s]train/val metrics at epoch 1 | loss : 1.31/1.06 | micro_F1 : 0.09/0.07:   0%|          | 0/300 [00:04<?, ?it/s]train/val metrics at epoch 1 | loss : 1.31/1.06 | micro_F1 : 0.09/0.07:   0%|          | 1/300 [00:04<22:20,  4.48s/it]train/val metrics at epoch 2 | loss : 1.25/1.04 | micro_F1 : 0.11/0.08:   0%|          | 1/300 [00:07<22:20,  4.48s/it]train/val metrics at epoch 2 | loss : 1.25/1.04 | micro_F1 : 0.11/0.08:   1%|          | 2/300 [00:07<18:30,  3.73s/it]train/val metrics at epoch 3 | loss : 1.20/1.02 | micro_F1 : 0.12/0.09:   1%|          | 2/300 [00:10<18:30,  3.73s/it]train/val metrics at epoch 3 | loss : 1.20/1.02 | micro_F1 : 0.12/0.09:   1%|          | 3/300 [00:10<17:26,  3.52s/it]train/val metrics at epoch 4 | loss : 1.14/1.01 | micro_F1 : 0.14/0.09:   1%|          | 3/300 [00:13<17:26,  3.52s/it]train/val metrics at epoch 4 | loss : 1.14/1.01 | micro_F1 : 0.14/0.09:   1%|▏         | 4/300 [00:14<16:46,  3.40s/it]train/val metrics at epoch 5 | loss : 1.10/0.99 | micro_F1 : 0.15/0.10:   1%|▏         | 4/300 [00:17<16:46,  3.40s/it]train/val metrics at epoch 5 | loss : 1.10/0.99 | micro_F1 : 0.15/0.10:   2%|▏         | 5/300 [00:17<16:26,  3.34s/it]train/val metrics at epoch 6 | loss : 1.05/0.98 | micro_F1 : 0.16/0.11:   2%|▏         | 5/300 [00:20<16:26,  3.34s/it]train/val metrics at epoch 6 | loss : 1.05/0.98 | micro_F1 : 0.16/0.11:   2%|▏         | 6/300 [00:20<16:09,  3.30s/it]train/val metrics at epoch 7 | loss : 1.01/1.02 | micro_F1 : 0.17/0.12:   2%|▏         | 6/300 [00:23<16:09,  3.30s/it]train/val metrics at epoch 7 | loss : 1.01/1.02 | micro_F1 : 0.17/0.12:   2%|▏         | 7/300 [00:23<16:03,  3.29s/it]train/val metrics at epoch 8 | loss : 0.97/0.94 | micro_F1 : 0.18/0.12:   2%|▏         | 7/300 [00:26<16:03,  3.29s/it]train/val metrics at epoch 8 | loss : 0.97/0.94 | micro_F1 : 0.18/0.12:   3%|▎         | 8/300 [00:27<15:50,  3.26s/it]train/val metrics at epoch 9 | loss : 0.92/0.93 | micro_F1 : 0.19/0.13:   3%|▎         | 8/300 [00:30<15:50,  3.26s/it]train/val metrics at epoch 9 | loss : 0.92/0.93 | micro_F1 : 0.19/0.13:   3%|▎         | 9/300 [00:30<15:45,  3.25s/it]train/val metrics at epoch 10 | loss : 0.89/0.92 | micro_F1 : 0.21/0.14:   3%|▎         | 9/300 [00:33<15:45,  3.25s/it]train/val metrics at epoch 10 | loss : 0.89/0.92 | micro_F1 : 0.21/0.14:   3%|▎         | 10/300 [00:33<15:37,  3.23s/it]train/val metrics at epoch 11 | loss : 0.85/0.93 | micro_F1 : 0.22/0.14:   3%|▎         | 10/300 [00:36<15:37,  3.23s/it]train/val metrics at epoch 11 | loss : 0.85/0.93 | micro_F1 : 0.22/0.14:   4%|▎         | 11/300 [00:36<15:32,  3.23s/it]train/val metrics at epoch 12 | loss : 0.82/0.91 | micro_F1 : 0.23/0.15:   4%|▎         | 11/300 [00:39<15:32,  3.23s/it]train/val metrics at epoch 12 | loss : 0.82/0.91 | micro_F1 : 0.23/0.15:   4%|▍         | 12/300 [00:39<15:33,  3.24s/it]train/val metrics at epoch 13 | loss : 0.79/0.92 | micro_F1 : 0.24/0.16:   4%|▍         | 12/300 [00:42<15:33,  3.24s/it]train/val metrics at epoch 13 | loss : 0.79/0.92 | micro_F1 : 0.24/0.16:   4%|▍         | 13/300 [00:43<15:30,  3.24s/it]train/val metrics at epoch 14 | loss : 0.76/0.91 | micro_F1 : 0.25/0.16:   4%|▍         | 13/300 [00:46<15:30,  3.24s/it]train/val metrics at epoch 14 | loss : 0.76/0.91 | micro_F1 : 0.25/0.16:   5%|▍         | 14/300 [00:46<15:22,  3.23s/it]train/val metrics at epoch 15 | loss : 0.73/0.91 | micro_F1 : 0.26/0.16:   5%|▍         | 14/300 [00:49<15:22,  3.23s/it]train/val metrics at epoch 15 | loss : 0.73/0.91 | micro_F1 : 0.26/0.16:   5%|▌         | 15/300 [00:49<15:18,  3.22s/it]train/val metrics at epoch 16 | loss : 0.70/0.94 | micro_F1 : 0.27/0.17:   5%|▌         | 15/300 [00:52<15:18,  3.22s/it]train/val metrics at epoch 16 | loss : 0.70/0.94 | micro_F1 : 0.27/0.17:   5%|▌         | 16/300 [00:52<15:15,  3.22s/it]train/val metrics at epoch 17 | loss : 0.67/0.92 | micro_F1 : 0.28/0.18:   5%|▌         | 16/300 [00:55<15:15,  3.22s/it]train/val metrics at epoch 17 | loss : 0.67/0.92 | micro_F1 : 0.28/0.18:   6%|▌         | 17/300 [00:56<15:08,  3.21s/it]train/val metrics at epoch 18 | loss : 0.66/0.94 | micro_F1 : 0.29/0.17:   6%|▌         | 17/300 [00:58<15:08,  3.21s/it]train/val metrics at epoch 18 | loss : 0.66/0.94 | micro_F1 : 0.29/0.17:   6%|▌         | 18/300 [00:59<15:05,  3.21s/it]train/val metrics at epoch 19 | loss : 0.65/0.93 | micro_F1 : 0.29/0.18:   6%|▌         | 18/300 [01:02<15:05,  3.21s/it]train/val metrics at epoch 19 | loss : 0.65/0.93 | micro_F1 : 0.29/0.18:   6%|▋         | 19/300 [01:02<15:10,  3.24s/it]train/val metrics at epoch 20 | loss : 0.64/0.96 | micro_F1 : 0.30/0.17:   6%|▋         | 19/300 [01:05<15:10,  3.24s/it]train/val metrics at epoch 20 | loss : 0.64/0.96 | micro_F1 : 0.30/0.17:   7%|▋         | 20/300 [01:05<15:06,  3.24s/it]train/val metrics at epoch 21 | loss : 0.63/0.94 | micro_F1 : 0.30/0.18:   7%|▋         | 20/300 [01:08<15:06,  3.24s/it]train/val metrics at epoch 21 | loss : 0.63/0.94 | micro_F1 : 0.30/0.18:   7%|▋         | 21/300 [01:09<15:00,  3.23s/it]train/val metrics at epoch 22 | loss : 0.62/0.95 | micro_F1 : 0.31/0.18:   7%|▋         | 21/300 [01:11<15:00,  3.23s/it]train/val metrics at epoch 22 | loss : 0.62/0.95 | micro_F1 : 0.31/0.18:   7%|▋         | 21/300 [01:12<16:08,  3.47s/it]
wandb: Waiting for W&B process to finish... (success).
wandb: 
wandb: Run history:
wandb:          epoch ▁
wandb:  learning rate ▁
wandb:           time ▁
wandb:     train loss ▁
wandb: train macro F1 ▁
wandb: train micro F1 ▁
wandb:       val loss ▁
wandb:   val macro F1 ▁
wandb:   val micro F1 ▁
wandb: 
wandb: Run summary:
wandb:          epoch 22
wandb:  learning rate 0.0
wandb:           time 75.1373
wandb:     train loss 0.61992
wandb: train macro F1 0.24293
wandb: train micro F1 0.30657
wandb:       val loss 0.94728
wandb:   val macro F1 0.10729
wandb:   val micro F1 0.179
wandb: 
wandb: 🚀 View run worthy-snow-15 at: https://wandb.ai/msc-nicola/train_all_MLC/runs/rarw0h7y
wandb: Synced 5 W&B file(s), 1 media file(s), 1 artifact file(s) and 0 other file(s)
wandb: Find logs at: ./wandb/run-20230626_213243-rarw0h7y/logs
wandb: Currently logged in as: tha-santacruz (msc-nicola). Use `wandb login --relogin` to force relogin
wandb: Tracking run with wandb version 0.15.4
wandb: Run data is saved locally in /home/santacro/masters_thesis/all_runs/wandb/run-20230626_213424-8qqasqcd
wandb: Run `wandb offline` to turn off syncing.
wandb: Syncing run floral-blaze-15
wandb: ⭐️ View project at https://wandb.ai/msc-nicola/test_all_MLC
wandb: 🚀 View run at https://wandb.ai/msc-nicola/test_all_MLC/runs/8qqasqcd
Running job on GPU : Tesla V100-PCIE-32GB
Namespace(BATCH_SIZE=128, CHECKPOINTS_PATH='/scratch/izar/santacro/checkpoints/', DATASET_PATH='/scratch/izar/santacro/final_data/', DEVICE='cuda:0', EMBEDDING='agnostic', EPOCH_NUM=300, FRACTION=40, HIDDEN_SIZE=8192, JOB_ID=15, LEARNING_RATE=1e-05, LEVEL='L2', LOAD_CHECKPOINT='yes', MERGE_METHOD='fusion', MIN_LEARNING_RATE=1e-06, NUM_WORKERS=8, RANDOM_STATE=1, RUN_MODE='test', SAVE_CHECKPOINTS='yes', SPLITTING='spatial', TARGET_BASE='set', WANDB_ENTITY='msc-nicola', WANDB_LOGS='yes', WANDB_PROJECT='all_MLC')
Number of train samples : 9286
Number of val samples : 1452
Number of test samples : 4221
Loaded model state dict from file /scratch/izar/santacro/checkpoints//1_agnostic_embedding_L2_level_fusion_merging_spatial_splitting_8192.pth
wandb: Waiting for W&B process to finish... (success).
wandb: - 0.029 MB of 0.616 MB uploaded (0.000 MB deduped)wandb: \ 0.627 MB of 0.627 MB uploaded (0.000 MB deduped)wandb: | 0.627 MB of 0.627 MB uploaded (0.000 MB deduped)wandb: 
wandb: Run history:
wandb:     test loss ▁
wandb: test macro F1 ▁
wandb:  test macro H ▁
wandb: test micro F1 ▁
wandb: 
wandb: Run summary:
wandb:     test loss 1.1356
wandb: test macro F1 0.11875
wandb:  test macro H 5.04643
wandb: test micro F1 0.1844
wandb: 
wandb: 🚀 View run floral-blaze-15 at: https://wandb.ai/msc-nicola/test_all_MLC/runs/8qqasqcd
wandb: Synced 4 W&B file(s), 33 media file(s), 1 artifact file(s) and 0 other file(s)
wandb: Find logs at: ./wandb/run-20230626_213424-8qqasqcd/logs
