/usr/share/lmod/lmod/init/sh: line 20: /usr/share/lmod/lmod/libexec//clearMT_cmd: No such file or directory
wandb: Currently logged in as: tha-santacruz (msc-nicola). Use `wandb login --relogin` to force relogin
wandb: Tracking run with wandb version 0.15.4
wandb: Run data is saved locally in /home/santacro/masters_thesis/all_runs/wandb/run-20230627_030248-vd9h9mad
wandb: Run `wandb offline` to turn off syncing.
wandb: Syncing run lively-planet-132
wandb: ⭐️ View project at https://wandb.ai/msc-nicola/train_all_MLC
wandb: 🚀 View run at https://wandb.ai/msc-nicola/train_all_MLC/runs/vd9h9mad
Running job on GPU : Tesla V100-PCIE-32GB
Namespace(BATCH_SIZE=128, CHECKPOINTS_PATH='/scratch/izar/santacro/checkpoints/', DATASET_PATH='/scratch/izar/santacro/final_data/', DEVICE='cuda:0', EMBEDDING='agnostic', EPOCH_NUM=300, FRACTION=10, HIDDEN_SIZE=8192, JOB_ID=132, LEARNING_RATE=1e-05, LEVEL='L1', LOAD_CHECKPOINT='no', MERGE_METHOD='fusion', MIN_LEARNING_RATE=1e-06, NUM_WORKERS=8, RANDOM_STATE=3, RUN_MODE='train', SAVE_CHECKPOINTS='yes', SPLITTING='progressive', TARGET_BASE='set', WANDB_ENTITY='msc-nicola', WANDB_LOGS='yes', WANDB_PROJECT='all_MLC')
Number of train samples : 9920
Number of val samples : 1102
Number of test samples : 5350
  0%|          | 0/300 [00:00<?, ?it/s]train/val metrics at epoch 1 | loss : 1.18/1.18 | micro_F1 : 0.27/0.32:   0%|          | 0/300 [00:03<?, ?it/s]train/val metrics at epoch 1 | loss : 1.18/1.18 | micro_F1 : 0.27/0.32:   0%|          | 1/300 [00:04<21:11,  4.25s/it]train/val metrics at epoch 2 | loss : 1.10/1.10 | micro_F1 : 0.32/0.34:   0%|          | 1/300 [00:07<21:11,  4.25s/it]train/val metrics at epoch 2 | loss : 1.10/1.10 | micro_F1 : 0.32/0.34:   1%|          | 2/300 [00:07<17:54,  3.61s/it]train/val metrics at epoch 3 | loss : 1.04/1.07 | micro_F1 : 0.35/0.36:   1%|          | 2/300 [00:10<17:54,  3.61s/it]train/val metrics at epoch 3 | loss : 1.04/1.07 | micro_F1 : 0.35/0.36:   1%|          | 3/300 [00:10<16:45,  3.39s/it]train/val metrics at epoch 4 | loss : 0.98/1.04 | micro_F1 : 0.38/0.38:   1%|          | 3/300 [00:13<16:45,  3.39s/it]train/val metrics at epoch 4 | loss : 0.98/1.04 | micro_F1 : 0.38/0.38:   1%|▏         | 4/300 [00:13<16:11,  3.28s/it]train/val metrics at epoch 5 | loss : 0.93/1.03 | micro_F1 : 0.40/0.38:   1%|▏         | 4/300 [00:16<16:11,  3.28s/it]train/val metrics at epoch 5 | loss : 0.93/1.03 | micro_F1 : 0.40/0.38:   2%|▏         | 5/300 [00:16<15:51,  3.23s/it]train/val metrics at epoch 6 | loss : 0.88/1.03 | micro_F1 : 0.42/0.39:   2%|▏         | 5/300 [00:19<15:51,  3.23s/it]train/val metrics at epoch 6 | loss : 0.88/1.03 | micro_F1 : 0.42/0.39:   2%|▏         | 6/300 [00:19<15:44,  3.21s/it]train/val metrics at epoch 7 | loss : 0.83/1.02 | micro_F1 : 0.44/0.39:   2%|▏         | 6/300 [00:22<15:44,  3.21s/it]train/val metrics at epoch 7 | loss : 0.83/1.02 | micro_F1 : 0.44/0.39:   2%|▏         | 7/300 [00:23<15:34,  3.19s/it]train/val metrics at epoch 8 | loss : 0.78/1.03 | micro_F1 : 0.46/0.40:   2%|▏         | 7/300 [00:25<15:34,  3.19s/it]train/val metrics at epoch 8 | loss : 0.78/1.03 | micro_F1 : 0.46/0.40:   3%|▎         | 8/300 [00:26<15:26,  3.17s/it]train/val metrics at epoch 9 | loss : 0.74/1.04 | micro_F1 : 0.48/0.41:   3%|▎         | 8/300 [00:29<15:26,  3.17s/it]train/val metrics at epoch 9 | loss : 0.74/1.04 | micro_F1 : 0.48/0.41:   3%|▎         | 9/300 [00:29<15:19,  3.16s/it]train/val metrics at epoch 10 | loss : 0.71/1.04 | micro_F1 : 0.49/0.41:   3%|▎         | 9/300 [00:32<15:19,  3.16s/it]train/val metrics at epoch 10 | loss : 0.71/1.04 | micro_F1 : 0.49/0.41:   3%|▎         | 10/300 [00:32<15:13,  3.15s/it]train/val metrics at epoch 11 | loss : 0.69/1.06 | micro_F1 : 0.50/0.42:   3%|▎         | 10/300 [00:35<15:13,  3.15s/it]train/val metrics at epoch 11 | loss : 0.69/1.06 | micro_F1 : 0.50/0.42:   4%|▎         | 11/300 [00:35<15:06,  3.14s/it]train/val metrics at epoch 12 | loss : 0.67/1.05 | micro_F1 : 0.51/0.41:   4%|▎         | 11/300 [00:38<15:06,  3.14s/it]train/val metrics at epoch 12 | loss : 0.67/1.05 | micro_F1 : 0.51/0.41:   4%|▍         | 12/300 [00:38<15:03,  3.14s/it]train/val metrics at epoch 13 | loss : 0.65/1.07 | micro_F1 : 0.52/0.41:   4%|▍         | 12/300 [00:41<15:03,  3.14s/it]train/val metrics at epoch 13 | loss : 0.65/1.07 | micro_F1 : 0.52/0.41:   4%|▍         | 13/300 [00:41<14:57,  3.13s/it]train/val metrics at epoch 14 | loss : 0.63/1.08 | micro_F1 : 0.52/0.42:   4%|▍         | 13/300 [00:44<14:57,  3.13s/it]train/val metrics at epoch 14 | loss : 0.63/1.08 | micro_F1 : 0.52/0.42:   5%|▍         | 14/300 [00:45<14:56,  3.14s/it]train/val metrics at epoch 15 | loss : 0.62/1.08 | micro_F1 : 0.53/0.42:   5%|▍         | 14/300 [00:47<14:56,  3.14s/it]train/val metrics at epoch 15 | loss : 0.62/1.08 | micro_F1 : 0.53/0.42:   5%|▌         | 15/300 [00:48<14:51,  3.13s/it]train/val metrics at epoch 16 | loss : 0.61/1.08 | micro_F1 : 0.54/0.42:   5%|▌         | 15/300 [00:50<14:51,  3.13s/it]train/val metrics at epoch 16 | loss : 0.61/1.08 | micro_F1 : 0.54/0.42:   5%|▌         | 16/300 [00:51<14:50,  3.14s/it]train/val metrics at epoch 17 | loss : 0.60/1.10 | micro_F1 : 0.54/0.42:   5%|▌         | 16/300 [00:54<14:50,  3.14s/it]train/val metrics at epoch 17 | loss : 0.60/1.10 | micro_F1 : 0.54/0.42:   5%|▌         | 16/300 [00:54<16:15,  3.43s/it]
wandb: Waiting for W&B process to finish... (success).
wandb: 
wandb: Run history:
wandb:          epoch ▁
wandb:  learning rate ▁
wandb:           time ▁
wandb:     train loss ▁
wandb: train macro F1 ▁
wandb: train micro F1 ▁
wandb:       val loss ▁
wandb:   val macro F1 ▁
wandb:   val micro F1 ▁
wandb: 
wandb: Run summary:
wandb:          epoch 17
wandb:  learning rate 0.0
wandb:           time 56.41506
wandb:     train loss 0.60375
wandb: train macro F1 0.46211
wandb: train micro F1 0.53858
wandb:       val loss 1.10186
wandb:   val macro F1 0.31553
wandb:   val micro F1 0.42186
wandb: 
wandb: 🚀 View run lively-planet-132 at: https://wandb.ai/msc-nicola/train_all_MLC/runs/vd9h9mad
wandb: Synced 5 W&B file(s), 1 media file(s), 1 artifact file(s) and 0 other file(s)
wandb: Find logs at: ./wandb/run-20230627_030248-vd9h9mad/logs
wandb: Currently logged in as: tha-santacruz (msc-nicola). Use `wandb login --relogin` to force relogin
wandb: Tracking run with wandb version 0.15.4
wandb: Run data is saved locally in /home/santacro/masters_thesis/all_runs/wandb/run-20230627_030405-rgsmf7o8
wandb: Run `wandb offline` to turn off syncing.
wandb: Syncing run fancy-cosmos-130
wandb: ⭐️ View project at https://wandb.ai/msc-nicola/test_all_MLC
wandb: 🚀 View run at https://wandb.ai/msc-nicola/test_all_MLC/runs/rgsmf7o8
Running job on GPU : Tesla V100-PCIE-32GB
Namespace(BATCH_SIZE=128, CHECKPOINTS_PATH='/scratch/izar/santacro/checkpoints/', DATASET_PATH='/scratch/izar/santacro/final_data/', DEVICE='cuda:0', EMBEDDING='agnostic', EPOCH_NUM=300, FRACTION=10, HIDDEN_SIZE=8192, JOB_ID=132, LEARNING_RATE=1e-05, LEVEL='L1', LOAD_CHECKPOINT='yes', MERGE_METHOD='fusion', MIN_LEARNING_RATE=1e-06, NUM_WORKERS=8, RANDOM_STATE=3, RUN_MODE='test', SAVE_CHECKPOINTS='yes', SPLITTING='progressive', TARGET_BASE='set', WANDB_ENTITY='msc-nicola', WANDB_LOGS='yes', WANDB_PROJECT='all_MLC')
Number of train samples : 9920
Number of val samples : 1102
Number of test samples : 5350
Loaded model state dict from file /scratch/izar/santacro/checkpoints//3_agnostic_embedding_L1_level_fusion_merging_progressive_10%_8192.pth
wandb: Waiting for W&B process to finish... (success).
wandb: - 0.007 MB of 0.189 MB uploaded (0.000 MB deduped)wandb: \ 0.189 MB of 0.194 MB uploaded (0.000 MB deduped)wandb: | 0.194 MB of 0.194 MB uploaded (0.000 MB deduped)wandb: 
wandb: Run history:
wandb:     test loss ▁
wandb: test macro F1 ▁
wandb:  test macro H ▁
wandb: test micro F1 ▁
wandb: 
wandb: Run summary:
wandb:     test loss 1.25867
wandb: test macro F1 0.28433
wandb:  test macro H 1.81271
wandb: test micro F1 0.39197
wandb: 
wandb: 🚀 View run fancy-cosmos-130 at: https://wandb.ai/msc-nicola/test_all_MLC/runs/rgsmf7o8
wandb: Synced 4 W&B file(s), 10 media file(s), 1 artifact file(s) and 0 other file(s)
wandb: Find logs at: ./wandb/run-20230627_030405-rgsmf7o8/logs
