/usr/share/lmod/lmod/init/sh: line 20: /usr/share/lmod/lmod/libexec//clearMT_cmd: No such file or directory
wandb: Currently logged in as: tha-santacruz (msc-nicola). Use `wandb login --relogin` to force relogin
wandb: Tracking run with wandb version 0.15.4
wandb: Run data is saved locally in /home/santacro/masters_thesis/all_runs/wandb/run-20230627_033257-i2amnz3j
wandb: Run `wandb offline` to turn off syncing.
wandb: Syncing run honest-jazz-243
wandb: ⭐️ View project at https://wandb.ai/msc-nicola/train_all_MLC
wandb: 🚀 View run at https://wandb.ai/msc-nicola/train_all_MLC/runs/i2amnz3j
Running job on GPU : Tesla V100-PCIE-32GB
Namespace(BATCH_SIZE=128, CHECKPOINTS_PATH='/scratch/izar/santacro/checkpoints/', DATASET_PATH='/scratch/izar/santacro/final_data/', DEVICE='cuda:0', EMBEDDING='doc2vec', EPOCH_NUM=300, FRACTION=30, HIDDEN_SIZE=8192, JOB_ID=242, LEARNING_RATE=1e-05, LEVEL='L1', LOAD_CHECKPOINT='no', MERGE_METHOD='fusion', MIN_LEARNING_RATE=1e-06, NUM_WORKERS=8, RANDOM_STATE=5, RUN_MODE='train', SAVE_CHECKPOINTS='yes', SPLITTING='progressive', TARGET_BASE='set', WANDB_ENTITY='msc-nicola', WANDB_LOGS='yes', WANDB_PROJECT='all_MLC')
Number of train samples : 9802
Number of val samples : 1089
Number of test samples : 5400
  0%|          | 0/300 [00:00<?, ?it/s]train/val metrics at epoch 1 | loss : 1.16/1.18 | micro_F1 : 0.22/0.26:   0%|          | 0/300 [00:02<?, ?it/s]train/val metrics at epoch 1 | loss : 1.16/1.18 | micro_F1 : 0.22/0.26:   0%|          | 1/300 [00:02<14:44,  2.96s/it]train/val metrics at epoch 2 | loss : 1.09/1.12 | micro_F1 : 0.29/0.30:   0%|          | 1/300 [00:04<14:44,  2.96s/it]train/val metrics at epoch 2 | loss : 1.09/1.12 | micro_F1 : 0.29/0.30:   1%|          | 2/300 [00:05<12:02,  2.43s/it]train/val metrics at epoch 3 | loss : 1.05/1.11 | micro_F1 : 0.34/0.35:   1%|          | 2/300 [00:06<12:02,  2.43s/it]train/val metrics at epoch 3 | loss : 1.05/1.11 | micro_F1 : 0.34/0.35:   1%|          | 3/300 [00:06<10:56,  2.21s/it]train/val metrics at epoch 4 | loss : 1.01/1.09 | micro_F1 : 0.37/0.36:   1%|          | 3/300 [00:08<10:56,  2.21s/it]train/val metrics at epoch 4 | loss : 1.01/1.09 | micro_F1 : 0.37/0.36:   1%|▏         | 4/300 [00:08<10:21,  2.10s/it]train/val metrics at epoch 5 | loss : 0.97/1.07 | micro_F1 : 0.39/0.37:   1%|▏         | 4/300 [00:10<10:21,  2.10s/it]train/val metrics at epoch 5 | loss : 0.97/1.07 | micro_F1 : 0.39/0.37:   2%|▏         | 5/300 [00:10<10:02,  2.04s/it]train/val metrics at epoch 6 | loss : 0.94/1.07 | micro_F1 : 0.40/0.38:   2%|▏         | 5/300 [00:12<10:02,  2.04s/it]train/val metrics at epoch 6 | loss : 0.94/1.07 | micro_F1 : 0.40/0.38:   2%|▏         | 6/300 [00:12<09:55,  2.02s/it]train/val metrics at epoch 7 | loss : 0.90/1.06 | micro_F1 : 0.41/0.39:   2%|▏         | 6/300 [00:14<09:55,  2.02s/it]train/val metrics at epoch 7 | loss : 0.90/1.06 | micro_F1 : 0.41/0.39:   2%|▏         | 7/300 [00:14<10:03,  2.06s/it]train/val metrics at epoch 8 | loss : 0.87/1.07 | micro_F1 : 0.42/0.39:   2%|▏         | 7/300 [00:16<10:03,  2.06s/it]train/val metrics at epoch 8 | loss : 0.87/1.07 | micro_F1 : 0.42/0.39:   3%|▎         | 8/300 [00:17<10:03,  2.07s/it]train/val metrics at epoch 9 | loss : 0.84/1.07 | micro_F1 : 0.43/0.39:   3%|▎         | 8/300 [00:18<10:03,  2.07s/it]train/val metrics at epoch 9 | loss : 0.84/1.07 | micro_F1 : 0.43/0.39:   3%|▎         | 9/300 [00:18<09:50,  2.03s/it]train/val metrics at epoch 10 | loss : 0.81/1.09 | micro_F1 : 0.44/0.40:   3%|▎         | 9/300 [00:20<09:50,  2.03s/it]train/val metrics at epoch 10 | loss : 0.81/1.09 | micro_F1 : 0.44/0.40:   3%|▎         | 10/300 [00:21<09:59,  2.07s/it]train/val metrics at epoch 11 | loss : 0.80/1.07 | micro_F1 : 0.45/0.40:   3%|▎         | 10/300 [00:22<09:59,  2.07s/it]train/val metrics at epoch 11 | loss : 0.80/1.07 | micro_F1 : 0.45/0.40:   4%|▎         | 11/300 [00:23<09:54,  2.06s/it]train/val metrics at epoch 12 | loss : 0.78/1.09 | micro_F1 : 0.46/0.40:   4%|▎         | 11/300 [00:25<09:54,  2.06s/it]train/val metrics at epoch 12 | loss : 0.78/1.09 | micro_F1 : 0.46/0.40:   4%|▍         | 12/300 [00:25<10:02,  2.09s/it]train/val metrics at epoch 13 | loss : 0.77/1.10 | micro_F1 : 0.46/0.41:   4%|▍         | 12/300 [00:27<10:02,  2.09s/it]train/val metrics at epoch 13 | loss : 0.77/1.10 | micro_F1 : 0.46/0.41:   4%|▍         | 13/300 [00:27<10:06,  2.11s/it]train/val metrics at epoch 14 | loss : 0.75/1.09 | micro_F1 : 0.47/0.41:   4%|▍         | 13/300 [00:29<10:06,  2.11s/it]train/val metrics at epoch 14 | loss : 0.75/1.09 | micro_F1 : 0.47/0.41:   5%|▍         | 14/300 [00:29<10:10,  2.13s/it]train/val metrics at epoch 15 | loss : 0.75/1.11 | micro_F1 : 0.47/0.41:   5%|▍         | 14/300 [00:31<10:10,  2.13s/it]train/val metrics at epoch 15 | loss : 0.75/1.11 | micro_F1 : 0.47/0.41:   5%|▌         | 15/300 [00:31<10:07,  2.13s/it]train/val metrics at epoch 16 | loss : 0.74/1.10 | micro_F1 : 0.48/0.41:   5%|▌         | 15/300 [00:33<10:07,  2.13s/it]train/val metrics at epoch 16 | loss : 0.74/1.10 | micro_F1 : 0.48/0.41:   5%|▌         | 16/300 [00:33<10:05,  2.13s/it]train/val metrics at epoch 17 | loss : 0.74/1.12 | micro_F1 : 0.48/0.40:   5%|▌         | 16/300 [00:35<10:05,  2.13s/it]train/val metrics at epoch 17 | loss : 0.74/1.12 | micro_F1 : 0.48/0.40:   5%|▌         | 16/300 [00:36<10:46,  2.28s/it]
wandb: Waiting for W&B process to finish... (success).
wandb: 
wandb: Run history:
wandb:          epoch ▁
wandb:  learning rate ▁
wandb:           time ▁
wandb:     train loss ▁
wandb: train macro F1 ▁
wandb: train micro F1 ▁
wandb:       val loss ▁
wandb:   val macro F1 ▁
wandb:   val micro F1 ▁
wandb: 
wandb: Run summary:
wandb:          epoch 17
wandb:  learning rate 0.0
wandb:           time 38.29942
wandb:     train loss 0.73716
wandb: train macro F1 0.40902
wandb: train micro F1 0.47867
wandb:       val loss 1.11772
wandb:   val macro F1 0.30781
wandb:   val micro F1 0.4019
wandb: 
wandb: 🚀 View run honest-jazz-243 at: https://wandb.ai/msc-nicola/train_all_MLC/runs/i2amnz3j
wandb: Synced 5 W&B file(s), 1 media file(s), 1 artifact file(s) and 0 other file(s)
wandb: Find logs at: ./wandb/run-20230627_033257-i2amnz3j/logs
wandb: Currently logged in as: tha-santacruz (msc-nicola). Use `wandb login --relogin` to force relogin
wandb: Tracking run with wandb version 0.15.4
wandb: Run data is saved locally in /home/santacro/masters_thesis/all_runs/wandb/run-20230627_033403-2go1t5gx
wandb: Run `wandb offline` to turn off syncing.
wandb: Syncing run breezy-darkness-240
wandb: ⭐️ View project at https://wandb.ai/msc-nicola/test_all_MLC
wandb: 🚀 View run at https://wandb.ai/msc-nicola/test_all_MLC/runs/2go1t5gx
Running job on GPU : Tesla V100-PCIE-32GB
Namespace(BATCH_SIZE=128, CHECKPOINTS_PATH='/scratch/izar/santacro/checkpoints/', DATASET_PATH='/scratch/izar/santacro/final_data/', DEVICE='cuda:0', EMBEDDING='doc2vec', EPOCH_NUM=300, FRACTION=30, HIDDEN_SIZE=8192, JOB_ID=242, LEARNING_RATE=1e-05, LEVEL='L1', LOAD_CHECKPOINT='yes', MERGE_METHOD='fusion', MIN_LEARNING_RATE=1e-06, NUM_WORKERS=8, RANDOM_STATE=5, RUN_MODE='test', SAVE_CHECKPOINTS='yes', SPLITTING='progressive', TARGET_BASE='set', WANDB_ENTITY='msc-nicola', WANDB_LOGS='yes', WANDB_PROJECT='all_MLC')
Number of train samples : 9802
Number of val samples : 1089
Number of test samples : 5400
Loaded model state dict from file /scratch/izar/santacro/checkpoints//5_doc2vec_embedding_L1_level_fusion_merging_progressive_30%_8192.pth
wandb: Waiting for W&B process to finish... (success).
wandb: - 0.135 MB of 0.191 MB uploaded (0.000 MB deduped)wandb: \ 0.007 MB of 0.191 MB uploaded (0.000 MB deduped)wandb: | 0.196 MB of 0.196 MB uploaded (0.000 MB deduped)wandb: 
wandb: Run history:
wandb:     test loss ▁
wandb: test macro F1 ▁
wandb:  test macro H ▁
wandb: test micro F1 ▁
wandb: 
wandb: Run summary:
wandb:     test loss 1.12221
wandb: test macro F1 0.32587
wandb:  test macro H 1.96611
wandb: test micro F1 0.39993
wandb: 
wandb: 🚀 View run breezy-darkness-240 at: https://wandb.ai/msc-nicola/test_all_MLC/runs/2go1t5gx
wandb: Synced 4 W&B file(s), 10 media file(s), 1 artifact file(s) and 0 other file(s)
wandb: Find logs at: ./wandb/run-20230627_033403-2go1t5gx/logs
