/usr/share/lmod/lmod/init/sh: line 20: /usr/share/lmod/lmod/libexec//clearMT_cmd: No such file or directory
wandb: Currently logged in as: tha-santacruz (msc-nicola). Use `wandb login --relogin` to force relogin
wandb: Tracking run with wandb version 0.15.4
wandb: Run data is saved locally in /home/santacro/masters_thesis/all_runs/wandb/run-20230627_025748-ve0wv3b9
wandb: Run `wandb offline` to turn off syncing.
wandb: Syncing run stoic-energy-119
wandb: ⭐️ View project at https://wandb.ai/msc-nicola/train_all_MLC
wandb: 🚀 View run at https://wandb.ai/msc-nicola/train_all_MLC/runs/ve0wv3b9
Running job on GPU : Tesla V100-PCIE-32GB
Namespace(BATCH_SIZE=128, CHECKPOINTS_PATH='/scratch/izar/santacro/checkpoints/', DATASET_PATH='/scratch/izar/santacro/final_data/', DEVICE='cuda:0', EMBEDDING='longformer', EPOCH_NUM=300, FRACTION=40, HIDDEN_SIZE=8192, JOB_ID=119, LEARNING_RATE=1e-05, LEVEL='L2', LOAD_CHECKPOINT='no', MERGE_METHOD='fusion', MIN_LEARNING_RATE=1e-06, NUM_WORKERS=8, RANDOM_STATE=3, RUN_MODE='train', SAVE_CHECKPOINTS='yes', SPLITTING='spatial', TARGET_BASE='set', WANDB_ENTITY='msc-nicola', WANDB_LOGS='yes', WANDB_PROJECT='all_MLC')
Number of train samples : 9300
Number of val samples : 1446
Number of test samples : 4214
  0%|          | 0/300 [00:00<?, ?it/s]train/val metrics at epoch 1 | loss : 1.30/1.07 | micro_F1 : 0.10/0.09:   0%|          | 0/300 [00:02<?, ?it/s]train/val metrics at epoch 1 | loss : 1.30/1.07 | micro_F1 : 0.10/0.09:   0%|          | 1/300 [00:02<14:45,  2.96s/it]train/val metrics at epoch 2 | loss : 1.23/1.10 | micro_F1 : 0.11/0.08:   0%|          | 1/300 [00:05<14:45,  2.96s/it]train/val metrics at epoch 2 | loss : 1.23/1.10 | micro_F1 : 0.11/0.08:   1%|          | 2/300 [00:05<12:52,  2.59s/it]train/val metrics at epoch 3 | loss : 1.19/1.06 | micro_F1 : 0.12/0.09:   1%|          | 2/300 [00:07<12:52,  2.59s/it]train/val metrics at epoch 3 | loss : 1.19/1.06 | micro_F1 : 0.12/0.09:   1%|          | 3/300 [00:07<12:15,  2.48s/it]train/val metrics at epoch 4 | loss : 1.16/1.04 | micro_F1 : 0.12/0.08:   1%|          | 3/300 [00:09<12:15,  2.48s/it]train/val metrics at epoch 4 | loss : 1.16/1.04 | micro_F1 : 0.12/0.08:   1%|▏         | 4/300 [00:09<11:55,  2.42s/it]train/val metrics at epoch 5 | loss : 1.14/1.03 | micro_F1 : 0.13/0.08:   1%|▏         | 4/300 [00:12<11:55,  2.42s/it]train/val metrics at epoch 5 | loss : 1.14/1.03 | micro_F1 : 0.13/0.08:   2%|▏         | 5/300 [00:12<11:50,  2.41s/it]train/val metrics at epoch 6 | loss : 1.12/1.02 | micro_F1 : 0.13/0.09:   2%|▏         | 5/300 [00:14<11:50,  2.41s/it]train/val metrics at epoch 6 | loss : 1.12/1.02 | micro_F1 : 0.13/0.09:   2%|▏         | 6/300 [00:14<11:37,  2.37s/it]train/val metrics at epoch 7 | loss : 1.10/1.03 | micro_F1 : 0.14/0.09:   2%|▏         | 6/300 [00:16<11:37,  2.37s/it]train/val metrics at epoch 7 | loss : 1.10/1.03 | micro_F1 : 0.14/0.09:   2%|▏         | 7/300 [00:17<11:33,  2.37s/it]train/val metrics at epoch 8 | loss : 1.08/1.01 | micro_F1 : 0.15/0.10:   2%|▏         | 7/300 [00:19<11:33,  2.37s/it]train/val metrics at epoch 8 | loss : 1.08/1.01 | micro_F1 : 0.15/0.10:   3%|▎         | 8/300 [00:19<11:32,  2.37s/it]train/val metrics at epoch 9 | loss : 1.06/1.00 | micro_F1 : 0.15/0.10:   3%|▎         | 8/300 [00:21<11:32,  2.37s/it]train/val metrics at epoch 9 | loss : 1.06/1.00 | micro_F1 : 0.15/0.10:   3%|▎         | 9/300 [00:21<11:32,  2.38s/it]train/val metrics at epoch 10 | loss : 1.03/0.98 | micro_F1 : 0.16/0.11:   3%|▎         | 9/300 [00:23<11:32,  2.38s/it]train/val metrics at epoch 10 | loss : 1.03/0.98 | micro_F1 : 0.16/0.11:   3%|▎         | 10/300 [00:24<11:26,  2.37s/it]train/val metrics at epoch 11 | loss : 1.02/0.97 | micro_F1 : 0.16/0.12:   3%|▎         | 10/300 [00:26<11:26,  2.37s/it]train/val metrics at epoch 11 | loss : 1.02/0.97 | micro_F1 : 0.16/0.12:   4%|▎         | 11/300 [00:26<11:21,  2.36s/it]train/val metrics at epoch 12 | loss : 1.00/0.97 | micro_F1 : 0.17/0.12:   4%|▎         | 11/300 [00:28<11:21,  2.36s/it]train/val metrics at epoch 12 | loss : 1.00/0.97 | micro_F1 : 0.17/0.12:   4%|▍         | 12/300 [00:28<11:19,  2.36s/it]train/val metrics at epoch 13 | loss : 0.98/0.96 | micro_F1 : 0.18/0.14:   4%|▍         | 12/300 [00:30<11:19,  2.36s/it]train/val metrics at epoch 13 | loss : 0.98/0.96 | micro_F1 : 0.18/0.14:   4%|▍         | 13/300 [00:31<11:15,  2.35s/it]train/val metrics at epoch 14 | loss : 0.97/0.96 | micro_F1 : 0.18/0.14:   4%|▍         | 13/300 [00:33<11:15,  2.35s/it]train/val metrics at epoch 14 | loss : 0.97/0.96 | micro_F1 : 0.18/0.14:   5%|▍         | 14/300 [00:33<11:14,  2.36s/it]train/val metrics at epoch 15 | loss : 0.95/0.96 | micro_F1 : 0.19/0.15:   5%|▍         | 14/300 [00:35<11:14,  2.36s/it]train/val metrics at epoch 15 | loss : 0.95/0.96 | micro_F1 : 0.19/0.15:   5%|▌         | 15/300 [00:35<11:14,  2.37s/it]train/val metrics at epoch 16 | loss : 0.94/0.94 | micro_F1 : 0.19/0.13:   5%|▌         | 15/300 [00:38<11:14,  2.37s/it]train/val metrics at epoch 16 | loss : 0.94/0.94 | micro_F1 : 0.19/0.13:   5%|▌         | 16/300 [00:38<11:09,  2.36s/it]train/val metrics at epoch 17 | loss : 0.93/0.95 | micro_F1 : 0.19/0.15:   5%|▌         | 16/300 [00:40<11:09,  2.36s/it]train/val metrics at epoch 17 | loss : 0.93/0.95 | micro_F1 : 0.19/0.15:   6%|▌         | 17/300 [00:40<11:10,  2.37s/it]train/val metrics at epoch 18 | loss : 0.91/0.95 | micro_F1 : 0.20/0.15:   6%|▌         | 17/300 [00:42<11:10,  2.37s/it]train/val metrics at epoch 18 | loss : 0.91/0.95 | micro_F1 : 0.20/0.15:   6%|▌         | 18/300 [00:43<11:06,  2.36s/it]train/val metrics at epoch 19 | loss : 0.91/0.94 | micro_F1 : 0.20/0.16:   6%|▌         | 18/300 [00:45<11:06,  2.36s/it]train/val metrics at epoch 19 | loss : 0.91/0.94 | micro_F1 : 0.20/0.16:   6%|▋         | 19/300 [00:45<10:58,  2.34s/it]train/val metrics at epoch 20 | loss : 0.89/0.93 | micro_F1 : 0.20/0.15:   6%|▋         | 19/300 [00:47<10:58,  2.34s/it]train/val metrics at epoch 20 | loss : 0.89/0.93 | micro_F1 : 0.20/0.15:   7%|▋         | 20/300 [00:47<10:56,  2.35s/it]train/val metrics at epoch 21 | loss : 0.88/0.94 | micro_F1 : 0.20/0.15:   7%|▋         | 20/300 [00:49<10:56,  2.35s/it]train/val metrics at epoch 21 | loss : 0.88/0.94 | micro_F1 : 0.20/0.15:   7%|▋         | 21/300 [00:49<10:45,  2.32s/it]train/val metrics at epoch 22 | loss : 0.87/0.96 | micro_F1 : 0.21/0.19:   7%|▋         | 21/300 [00:52<10:45,  2.32s/it]train/val metrics at epoch 22 | loss : 0.87/0.96 | micro_F1 : 0.21/0.19:   7%|▋         | 22/300 [00:52<10:45,  2.32s/it]train/val metrics at epoch 23 | loss : 0.86/0.93 | micro_F1 : 0.21/0.15:   7%|▋         | 22/300 [00:54<10:45,  2.32s/it]train/val metrics at epoch 23 | loss : 0.86/0.93 | micro_F1 : 0.21/0.15:   8%|▊         | 23/300 [00:54<10:43,  2.32s/it]train/val metrics at epoch 24 | loss : 0.85/0.96 | micro_F1 : 0.21/0.17:   8%|▊         | 23/300 [00:56<10:43,  2.32s/it]train/val metrics at epoch 24 | loss : 0.85/0.96 | micro_F1 : 0.21/0.17:   8%|▊         | 24/300 [00:56<10:38,  2.31s/it]train/val metrics at epoch 25 | loss : 0.84/0.92 | micro_F1 : 0.22/0.16:   8%|▊         | 24/300 [00:58<10:38,  2.31s/it]train/val metrics at epoch 25 | loss : 0.84/0.92 | micro_F1 : 0.22/0.16:   8%|▊         | 25/300 [00:59<10:36,  2.31s/it]train/val metrics at epoch 26 | loss : 0.84/0.91 | micro_F1 : 0.22/0.16:   8%|▊         | 25/300 [01:01<10:36,  2.31s/it]train/val metrics at epoch 26 | loss : 0.84/0.91 | micro_F1 : 0.22/0.16:   9%|▊         | 26/300 [01:01<10:32,  2.31s/it]train/val metrics at epoch 27 | loss : 0.83/0.93 | micro_F1 : 0.22/0.17:   9%|▊         | 26/300 [01:03<10:32,  2.31s/it]train/val metrics at epoch 27 | loss : 0.83/0.93 | micro_F1 : 0.22/0.17:   9%|▉         | 27/300 [01:03<10:34,  2.32s/it]train/val metrics at epoch 28 | loss : 0.82/0.93 | micro_F1 : 0.22/0.14:   9%|▉         | 27/300 [01:05<10:34,  2.32s/it]train/val metrics at epoch 28 | loss : 0.82/0.93 | micro_F1 : 0.22/0.14:   9%|▉         | 28/300 [01:06<10:33,  2.33s/it]train/val metrics at epoch 29 | loss : 0.82/0.92 | micro_F1 : 0.22/0.17:   9%|▉         | 28/300 [01:08<10:33,  2.33s/it]train/val metrics at epoch 29 | loss : 0.82/0.92 | micro_F1 : 0.22/0.17:  10%|▉         | 29/300 [01:08<10:29,  2.32s/it]train/val metrics at epoch 30 | loss : 0.81/0.93 | micro_F1 : 0.22/0.16:  10%|▉         | 29/300 [01:10<10:29,  2.32s/it]train/val metrics at epoch 30 | loss : 0.81/0.93 | micro_F1 : 0.22/0.16:  10%|█         | 30/300 [01:10<10:26,  2.32s/it]train/val metrics at epoch 31 | loss : 0.81/0.93 | micro_F1 : 0.22/0.16:  10%|█         | 30/300 [01:12<10:26,  2.32s/it]train/val metrics at epoch 31 | loss : 0.81/0.93 | micro_F1 : 0.22/0.16:  10%|█         | 31/300 [01:13<10:23,  2.32s/it]train/val metrics at epoch 32 | loss : 0.81/0.93 | micro_F1 : 0.23/0.18:  10%|█         | 31/300 [01:15<10:23,  2.32s/it]train/val metrics at epoch 32 | loss : 0.81/0.93 | micro_F1 : 0.23/0.18:  11%|█         | 32/300 [01:15<10:18,  2.31s/it]train/val metrics at epoch 33 | loss : 0.81/0.92 | micro_F1 : 0.22/0.16:  11%|█         | 32/300 [01:17<10:18,  2.31s/it]train/val metrics at epoch 33 | loss : 0.81/0.92 | micro_F1 : 0.22/0.16:  11%|█         | 33/300 [01:17<10:22,  2.33s/it]train/val metrics at epoch 34 | loss : 0.81/0.91 | micro_F1 : 0.23/0.17:  11%|█         | 33/300 [01:19<10:22,  2.33s/it]train/val metrics at epoch 34 | loss : 0.81/0.91 | micro_F1 : 0.23/0.17:  11%|█▏        | 34/300 [01:20<10:13,  2.31s/it]train/val metrics at epoch 35 | loss : 0.80/0.92 | micro_F1 : 0.23/0.17:  11%|█▏        | 34/300 [01:22<10:13,  2.31s/it]train/val metrics at epoch 35 | loss : 0.80/0.92 | micro_F1 : 0.23/0.17:  12%|█▏        | 35/300 [01:22<10:09,  2.30s/it]train/val metrics at epoch 36 | loss : 0.80/0.93 | micro_F1 : 0.23/0.18:  12%|█▏        | 35/300 [01:24<10:09,  2.30s/it]train/val metrics at epoch 36 | loss : 0.80/0.93 | micro_F1 : 0.23/0.18:  12%|█▏        | 35/300 [01:25<10:44,  2.43s/it]
wandb: Waiting for W&B process to finish... (success).
wandb: - 0.010 MB of 0.012 MB uploaded (0.000 MB deduped)wandb: \ 0.010 MB of 0.012 MB uploaded (0.000 MB deduped)wandb: | 0.010 MB of 0.012 MB uploaded (0.000 MB deduped)wandb: / 0.010 MB of 0.012 MB uploaded (0.000 MB deduped)wandb: - 0.010 MB of 0.012 MB uploaded (0.000 MB deduped)wandb: \ 0.010 MB of 0.012 MB uploaded (0.000 MB deduped)wandb: 
wandb: Run history:
wandb:          epoch ▁
wandb:  learning rate ▁
wandb:           time ▁
wandb:     train loss ▁
wandb: train macro F1 ▁
wandb: train micro F1 ▁
wandb:       val loss ▁
wandb:   val macro F1 ▁
wandb:   val micro F1 ▁
wandb: 
wandb: Run summary:
wandb:          epoch 36
wandb:  learning rate 0.0
wandb:           time 87.5216
wandb:     train loss 0.80245
wandb: train macro F1 0.18253
wandb: train micro F1 0.22736
wandb:       val loss 0.92932
wandb:   val macro F1 0.10183
wandb:   val micro F1 0.17729
wandb: 
wandb: 🚀 View run stoic-energy-119 at: https://wandb.ai/msc-nicola/train_all_MLC/runs/ve0wv3b9
wandb: Synced 5 W&B file(s), 1 media file(s), 1 artifact file(s) and 0 other file(s)
wandb: Find logs at: ./wandb/run-20230627_025748-ve0wv3b9/logs
wandb: Currently logged in as: tha-santacruz (msc-nicola). Use `wandb login --relogin` to force relogin
wandb: Tracking run with wandb version 0.15.4
wandb: Run data is saved locally in /home/santacro/masters_thesis/all_runs/wandb/run-20230627_025941-eyk0iqdw
wandb: Run `wandb offline` to turn off syncing.
wandb: Syncing run sage-totem-119
wandb: ⭐️ View project at https://wandb.ai/msc-nicola/test_all_MLC
wandb: 🚀 View run at https://wandb.ai/msc-nicola/test_all_MLC/runs/eyk0iqdw
Running job on GPU : Tesla V100-PCIE-32GB
Namespace(BATCH_SIZE=128, CHECKPOINTS_PATH='/scratch/izar/santacro/checkpoints/', DATASET_PATH='/scratch/izar/santacro/final_data/', DEVICE='cuda:0', EMBEDDING='longformer', EPOCH_NUM=300, FRACTION=40, HIDDEN_SIZE=8192, JOB_ID=119, LEARNING_RATE=1e-05, LEVEL='L2', LOAD_CHECKPOINT='yes', MERGE_METHOD='fusion', MIN_LEARNING_RATE=1e-06, NUM_WORKERS=8, RANDOM_STATE=3, RUN_MODE='test', SAVE_CHECKPOINTS='yes', SPLITTING='spatial', TARGET_BASE='set', WANDB_ENTITY='msc-nicola', WANDB_LOGS='yes', WANDB_PROJECT='all_MLC')
Number of train samples : 9300
Number of val samples : 1446
Number of test samples : 4214
Loaded model state dict from file /scratch/izar/santacro/checkpoints//3_longformer_embedding_L2_level_fusion_merging_spatial_splitting_8192.pth
wandb: Waiting for W&B process to finish... (success).
wandb: 
wandb: Run history:
wandb:     test loss ▁
wandb: test macro F1 ▁
wandb:  test macro H ▁
wandb: test micro F1 ▁
wandb: 
wandb: Run summary:
wandb:     test loss 1.0646
wandb: test macro F1 0.11258
wandb:  test macro H 5.12482
wandb: test micro F1 0.17573
wandb: 
wandb: 🚀 View run sage-totem-119 at: https://wandb.ai/msc-nicola/test_all_MLC/runs/eyk0iqdw
wandb: Synced 4 W&B file(s), 33 media file(s), 1 artifact file(s) and 0 other file(s)
wandb: Find logs at: ./wandb/run-20230627_025941-eyk0iqdw/logs
