/usr/share/lmod/lmod/init/sh: line 20: /usr/share/lmod/lmod/libexec//clearMT_cmd: No such file or directory
wandb: Currently logged in as: tha-santacruz (msc-nicola). Use `wandb login --relogin` to force relogin
wandb: Tracking run with wandb version 0.15.4
wandb: Run data is saved locally in /home/santacro/masters_thesis/all_runs/wandb/run-20230627_033056-g7xvhubn
wandb: Run `wandb offline` to turn off syncing.
wandb: Syncing run different-wave-232
wandb: ⭐️ View project at https://wandb.ai/msc-nicola/train_all_MLC
wandb: 🚀 View run at https://wandb.ai/msc-nicola/train_all_MLC/runs/g7xvhubn
Running job on GPU : Tesla V100-PCIE-32GB
Namespace(BATCH_SIZE=128, CHECKPOINTS_PATH='/scratch/izar/santacro/checkpoints/', DATASET_PATH='/scratch/izar/santacro/final_data/', DEVICE='cuda:0', EMBEDDING='agnostic', EPOCH_NUM=300, FRACTION=40, HIDDEN_SIZE=8192, JOB_ID=232, LEARNING_RATE=1e-05, LEVEL='L2', LOAD_CHECKPOINT='no', MERGE_METHOD='fusion', MIN_LEARNING_RATE=1e-06, NUM_WORKERS=8, RANDOM_STATE=5, RUN_MODE='train', SAVE_CHECKPOINTS='yes', SPLITTING='species', TARGET_BASE='set', WANDB_ENTITY='msc-nicola', WANDB_LOGS='yes', WANDB_PROJECT='all_MLC')
Number of train samples : 9066
Number of val samples : 929
Number of test samples : 9397
  0%|          | 0/300 [00:00<?, ?it/s]train/val metrics at epoch 1 | loss : 1.32/1.09 | micro_F1 : 0.09/0.08:   0%|          | 0/300 [00:04<?, ?it/s]train/val metrics at epoch 1 | loss : 1.32/1.09 | micro_F1 : 0.09/0.08:   0%|          | 1/300 [00:04<21:47,  4.37s/it]train/val metrics at epoch 2 | loss : 1.26/1.07 | micro_F1 : 0.11/0.10:   0%|          | 1/300 [00:07<21:47,  4.37s/it]train/val metrics at epoch 2 | loss : 1.26/1.07 | micro_F1 : 0.11/0.10:   1%|          | 2/300 [00:08<20:06,  4.05s/it]train/val metrics at epoch 3 | loss : 1.21/1.06 | micro_F1 : 0.13/0.10:   1%|          | 2/300 [00:11<20:06,  4.05s/it]train/val metrics at epoch 3 | loss : 1.21/1.06 | micro_F1 : 0.13/0.10:   1%|          | 3/300 [00:11<18:46,  3.79s/it]train/val metrics at epoch 4 | loss : 1.15/1.02 | micro_F1 : 0.14/0.12:   1%|          | 3/300 [00:14<18:46,  3.79s/it]train/val metrics at epoch 4 | loss : 1.15/1.02 | micro_F1 : 0.14/0.12:   1%|▏         | 4/300 [00:14<17:41,  3.59s/it]train/val metrics at epoch 5 | loss : 1.10/0.98 | micro_F1 : 0.15/0.12:   1%|▏         | 4/300 [00:18<17:41,  3.59s/it]train/val metrics at epoch 5 | loss : 1.10/0.98 | micro_F1 : 0.15/0.12:   2%|▏         | 5/300 [00:18<17:44,  3.61s/it]train/val metrics at epoch 6 | loss : 1.05/0.97 | micro_F1 : 0.17/0.13:   2%|▏         | 5/300 [00:21<17:44,  3.61s/it]train/val metrics at epoch 6 | loss : 1.05/0.97 | micro_F1 : 0.17/0.13:   2%|▏         | 6/300 [00:22<17:22,  3.55s/it]train/val metrics at epoch 7 | loss : 1.00/0.95 | micro_F1 : 0.18/0.14:   2%|▏         | 6/300 [00:25<17:22,  3.55s/it]train/val metrics at epoch 7 | loss : 1.00/0.95 | micro_F1 : 0.18/0.14:   2%|▏         | 7/300 [00:25<16:54,  3.46s/it]train/val metrics at epoch 8 | loss : 0.96/0.95 | micro_F1 : 0.19/0.15:   2%|▏         | 7/300 [00:28<16:54,  3.46s/it]train/val metrics at epoch 8 | loss : 0.96/0.95 | micro_F1 : 0.19/0.15:   3%|▎         | 8/300 [00:29<17:32,  3.60s/it]train/val metrics at epoch 9 | loss : 0.92/0.90 | micro_F1 : 0.20/0.17:   3%|▎         | 8/300 [00:32<17:32,  3.60s/it]train/val metrics at epoch 9 | loss : 0.92/0.90 | micro_F1 : 0.20/0.17:   3%|▎         | 9/300 [00:32<17:04,  3.52s/it]train/val metrics at epoch 10 | loss : 0.88/0.89 | micro_F1 : 0.21/0.17:   3%|▎         | 9/300 [00:35<17:04,  3.52s/it]train/val metrics at epoch 10 | loss : 0.88/0.89 | micro_F1 : 0.21/0.17:   3%|▎         | 10/300 [00:35<16:37,  3.44s/it]train/val metrics at epoch 11 | loss : 0.84/0.89 | micro_F1 : 0.22/0.18:   3%|▎         | 10/300 [00:39<16:37,  3.44s/it]train/val metrics at epoch 11 | loss : 0.84/0.89 | micro_F1 : 0.22/0.18:   4%|▎         | 11/300 [00:39<16:45,  3.48s/it]train/val metrics at epoch 12 | loss : 0.81/0.88 | micro_F1 : 0.24/0.18:   4%|▎         | 11/300 [00:42<16:45,  3.48s/it]train/val metrics at epoch 12 | loss : 0.81/0.88 | micro_F1 : 0.24/0.18:   4%|▍         | 12/300 [00:42<16:49,  3.51s/it]train/val metrics at epoch 13 | loss : 0.78/0.91 | micro_F1 : 0.24/0.19:   4%|▍         | 12/300 [00:46<16:49,  3.51s/it]train/val metrics at epoch 13 | loss : 0.78/0.91 | micro_F1 : 0.24/0.19:   4%|▍         | 13/300 [00:46<16:35,  3.47s/it]train/val metrics at epoch 14 | loss : 0.75/0.89 | micro_F1 : 0.25/0.19:   4%|▍         | 13/300 [00:49<16:35,  3.47s/it]train/val metrics at epoch 14 | loss : 0.75/0.89 | micro_F1 : 0.25/0.19:   5%|▍         | 14/300 [00:49<16:44,  3.51s/it]train/val metrics at epoch 15 | loss : 0.72/0.87 | micro_F1 : 0.26/0.20:   5%|▍         | 14/300 [00:52<16:44,  3.51s/it]train/val metrics at epoch 15 | loss : 0.72/0.87 | micro_F1 : 0.26/0.20:   5%|▌         | 15/300 [00:53<16:17,  3.43s/it]train/val metrics at epoch 16 | loss : 0.69/0.89 | micro_F1 : 0.27/0.20:   5%|▌         | 15/300 [00:56<16:17,  3.43s/it]train/val metrics at epoch 16 | loss : 0.69/0.89 | micro_F1 : 0.27/0.20:   5%|▌         | 16/300 [00:56<16:01,  3.39s/it]train/val metrics at epoch 17 | loss : 0.67/0.87 | micro_F1 : 0.27/0.20:   5%|▌         | 16/300 [00:59<16:01,  3.39s/it]train/val metrics at epoch 17 | loss : 0.67/0.87 | micro_F1 : 0.27/0.20:   6%|▌         | 17/300 [01:00<16:13,  3.44s/it]train/val metrics at epoch 18 | loss : 0.66/0.88 | micro_F1 : 0.28/0.20:   6%|▌         | 17/300 [01:03<16:13,  3.44s/it]train/val metrics at epoch 18 | loss : 0.66/0.88 | micro_F1 : 0.28/0.20:   6%|▌         | 18/300 [01:03<15:57,  3.40s/it]train/val metrics at epoch 19 | loss : 0.65/0.92 | micro_F1 : 0.28/0.20:   6%|▌         | 18/300 [01:06<15:57,  3.40s/it]train/val metrics at epoch 19 | loss : 0.65/0.92 | micro_F1 : 0.28/0.20:   6%|▋         | 19/300 [01:06<15:47,  3.37s/it]train/val metrics at epoch 20 | loss : 0.64/0.87 | micro_F1 : 0.29/0.21:   6%|▋         | 19/300 [01:09<15:47,  3.37s/it]train/val metrics at epoch 20 | loss : 0.64/0.87 | micro_F1 : 0.29/0.21:   7%|▋         | 20/300 [01:10<15:58,  3.42s/it]train/val metrics at epoch 21 | loss : 0.63/0.95 | micro_F1 : 0.29/0.20:   7%|▋         | 20/300 [01:13<15:58,  3.42s/it]train/val metrics at epoch 21 | loss : 0.63/0.95 | micro_F1 : 0.29/0.20:   7%|▋         | 21/300 [01:13<15:40,  3.37s/it]train/val metrics at epoch 22 | loss : 0.62/0.89 | micro_F1 : 0.29/0.21:   7%|▋         | 21/300 [01:16<15:40,  3.37s/it]train/val metrics at epoch 22 | loss : 0.62/0.89 | micro_F1 : 0.29/0.21:   7%|▋         | 22/300 [01:16<15:39,  3.38s/it]train/val metrics at epoch 23 | loss : 0.62/0.90 | micro_F1 : 0.29/0.21:   7%|▋         | 22/300 [01:20<15:39,  3.38s/it]train/val metrics at epoch 23 | loss : 0.62/0.90 | micro_F1 : 0.29/0.21:   8%|▊         | 23/300 [01:20<15:57,  3.46s/it]train/val metrics at epoch 24 | loss : 0.61/0.95 | micro_F1 : 0.30/0.21:   8%|▊         | 23/300 [01:23<15:57,  3.46s/it]train/val metrics at epoch 24 | loss : 0.61/0.95 | micro_F1 : 0.30/0.21:   8%|▊         | 24/300 [01:23<15:43,  3.42s/it]train/val metrics at epoch 25 | loss : 0.61/0.92 | micro_F1 : 0.30/0.21:   8%|▊         | 24/300 [01:26<15:43,  3.42s/it]train/val metrics at epoch 25 | loss : 0.61/0.92 | micro_F1 : 0.30/0.21:   8%|▊         | 24/300 [01:27<16:47,  3.65s/it]
wandb: Waiting for W&B process to finish... (success).
wandb: 
wandb: Run history:
wandb:          epoch ▁
wandb:  learning rate ▁
wandb:           time ▁
wandb:     train loss ▁
wandb: train macro F1 ▁
wandb: train micro F1 ▁
wandb:       val loss ▁
wandb:   val macro F1 ▁
wandb:   val micro F1 ▁
wandb: 
wandb: Run summary:
wandb:          epoch 25
wandb:  learning rate 0.0
wandb:           time 89.13738
wandb:     train loss 0.60831
wandb: train macro F1 0.23374
wandb: train micro F1 0.30158
wandb:       val loss 0.92195
wandb:   val macro F1 0.12185
wandb:   val micro F1 0.20909
wandb: 
wandb: 🚀 View run different-wave-232 at: https://wandb.ai/msc-nicola/train_all_MLC/runs/g7xvhubn
wandb: Synced 5 W&B file(s), 1 media file(s), 1 artifact file(s) and 0 other file(s)
wandb: Find logs at: ./wandb/run-20230627_033056-g7xvhubn/logs
wandb: Currently logged in as: tha-santacruz (msc-nicola). Use `wandb login --relogin` to force relogin
wandb: Tracking run with wandb version 0.15.4
wandb: Run data is saved locally in /home/santacro/masters_thesis/all_runs/wandb/run-20230627_033256-yhqime1c
wandb: Run `wandb offline` to turn off syncing.
wandb: Syncing run astral-snowflake-234
wandb: ⭐️ View project at https://wandb.ai/msc-nicola/test_all_MLC
wandb: 🚀 View run at https://wandb.ai/msc-nicola/test_all_MLC/runs/yhqime1c
Running job on GPU : Tesla V100-PCIE-32GB
Namespace(BATCH_SIZE=128, CHECKPOINTS_PATH='/scratch/izar/santacro/checkpoints/', DATASET_PATH='/scratch/izar/santacro/final_data/', DEVICE='cuda:0', EMBEDDING='agnostic', EPOCH_NUM=300, FRACTION=40, HIDDEN_SIZE=8192, JOB_ID=232, LEARNING_RATE=1e-05, LEVEL='L2', LOAD_CHECKPOINT='yes', MERGE_METHOD='fusion', MIN_LEARNING_RATE=1e-06, NUM_WORKERS=8, RANDOM_STATE=5, RUN_MODE='test', SAVE_CHECKPOINTS='yes', SPLITTING='species', TARGET_BASE='set', WANDB_ENTITY='msc-nicola', WANDB_LOGS='yes', WANDB_PROJECT='all_MLC')
Number of train samples : 9066
Number of val samples : 929
Number of test samples : 9397
Loaded model state dict from file /scratch/izar/santacro/checkpoints//5_agnostic_embedding_L2_level_fusion_merging_species_splitting_8192.pth
wandb: Waiting for W&B process to finish... (success).
wandb: - 0.032 MB of 0.655 MB uploaded (0.000 MB deduped)wandb: \ 0.655 MB of 0.665 MB uploaded (0.000 MB deduped)wandb: | 0.665 MB of 0.665 MB uploaded (0.000 MB deduped)wandb: / 0.665 MB of 0.665 MB uploaded (0.000 MB deduped)wandb: 
wandb: Run history:
wandb:     test loss ▁
wandb: test macro F1 ▁
wandb:  test macro H ▁
wandb: test micro F1 ▁
wandb: 
wandb: Run summary:
wandb:     test loss 1.42666
wandb: test macro F1 0.13769
wandb:  test macro H 3.78972
wandb: test micro F1 0.17786
wandb: 
wandb: 🚀 View run astral-snowflake-234 at: https://wandb.ai/msc-nicola/test_all_MLC/runs/yhqime1c
wandb: Synced 4 W&B file(s), 33 media file(s), 1 artifact file(s) and 0 other file(s)
wandb: Find logs at: ./wandb/run-20230627_033256-yhqime1c/logs
